Document,Section Header,Section Text,Start Page,End Page
"CAI International, Inc._20210804_DEFM14A_19444962_4270736.Pdf",Employee Benefits.,"Employee Benefits.
(a) Section 4.10(a) of the Company Disclosure Schedule sets forth a list of all material Company Benefit Plans
(other than employment agreements, offer letters, individual consulting agreements and similar contracts, in
each case, with any Service Provider who is not a Key Employee and that may be terminated by the Company
A-20TABLE OF CONTENTS
or a Company Subsidiary upon less than 35 days advance notice and that do not provide for severance or
termination benefits in excess of statutory requirements), and specifies whether such Company Benefit Plan is a
U.S. Company Benefit Plan or an International Company Benefit Plan. For purposes of this Agreement,
“Company Benefit Plan” means each (i) “employee benefit plan” (as defined in Section 3(3) of ERISA, whether
or not subject to ERISA), (ii) compensation, employment, consulting, severance, termination protection, change
in control, transaction bonus, retention or similar plan, agreement, arrangement, program or policy or (iii) other
plan, agreement, arrangement, program or policy providing for profit sharing, pension, bonus, deferred
compensation, incentive compensation, option, equity or equity-based compensation, salary continuation,
severance or termination pay, hospitalization, medical, dental, vision, prescription, life insurance, accident,
disability or sick leave, cafeteria, fringe benefits, vacation benefits, relocation or expatriate benefits, employee
assistance program, supplemental unemployment benefits or post-employment or retirement benefits, in each
case, whether written or unwritten, and in each case (y) that is sponsored, maintained, contributed to or required
to be contributed to by the Company or any Company Subsidiary (or to which the Company or any Company
Subsidiary is a party) for the benefit of any Service Providers (or their beneficiaries or eligible dependents) or (z)
with respect to which the Company or any Company Subsidiary has, or could reasonably be expected to have,
any direct or indirect liability (including contingent liability); provided, that in no event shall a Company Benefit
Plan include any plan, program or arrangement sponsored, maintained, administered or operated by a
Governmental Authority or required to be contributed to by the Company or any Company Subsidiary pursuant
to applicable Law.
(b) With respect to each Company Benefit Plan identified in Section 4.10(a) of the Company Disclosure
Schedule, copies of the following have been made available to Parent (to the extent applicable to such Company
Benefit Plan): (i) the current plan document and all amendments thereto; (ii) the current trust agreement,
insurance contract or annuity contract serving as a funding vehicle for such Company Benefit Plan; (iii) the
most recent summary plan description, and any summaries of material modifications related thereto, distributed
to participants in such Company Benefit Plan; (iv) the most recently filed Form 5500 (and all schedules thereto);
(v) if such Company Benefit Plan is intended to be qualified under Section 401(a) of the Code, the most recent
determination, opinion or advisory letter received from the United States Internal Revenue Service; (vi) all
material, non-routine documents and correspondence relating to such Company Benefit Plan received from or
provided to any Governmental Authority within the last two years; and (vii) all current employee handbooks,
manuals and policies.
(c) Except as would not be reasonably expected to have a Company Material Adverse Effect: (i) each Company
Benefit Plan has been established, maintained and administered in accordance with its terms and in compliance
with applicable Law (including ERISA and the Code); (ii) each Company Benefit Plan intended to be qualified
under Section 401(a) of the Code is the subject of a favorable determination letter from the United States Internal
Revenue Service or utilizes a prototype or volume submitter plan document that is the subject of a favorable
opinion or advisory letter issued by the United States Internal Revenue Service to the sponsor of such
prototype or volume submitter plan, and, to the Knowledge of the Company, nothing has occurred since the
most recent such determination, opinion or advisory letter that would reasonably be expected to result in any
such letter being revoked (and, to the Knowledge of the Company, any trust relating to such Company Benefit
Plan is exempt from Tax under Section 501(a) of the Code and has been so exempt since its creation); (iii) none of
the Company, any Company Subsidiary or, to the Knowledge of the Company, any other Person has (A)
engaged in a nonexempt “prohibited transaction” (within the meaning of Section 406 of ERISA or Section 4975
of the Code) with respect to any Company Benefit Plan that is subject to such provisions, or (B) breached any
fiduciary duty imposed upon it by ERISA with respect to any Company Benefit Plan that is subject to ERISA;
and (iv) there are no pending or, to the Knowledge of the Company, threatened lawsuits or claims, or, to the
Knowledge of the Company, any reasonable basis therefor, against or otherwise involving any Company Benefit
Plan (other than routine claims for benefits, appeals of such claims and domestic relations order proceedings).
(d) During the last six (6) years, none of the Company, any Company Subsidiary or any of their respective
ERISA Affiliates has sponsored, maintained, contributed to, or been required to contribute to, nor does the
Company or any Company Subsidiary have or is reasonably expected to have any direct or indirect liability
(including contingent liability) under, (i) any “multiemployer plan” (as defined in Section 3(37) of ERISA),
A-21
TABLE OF CONTENTS
(ii) a “multiple employer welfare arrangement” (as defined in Section 3(40) of ERISA), (iii) an “employee pension
benefit plan” (as defined in Section 3(2) of ERISA) that is subject to Section 412 of the Code, Section 302 of
ERISA or Title IV of ERISA, or (iv) a “multiple employer plan” (as defined in Section 4063 or ERISA or Section
413(c) of the Code).
(e) Except as would not be reasonably expected to have, individually or in the aggregate, a Company Material
Adverse Effect, neither the Company nor any Company Subsidiary has any current or projected liability for, and
no Company Benefit Plan provides or promises, any post-employment or post-retirement welfare benefits to
former employees of the Company or its ERISA Affiliates (or their respective beneficiaries or dependents)
beyond their retirement or other separation from service, other than pursuant to Section 4980B of the Code or
any other applicable Law (and, except as set forth on Section 4.10(e) of the Company Disclosure Schedule, with
the participant bearing the premium costs).
(f) There has been no amendment to, written interpretation of or announcement (whether or not written) by the
Company or any of the Company Subsidiaries relating to, or change in employee participation or coverage
under, any Company Benefit Plan that would increase materially the expense to the Company and the Company
Subsidiaries, taken as a whole, of maintaining such plan above the level of expense incurred in respect thereof
for the most recent fiscal year ended prior to the date hereof.
(g) Except as would not be reasonably expected to have a Company Material Adverse Effect, each
International Company Benefit Plan (i) has been maintained in compliance with its terms and applicable Law and
(ii) if intended to qualify for special tax treatment, meets all requirements for such treatment. Except as would not
be reasonably expected to have a Company Material Adverse Effect, the assets of each International Company
Benefit Plan that provides retirement, medical or life insurance benefits following retirement or other termination
of service or employment (x) are at least equal to the liabilities of such International Company Benefit Plan
(determined based on reasonable actuarial assumptions) or (y) if such International Company Benefit Plan if
unfunded, properly accrued in accordance with the accounting standards applicable to the Company Subsidiary
that sponsors, maintains or contributes to such International Company Benefit Plan. From and after the Closing
Date, Parent and its Affiliates will receive the full benefit of any funds, accruals and reserves under the
International Company Benefit Plans.
(h) Except as set forth in Section 4.10(h) of the Company Disclosure Schedule, as contemplated by the terms of
this Agreement or as required by applicable Law, the execution or delivery of this Agreement, all other
agreements and documents contemplated hereby to which the Company is a party, and the consummation of the
transactions contemplated hereby and thereby will not, either alone or in connection with any termination of
employment (whether voluntary, involuntary, with or without good reason, or with or without cause, as a result
of disability, death, retirement, or otherwise) or any other event (i) result in any severance or payment or benefit
becoming due or payable, or required to be provided, to any current or former Service Provider under a
Company Benefit Plan, (ii) trigger or accelerate the time of payment or vesting or increase the amount or value of
any benefit or compensation otherwise payable or required to be provided to any such Service Provider under a
Company Benefit Plan, (iii) accelerate the timing of any funding obligation (through a grantor trust or otherwise)
under any Company Benefit Plan, (iv) result in the forgiveness of indebtedness for the benefit of any such
Service Provider under a Company Benefit Plan, (v) limit or restrict the right of the Company or any Company
Subsidiary or, after the Closing, Parent or its any of its Affiliates, to merge, amend or terminate any Company
Benefit Plan or (vi) result in the payment of any amount that could, individually or in combination with any other
such payment, constitute an “excess parachute payment” as defined in Section 280G(b)(1) of the Code. The
Company has made available prior to the date hereof to Parent complete and correct copies of any Section 280G
calculations prepared (whether or not final) with respect to any disqualified individual in connection with the
transactions contemplated by this Agreement. No Company Benefit Plan provides for any Tax gross-up
payment, indemnification or reimbursement from the Company or any of its Affiliates as a result of the
imposition of additional Taxes under Sections 409A or 4999 of the Code.",155,157
"CAI International, Inc._20210804_DEFM14A_19444962_4270736.Pdf",Litigation,"Litigation. There is no demand, suit, claim, action or other proceeding (whether at law or in equity)
before any Governmental Authority pending or, to the Knowledge of the Company, threatened in writing against the
Company or any Company Subsidiary or any of their respective properties (including any properties owned,
operated, leased or licensed by the Company or any Company Subsidiary) or assets that has had or would
reasonably be expected to result in a Company Material Adverse Effect, nor is there any Order outstanding against
A-22TABLE OF CONTENTS
or, to the Knowledge of the Company, investigation by any Governmental Authority involving the Company or any
Company Subsidiary or any of their respective properties (including any properties owned, operated, leased or
licensed by the Company or any Company Subsidiary) or assets that has had or would reasonably be expected to
result in a Company Material Adverse Effect.
Section 4.12 Compliance with Applicable Laws. Except as would not reasonably be expected to have a Company",157,158
"CAI International, Inc._20210804_DEFM14A_19444962_4270736.Pdf",Compliance with Applicable Laws,"Compliance with Applicable Laws. Except as would not reasonably be expected to have a Company
Material Adverse Effect, since January 1, 2019, the business of the Company and the Company Subsidiaries has been
conducted in accordance with all Laws applicable thereto. The Company and the Company Subsidiaries have been
granted all Permits necessary under applicable Laws for each of the Company and the Company Subsidiaries to own,
lease and operate its properties and to carry on its business as currently conducted, except for Permits the absence of
which would not be reasonably expected to have a Company Material Adverse Effect (collectively, the “Company
Permits”). Section 4.12 of the Company Disclosure Schedule contains a true and complete list of all Company Permits
together with the name of the Governmental Authority that issued such Company Permit. All such Company Permits
are valid and in full force and effect and each of the Company and the Company Subsidiaries is in compliance with
any requirements imposed by any Governmental Authority as a condition to obtaining or maintaining any applicable
Company Permit, in each case except where the failure to be so compliant would not be reasonably expected to have a
Company Material Adverse Effect.
Section 4.13 Environmental Matters.",158,158
"CAI International, Inc._20210804_DEFM14A_19444962_4270736.Pdf",Environmental Matters.,"Environmental Matters.
(a) (i) The Company and the Company Subsidiaries are and for the five (5) years prior to the date hereof, have
been in compliance with all Environmental Laws; (ii) the Company and the Company Subsidiaries possess, have
renewed and maintained, and are and for the five (5) years prior to the date hereof, have been in compliance with
all Environmental Permits, and no action or proceeding is pending or, to the Knowledge of the Company,
threatened to revoke, modify, suspend or terminate any Environmental Permit; (iii) none of the Company or any
Company Subsidiary has received any written notice, demand, request for information, citation, summons or
complaint from any Person related to any Environmental Law, Environmental Permit or Hazardous Substance
during the five (5) years prior to the date hereof or otherwise in any case that remains unresolved as of the date
hereof; (iv) no order, judgment, decree or injunction has been issued or is otherwise in effect, no penalty has
been assessed and no investigation, action, claim, suit, proceeding or review is pending, or to the Knowledge of
the Company, threatened, with respect to the Company or any of the Company Subsidiaries (or any of their
respective predecessor entities) that relates to any Environmental Law, Environmental Permit or Hazardous
Substance; and (v) there has been no Release of a Hazardous Substance (A) by the Company or, to the
Knowledge of the Company, by any other Person, at, on, under, to, in or from any property or facility now or
previously owned, leased or operated by the Company or any of the Company Subsidiaries (or any of their
respective predecessor entities), and or (B) to the Knowledge of the Company, at, on, under, to, in or from any
property or facility to which any Hazardous Substance has been transported for disposal, recycling or treatment
by or on behalf of the Company or any of the Company Subsidiaries, except with respect to any of the foregoing
under (i), (ii), (iii), (iv), or (v) as would not reasonably be expected to have a Company Material Adverse Effect.
(b) The Company and the Company Subsidiaries do not own, lease or operate any real properties or facilities
in New Jersey or Connecticut.
(c) Except as has been delivered to Parent at least five days prior to the date hereof, there is no material
environmental investigation, study, audit, test, review, analysis or other report in the possession or reasonable
control of the Company or any of the Company Subsidiaries that relates to the compliance with or potential
liability under any Environmental Law or Environmental Permit by the Company or any of the Company
Subsidiaries (or any of their respective predecessor entities) or any property or facility now or previously
owned, leased or operated by the Company or any of the Company Subsidiaries (or any of their respective
predecessor entities).",158,158
"CAI International, Inc._20210804_DEFM14A_19444962_4270736.Pdf",Contracts.,"Contracts.
(a) Each of the Company’s “material contracts” pursuant to Item 601(b)(10) of Regulation S-K promulgated by
the SEC (a “Filed Company Contract”) has been filed with the SEC.
(b) Section 4.14(b) of the Company Disclosure Schedule sets forth, as of the date of this Agreement, a true and
complete list of the following types of Contracts to which the Company or any Company Subsidiary is a party as
of the date of this Agreement:
A-23TABLE OF CONTENTS
(i) each Contract that contains a non-compete or client, customer or employee non-solicit requirement or
any other provision which materially restricts the ability of the Company or any Company Subsidiaries to
compete in any material line of business or geographic area;
(ii) each Contract (excluding purchase orders for containers, roll trailers, swap bodies, gensets or similar
equipment purchased for leasing to customers in the ordinary course) relating to any Indebtedness (A) of
the Company or any of the Company Subsidiaries or (B) in respect of any asset backed securitization or
similar transactions (whether or not off-balance sheet) where the Company or any of the Company
Subsidiaries is an originator, in each case with a principal amount in excess of $5,000,000 (whether
outstanding or that may be incurred by its terms), other than any such Contract solely between or among
the Company and the wholly owned Company Subsidiaries or between or among wholly owned Company
Subsidiaries;
(iii) each partnership, joint venture, strategic alliance, collaboration or similar Contract relating to the
formation, creation, operation, management or control of any partnership or joint venture or to the
ownership of any equity interest in any entity or business enterprise;
(iv) other than any Filed Company Contracts filed as exhibits (including exhibits incorporated by
reference to any Filed Company SEC Documents), each material Contract between the Company or any of
its Subsidiaries, on the one hand, and, on the other hand, any (A) present executive officer or director of
either the Company or any of the Company Subsidiaries, (B) record or beneficial owner of more than 5% of
the shares of Common Stock outstanding as of the date hereof or (C) to the Knowledge of the Company,
any Affiliate of any such executive officer, director or record or beneficial owner of more than 5% of the
shares of Common Stock outstanding as of the date hereof (other than the Company or any of the
Company Subsidiaries);
(v) each Contract relating to the disposition or acquisition by the Company or any of the Company
Subsidiaries of any business or any amount of assets for an amount (in any transaction or series of related
transactions) in excess of $1,000,000 (excluding purchase orders for the purchase of shipping containers);
(vi) other than Contracts for ordinary repair and maintenance, each Contract providing for the
development or construction of, or additions or expansions to, any real property, under which the
Company or any of the Company Subsidiaries has, or expects to incur, an obligation in excess of $1,000,000
in the aggregate;
(vii) each Contract with a customer (x) under which the customer leases equipment with a book value
greater than $1,000,000 as of the Balance Sheet Date or (y) pursuant to which any customer made payments
to the Company and the Company Subsidiaries, taken as a whole, in excess of $1,000,000 during the 12-
month period ended December 31, 2020;
(viii) each Contract with a vendor (other than as provided in (ix) below and other than Contracts related
to the Company Benefit Plans) under which the Company or any Company Subsidiaries paid an aggregate
amount greater than $1,000,000 to purchase goods or services during the year ended December 31, 2020;
(ix) each purchase order under which the Company or any Company Subsidiaries paid an aggregate
amount greater than $10,000,000 to purchase shipping containers during the year ended December 31, 2020;
(x) each Contract involving any settlement, conciliation or similar agreement that is with any
Governmental Authority, (A) pursuant to which the Company or any Company Subsidiary is obligated after
the date of this Agreement to make any material payment to a Governmental Authority, (B) that would
otherwise limit the operation of the Company or any Company Subsidiary (or Parent or any of its other
Affiliates) in any material respect after the Closing or (C) that imposes any injunctive or other equitable
relief;
(xi) any Contract that contains exclusivity or “most favored nation” provisions, or grants any right of first
refusal or right of first offer to any Person;
(xii) any Contract that requires the Company or any Company Subsidiary to purchase or sell a minimum
quantity of goods or amount of services;
A-24
TABLE OF CONTENTS
(xiii) any stockholders, investors rights, registration rights or similar agreement or arrangement;
(xiv) each Contract that provides for retention, change in control or transaction bonuses or benefits;
(xv) each Contract that is a collective bargaining agreement; and
(xvi) each Contract pursuant to which the Company or any of the Company Subsidiaries (A) obtains any
license or covenant not to be sued under any Intellectual Property Rights (other than any non-exclusive
licenses for off-the-shelf software that is commercially available); or (B) grants any license or covenant not
to be sued under, any Intellectual Property Rights (other than non-exclusive licenses granted to customers
in the ordinary course of business).
(c) Except for matters which have not had and would not reasonably be expected to have a Company Material
Adverse Effect, (i) each Material Contract is a valid, binding and legally enforceable obligation of the Company
or one of the Company Subsidiaries, as the case may be, and, to the Knowledge of the Company, of the other
parties thereto, except, in each case, as enforcement may be limited by bankruptcy, insolvency, reorganization or
similar Laws affecting creditors’ rights generally and by general principles of equity, (ii) each such Material
Contract is in full force and effect and (iii) none of the Company or any of the Company Subsidiaries is (with or
without notice or lapse of time, or both) in breach or default under any such Material Contract and, to the
Knowledge of the Company, no other party to any such Material Contract is (with or without notice or lapse of
time, or both) in breach or default thereunder, except, in the case of clauses (i) or (ii), with respect to any Material
Contract which expires by its terms (as in effect as of the date hereof) or which is terminated in accordance with
the terms thereof by the Company in the ordinary course of business consistent with past practice. Except as
would not be reasonably expected to have a Company Material Adverse Effect, the Company has not received
any notice in writing from any Person that such Person intends to terminate, or not renew, any Material
Contract. For purposes of this Section 4.14(c), the reference to “Material Contract” shall include any Contract to
which the Company or any of its Subsidiaries becomes party to after the date hereof and prior to the Closing
that would constitute a Material Contract if entered into prior to the date hereof.",158,160
