Document,Section Header,Section Text,Start Page,End Page
"CAI International, Inc._20210804_DEFM14A_19444962_4270736.Pdf",Recommendation of the Board and Reasons for the Merger,"Recommendation of the Board and Reasons for the Merger
Recommendation of the Board",66,66
"CAI International, Inc._20210804_DEFM14A_19444962_4270736.Pdf",Recommendation of the Board,"Recommendation of the Board
The Board has unanimously: (i) determined that the Merger Agreement and the transactions contemplated thereby,
including the Merger, are advisable, fair to and in the best interests of the Company and its stockholders on the terms
and conditions set forth in the Merger Agreement; (ii) adopted resolutions approving and declaring the advisability
of the Merger Agreement and the transactions contemplated thereby, including the Merger, on the terms and
conditions set forth in the Merger Agreement; and (iii) adopted resolutions recommending that the stockholders of
the Company entitled to vote adopt the Merger Agreement and directing that the Merger Agreement and the
transactions contemplated thereby, including the Merger, be submitted to the stockholders of the Company entitled
to vote for adoption.
The Board unanimously recommends that you vote: (1) “FOR” the Merger Proposal; (2) “FOR” the Adjournment
Proposal; and (3) “FOR” the Compensation Proposal.
Reasons for the Merger",66,66
"CAI International, Inc._20210804_DEFM14A_19444962_4270736.Pdf",Reasons for the Merger,"Reasons for the Merger
In evaluating the Merger Agreement, the Merger and the transactions contemplated thereby, including the Merger,
the Board consulted with management, and representatives of the Company’s financial advisor and legal
54TABLE OF CONTENTS
advisors. In unanimously recommending that common stockholders vote in favor of the Merger Proposal, the Board
considered a number of factors, including the following (which factors are not necessarily presented in order of
relative importance):
•
the Board’s understanding of the Company’s business, assets, financial condition, liquidity position and
results of operations, its competitive position and historical and prospective performance, and the nature of
the industry in which the Company competes.
•
the fact that the all-cash Merger Consideration will provide certainty of value and liquidity to stockholders,
while eliminating the effect of long-term business and execution risks to stockholders.
•
the relationship of the $56.00 per share Common Merger Consideration to the trading price of our common
stock on the NYSE, including that the Common Merger Consideration constituted a significant premium of
approximately (i) 47% over the closing share price of our common stock on the NYSE on June 17, 2021, the
last trading day prior to the date the Merger Agreement was publicly announced, and (ii) 31% over the
volume weighted average price of our common stock on the NYSE during the 60 trading days up to, and
including, June 17, 2021.
•
the relationship of the $56.00 per share Common Merger Consideration to the discounted cash flow net
present value of the Company.
•
the relationship of the $56.00 per share Common Merger Consideration to public comparable data of price
to book value.
•
the current and historical market prices of our common stock, including the market performance of our
common stock relative to those of other participants in our industry and the general market.
•
the evaluation of multiple strategic alternatives and the solicitation of bids from multiple strategic and
financial sponsor parties, as discussed under “-Background of the Merger.”
•
the Board’s belief that, if any third parties were interested in exploring a transaction with the Company,
such potential acquirers were contacted by Centerview or would have been motivated to approach the
Company.
•
the advantages of entering into the Merger Agreement in comparison with the risks of remaining an
independent public company, including, but not limited to, the risks and uncertainties with respect to:
○
achieving the Company’s growth plans in light of the current and foreseeable market conditions,
including the risks and uncertainties in the U.S. and global economy generally and the Company’s
industry specifically, and risks related to the current stage of the economic cycle and macroeconomic
challenges that could result in a market downturn in the coming months or years, in each case,
especially in light of COVID-19;
○
competing with the Company’s competitors in a market with increasing container leasing industry
consolidation and container shipping company consolidation as well as the risk that potential
opportunities could diminish in the future as the Company’s competitors continue to pursue
acquisitions;
○
competing for lessees in a market with likely further container shipping company consolidation;
○
the increasing importance of operational scale and financial resources in maintaining efficiency and
remaining competitive in the container leasing industry;
○
achieving projected fiscal year 2021 performance and long-term financial projections as a standalone
company is unlikely to result in value to the Company’s stockholders that would exceed, on a present-
value basis, the value of the applicable Merger Consideration; and
○
the various additional risks and uncertainties that are set forth in Part I, Item 1A. of our Annual Report
on Form 10-K for the year ended December 31, 2020, filed with the SEC on March 1, 2021, which is
incorporated by reference herein, as updated by our subsequent filings with the SEC.
•
our ability to service, pay down or pay off our high debt levels while maintaining our operations and
funding current and future capital expenditures.
55
TABLE OF CONTENTS
•
its belief, based on discussions and negotiations with Parent, that $56.00 per share was the highest price
Parent would be willing to pay.
•
the fact that the Company sought out and engaged other potential purchasers and the Board determined
that there were no other potential purchasers that would be reasonably likely to engage in a transaction in
the near term at a price per share equal to or greater than the price being offered by Parent and on other
acceptable terms.
•
the extensive arm’s length negotiations with Parent.
•
the likelihood that the Merger will be consummated, based on, among other things:
○
the Board’s evaluation of the conditions to the Merger;
○
that the condition to closing related to the accuracy of the Company’s representations and warranties,
is generally subject to a Company Material Adverse Effect qualification, as described under “The
Merger Agreement-Representations and Warranties;”
○
the absence of a financing condition;
○
Parent’s representation that it has and will have sufficient financial resources to pay the aggregate
Merger Consideration and consummate the Merger;
○
the Board’s and management’s assessment, after discussion with representatives of Centerview, that
Parent has the financial capability to complete the Merger;
○
that the Company will be permitted to continue to pay quarterly dividends on its Preferred Stock and
on its common stock (not to exceed $0.30 per share of common stock per quarter), solely to the extent
made on payment dates that correspond to record dates on June 28, 2021, September 27, 2021, and
December 27, 2021, between signing and Closing under the Merger Agreement;
○
the relative likelihood of obtaining required regulatory approvals;
○
the relative likelihood of completing the Migration, including the obtainment of the Migration Contract
Consents, within the required timeframe such that the Closing can take place prior to the End Date;
○
that the End Date under the Merger Agreement is expected to allow for sufficient time to complete the
Merger, obtain required regulatory approvals and complete the Migration;
○
the Company’s ability to elect tax treatment that will be neutral to it in the event the Migration is
completed, but the Merger is not completed; and
○
the remedies available under the Merger Agreement to the Company in the event of a breach by
Parent, including, but not limited to, our ability, under certain circumstances pursuant to the Merger
Agreement, to seek specific performance to prevent breaches of the Merger Agreement, and to
enforce specifically the terms of the Merger Agreement, as described under “The Merger Agreement-
Specific Performance.”
•
the terms of the Merger Agreement and the related agreements, including, but not limited to:
○
the Company’s ability to consider and respond to, under certain circumstances specified in the Merger
Agreement, an Alternative Proposal;
○
the Board’s right, after complying with the terms of the Merger Agreement, to terminate the Merger
Agreement in order to enter into an agreement with respect to a Superior Proposal upon payment of
the Termination Fee and the Merger Agreement Expenses, as described under “The Merger
Agreement-Alternative Proposals; Change in Recommendation; Intervening Events” and “The
Merger Agreement-Termination Fees and Treatment of Expenses;” and
○
Parent’s obligation to pay the Parent Termination Fee and Merger Agreement Expenses under certain
circumstances. For more information, see “The Merger Agreement-Termination Fees and Treatment of
Expenses.”
56
TABLE OF CONTENTS
•
that the Merger would be subject to the approval of the Company’s stockholders holding at least a majority
of the outstanding shares of common stock to vote at the Special Meeting as of the Record Date, and the
stockholders would be free to reject the Merger.
•
the availability of appraisal rights and payment of fair value under Delaware law to registered holders of
shares, and beneficial owners of shares whose nominees follow the required statutory procedures, who
timely file a written objection to the Merger Agreement, do not vote in favor of the Merger Proposal (to the
extent they are entitled to do so) and comply with all of the required procedures under Delaware law, which
provides those eligible stockholders with an opportunity to have a Delaware court determine the fair value
of their shares, which may be more than, less than, or the same as the amount such stockholders would
have received under the Merger Agreement.
•
the Board’s view that the Merger Agreement was the product of arm’s-length negotiations and contained
overall reasonable terms and conditions.
•
the timing of the Merger and the risk that if the Board did not accept Parent’s offer at the time it was made,
the Board might not have had another opportunity to do so.
•
the opinion of Centerview rendered to the Board on June 17, 2021, which was subsequently confirmed by
delivery of a written opinion dated such date that, as of such date and based upon and subject to the
assumptions made, procedures followed, matters considered, and qualifications and limitations upon the
review undertaken by Centerview in preparing its opinion, the Common Merger Consideration to be paid to
the holders of shares of common stock (other than as specified in such opinion) pursuant to the Merger
Agreement was fair, from a financial point of view, to such holders, as more fully described below under the
caption “-Opinion of Centerview Partners LLC.”
The Board also considered a number of uncertainties and risks concerning the Merger that generally weighed against
entering into the Merger Agreement, including the following (which factors are not necessarily presented in order of
relative importance):
•
the fact that the announcement and pendency of the Merger, or the risks and costs to the Company if the
Merger does not close, could result in the diversion of management and employee attention (including
efforts and consequences relating to the Migration), and potentially have a negative effect on the
Company’s business and relationships with customers, suppliers and vendors.
•
the effect of a public announcement of the Company entering into the Merger Agreement on the
Company’s operations, stock price and employees and its ability to attract and retain key management and
personnel while the Merger is pending.
•
the fact that stockholders will not participate in any future earnings or growth of the Company and will not
benefit from any appreciation in value of the Company, including any appreciation in value that could be
realized as a result of improvements to our operations.
•
the unlikely possibility that Parent will be unable to pay the aggregate Merger Consideration on the
Closing Date.
•
the requirement that the Company pay Parent the Termination Fee of $35.0 million and the Merger
Agreement Expenses in an amount not to exceed $5.0 million, upon certain termination circumstances. For
more information, see “The Merger Agreement-Termination Fees and Treatment of Expenses.”
•
the possibility that the amounts that may be payable by the Company upon the termination of the Merger
Agreement, as set forth in “The Merger Agreement-Termination Fees and Treatment of Expenses,” could
discourage other potential acquirers from making a competing bid to acquire the Company.
•
the restrictions on the Company’s conduct of business prior to the consummation of the Merger, including
the requirement that it conduct its business in the ordinary course, subject to specific limitations, which
may delay or prevent the Company from undertaking business opportunities that may arise before the
completion of the Merger and that, absent the Merger Agreement, the Company might have pursued.
•
the fact that an all-cash transaction would be taxable to the Company’s stockholders that are U.S. Holders
for U.S. federal income tax purposes.
57
TABLE OF CONTENTS
•
the fact that under the terms of the Merger Agreement, the Company is unable to solicit other acquisition
proposals.
•
the fact that, by reason of the factors described immediately above, the likelihood of any third party
submitting to the Board or the Company (on an unsolicited basis pursuant to the “window shop”
exceptions to the Company’s no-solicitation covenant in the Merger Agreement) an Alternative Proposal
constituting or reasonably likely to lead to a Superior Proposal is materially diminished.
•
the risk that, while the Merger is expected to be completed, there can be no assurance that all conditions to
the parties’ obligations to complete the Merger, including the Migration, will be satisfied, and as a result, it
is possible that the Merger may not be completed even if approved by the Company’s common
stockholders.
•
the risk that the Company is required to complete the Migration as a condition to Parent and Merger Sub’s
obligation to close the Merger, and that it is possible that after completing the Migration, Parent could
default on its obligation to close the Merger.
•
the fact that notwithstanding any Company Adverse Recommendation Change, unless the Merger
Agreement has been earlier terminated in accordance with the terms thereof, the Merger Agreement will,
subject to certain exceptions, be submitted to the Company’s common stockholders at the Special Meeting.
For more information, see “The Merger Agreement-Alternative Proposals; Change in Recommendation;
Intervening Events.”
•
the significant costs involved in connection with entering into the Merger Agreement and completing the
Merger and the substantial time and effort of the Company’s management required to complete the Merger,
which may disrupt the Company’s business operations.
•
the fact that the Company’s business, operations, financial results and liquidity position could suffer in the
event that the Merger is not consummated.
•
the risk that the Merger might not be completed and the effect of the resulting public announcement of
termination of the Merger Agreement on the trading price of the Company’s common stock on the NYSE.
•
the risk of litigation arising in respect of the Merger Agreement, the Merger, or the other transactions
contemplated by the Merger Agreement.
•
the fact that the completion of the Merger will require antitrust and other regulatory approvals in the United
States and certain other countries, including the requirement of Parent and the Company to use their
reasonable best efforts to defend through litigation on the merits any claim asserted in any court with
respect to the transactions contemplated by the Merger Agreement by the FTC, the DOJ or any other
applicable governmental authority.
•
the risk that the Migration may not be completed within the required timeframe such that the Closing can
take place prior to the End Date.
•
the fact that if the Merger is not consummated and the Migration has been completed, the Company will
have to take certain steps in order to modify its legal and tax structure in order to avoid possible negative
tax consequences.
•
the risk that the Company may not obtain the Migration Contract Consents such that the Closing can take
place prior to the End Date.
•
the fact that there can be no assurance that a challenge to the Merger on antitrust grounds will not be made
or, if such a challenge is made, that it would not be successful.
In addition, the Board was aware of and considered the interests that certain of our directors and executive officers
may have in the Merger that differ from, or are in addition to, those of our other stockholders. For more information,
please see “The Merger-Interests of the Company’s Directors and Executive Officers in the Merger.”
The foregoing discussion is not meant to be an exhaustive list, but summarizes many, if not all, of the material factors
considered by the Board in its consideration of the Merger. After considering these and other factors, the Board
concluded that the potential benefits of the Merger outweighed the uncertainties and the risks. In view of the variety
of factors considered by the Board and the complexity of these factors, the Board did not find it practicable
58
TABLE OF CONTENTS
to, and did not, quantify or otherwise assign relative weights to the foregoing factors in reaching its determination
and recommendations. Moreover, each member of the Board applied such member’s own personal business judgment
to the process and may have assigned different weights to different factors. The Board unanimously adopted the
Merger Agreement and approved the other transactions contemplated by thereby, including the Merger, and
unanimously recommends that common stockholders approve the Merger Proposal based upon the totality of the
information presented to, and considered by, the Board.
Opinion of Centerview Partners LLC",66,71
