Document,Section Header,Section Text,Start Page,End Page
recommend (or propose publicly to adopt, endorse, approve or recommend) any Acquisition Proposal, (3) fail to issue a press release publicly reaffirming
the Company Board Recommendation in response to an Acquisition Proposal that has been publicly disclosed within ten Business Days after a request
by Parent to do so or, if earlier, at least two Business Days prior to the Company Stockholder Meeting (which request may be made once per Acquisition
Proposal), (4) fail to include the Company Board Recommendation in the Proxy Statement, or (5) submit to the Company’s stockholders for approval or
adoption any Acquisition Proposal (any of the foregoing in clauses (1) through (5), an “Adverse Recommendation Change”; provided, that, for the
avoidance of doubt, (y) any determination or action by the Board of Directors of the Company to the extent expressly permitted by Section 6.03(d),
Section 6.03(e) or Section 6.03(h) shall not be, and shall not be deemed to be, in and of itself a breach or violation of this Section 6.03(c) and shall not,
unless an Adverse Recommendation Change has occurred, give Parent a right to terminate this Agreement pursuant to Section 10.01(c)(i), and (z) none of
the following, in and of itself, shall constitute an Adverse Recommendation Change: (aa) the determination by the Board of Directors of the Company that
an Acquisition Proposal constitutes a Superior Proposal, (bb) a public press release as to the determination described in prior clause (aa) so long as such
press release also states that no Adverse Recommendation Change or termination of this Agreement shall occur until the expiration of the 3 Business
Day (or, if applicable, the 2 Business Day) period contemplated by Section 6.03(h) has occurred and promptly after the end of such 3 Business Day (or, if
applicable, such 2 Business Day) period the Company shall either (I) issue a public press release stating that the prior Acquisition Proposal no longer
constitutes a Superior Proposal or (II) make an Adverse Recommendation Change or terminate this Agreement pursuant to Section 10.01(d)(i) or (cc) the
delivery by the Company to Parent, Merger Subsidiary or their respective Representatives of the notice required by Section 6.03(e), (g) or (h)).
(d) Notwithstanding Section 6.03(c) or anything else in this Section 6.03, at any time prior to obtaining the Company Stockholder Approval, if the
Company or any of the Representatives of the Company or its Subsidiaries has received a written Acquisition Proposal from any Third Party (including
any Excluded Party, at any time) that did not result from a breach in any material respect of Section 6.03, (I) the Company and such Representatives may
contact the Third Party making such Acquisition Proposal to clarify the terms and conditions thereof or inform such Person of the existence of the
provisions in this Section 6.03 or (II) if the Board of Directors of the Company determines in good faith, after consultation with its financial advisor and
outside legal counsel, such Acquisition Proposal constitutes or would reasonably be expected to lead to or result in, a Superior Proposal, then the
Company and its Subsidiaries, directly or indirectly through its and their Representatives, may (i) engage or participate in negotiations or discussions
with such Third Party and its Representatives and (ii) furnish to such Third Party or its Representatives non-public information relating to the Company
or any of its Subsidiaries subject to the entry into, and solely pursuant to, an Acceptable Confidentiality Agreement; provided, that, prior to or
substantially concurrently (and in any event within one day) with the time such information is made available to such Third Party, the Company shall
make available to Parent any material non-public information relating to the Company or its Subsidiaries that is made available to such Third Party and
that was not previously made available to Parent. Notwithstanding anything in this Agreement to the contrary and notwithstanding the occurrence of the
No Shop Period Start Date, from and after the No Shop Period Start Date, the Company may continue to engage in the activities described in Section
6.03(a) with respect to any Excluded Party, including with respect to any amended proposal or offer submitted by an Excluded Party following the No
Shop Period Start Date, and the restrictions in Section 6.03(c) and Section 6.03(d) will not apply with respect thereto, until the Cut-Off Date.
(e) Notwithstanding anything contained in this Agreement to the contrary, at any time prior to obtaining the Company Stockholder Approval, in
response to an Intervening Event, if the Board of Directors of the Company determines in good faith, after consultation with outside legal counsel, that
the failure to make an Adverse
 
48
Table of Contents
Recommendation Change as a result of such Intervening Event would reasonably be expected to be inconsistent with its fiduciary duties under Delaware
Law, the Board of Directors of the Company may make an Adverse Recommendation Change (but shall not be permitted to take the actions referred to in
clause (2), (3) or (5) of the definition thereof which relate solely to Acquisition Proposals); provided, that, the Board of Directors of the Company shall not
make any such Adverse Recommendation Change unless the Company has (i) provided to Parent at least three (3) Business Days’ prior written notice
that it intends to take such action and specifying in reasonable detail the facts of the underlying Intervening Event, (ii) during such three (3) Business
Day period, if requested by Parent, engaged in good faith negotiations with Parent to amend this Agreement in such a manner that obviates the need for
such Adverse Recommendation Change (provided that it is understood and agreed that the Board of Directors of the Company’s determination and
providing such notice solely to Parent in each case as permitted by the express terms of this Agreement shall not in itself constitute an Adverse
Recommendation Change or a basis to terminate this Agreement) and (iii) shall have considered in good faith any revisions to this Agreement or any
other Transaction Document irrevocably proposed in writing by Parent.
(f) In addition, nothing contained herein shall prevent the Board of Directors of the Company from (i) complying with its disclosure obligations
required under Applicable Law or applicable rules of the NASDAQ, including taking and disclosing to its stockholders a position contemplated by Rule
14e-2(a), Rule 14d-9(g) or Item 1012(a) of Regulation M-A promulgated under the 1934 Act with regard to an Acquisition Proposal (or any similar
communication to stockholders) or (ii) making any “stop-look-and-listen” communication to stockholders of the Company pursuant to Rule 14d-9(f) or
(iii) making any disclosure to the stockholders of the Company if the Board of Directors of the Company determines in good faith, after consultation with
outside legal counsel, that the failure to make such disclosure would reasonably be expected to be inconsistent with its fiduciary duties under Delaware
Law (provided that this clause (iii) shall not permit the Company to take any action which would constitute an Adverse Recommendation Change, which
instead shall be governed by Section 6.03(c), Section 6.03(e) or Section 6.03(h)); provided, that with respect to the foregoing clauses (i) through (iii), any
such action taken or statement made, in and of itself, shall not be deemed to be an Adverse Recommendation Change if the Board of Directors of the
Company reaffirms the Company Board Recommendation in such statement or in connection with such action.
(g) At any time after the No Shop Period Start Date and until the earlier of the valid termination of this Agreement and the Effective Time, the
Company shall notify Parent promptly (but in no event later than one day after (i) the end of the No Shop Period Start Date with respect to previously
received Acquisition Proposals or (ii) receipt by the Company of any Acquisition Proposal, as applicable), which notice shall identify the Third Party
making, and the material terms and conditions of, any such Acquisition Proposal and the Company shall reasonably promptly inform Parent (but in no
event later than one day) after any material developments, discussions or negotiations regarding any Acquisition Proposal and shall provide to Parent
promptly (but in no event later than one day after receipt thereof) copies of all proposed transaction agreements or proposal letters or other material
written agreements sent or provided to the Company or any of its Subsidiaries that describe any material terms or conditions of any Acquisition Proposal.
(h) Further, nothing contained in Section 6.03(c) or elsewhere in this Agreement shall prevent the Board of Directors of the Company from, prior to
receipt of the Company Stockholder Approval, making an Adverse Recommendation Change in response to an Acquisition Proposal or terminating this
Agreement pursuant to Section 10.01(d)(i), if (i) the Board of Directors of the Company has determined in good faith, after consultation with its financial
advisor and outside legal counsel, that such Acquisition Proposal constitutes a Superior Proposal and the failure to make an Adverse Recommendation
Change or terminate this Agreement, as applicable, would reasonably be expected to be inconsistent with its fiduciary duties pursuant to Delaware Law,
(ii) the Company, its Subsidiaries and their respective Representatives shall have complied in all material respects with Sections 6.03(b) and (c) with
respect to such Acquisition Proposal, (iii) the Company promptly notifies Parent in writing, at least three (3) Business Days before taking such action, of
the determination of the Board of Directors of the Company that such Acquisition Proposal constitutes a Superior Proposal and of its intention to take
such action, attaching the most current version of the proposed agreement under which such
 
49
Table of Contents
Superior Proposal is proposed to be consummated and the identity of the Third Party making such Superior Proposal and (iv) the Board of Directors of
the Company (A) shall have, during such notice period, engaged in good faith negotiations with Parent, to the extent Parent requests to negotiate, to
amend this Agreement in such a manner that obviates the need for such Adverse Recommendation Change or valid termination of this Agreement
pursuant to Section 10.01(d)(i), (B) shall have considered in good faith any revisions to this Agreement or any other Transaction Document irrevocably
proposed in writing by Parent and (C) shall have determined that such Acquisition Proposal would continue to constitute a Superior Proposal and the
failure to make an Adverse Change Recommendation or terminate this Agreement, as applicable, would reasonably be expected to be inconsistent with its
fiduciary duties pursuant to Delaware Law, if such revisions were to be given effect (provided that it is understood and agreed that the determination of
the Board of Directors of the Company in accordance with clause (i) and providing the notice required by clause (iii) shall not, in and of itself, constitute
an Adverse Recommendation Change or a basis to terminate this Agreement) (it being understood and agreed that any material amendment to the
financial terms or other material terms of such Superior Proposal shall require a new written notification from the Company but only a new two (2)
Business Day period under this Section 6.03(h)). As used in this Agreement:
(i) “Acceptable Confidentiality Agreement” means a confidentiality agreement to which the Company is a party that contains provisions that
are no less favorable in the aggregate to the Company than those contained in the Confidentiality Agreement; provided that such confidentiality
agreement may contain a less restrictive or no standstill restriction.
(ii) “Intervening Event” means a material fact, event, change, development or set of circumstances that was not known or reasonably
foreseeable to the Board of Directors of the Company as of the date hereof (or if known to the Board of Directors of the Company as of the date
hereof, the consequences of which were not known or reasonably foreseeable to the Board of Directors of the Company as of the date hereof) and
becomes known to the Board of Directors of the Company prior to the time the Company Stockholder Approval is obtained; provided, however
that none of the following will constitute, or be considered in determining whether there has been, an Intervening Event: (A) the receipt, existence
of or terms of an Acquisition Proposal or any matter relating thereto or consequence thereof and (B) changes in the market price or trading volume
of the shares of Company Stock or the fact that the Company meets or exceeds internal or published projections, budgets, forecasts or estimates of
revenues, earnings or other financial results for any period (provided, however, that the underlying causes of such change or fact shall not be
excluded by this clause (B)).
(iii) “Superior Proposal” means a bona fide, written Acquisition Proposal for at least a majority of the outstanding shares of Company Stock
(assuming the prior exchange of all OpCo Units for shares of Company Stock) or at least a majority of the consolidated assets of the Company and
its Subsidiaries that was not solicited in breach in any material respect of the terms of Sections 6.03(b) or (c) and that the Board of Directors of the
Company determines in good faith, after consultation with its financial advisor and outside legal counsel, and taking into account all relevant terms
and conditions of such Acquisition Proposal (including legal, regulatory, financing and closing conditions), is more favorable from a financial
perspective to the holders of the Company Stock than the Merger (taking into account any irrevocable written proposal by Parent to amend the
terms of this Agreement pursuant to Section 6.03(h)).
(iv) “Excluded Party” means any Third Party (i) from whom the Company or any of its Representatives receives an Acquisition Proposal after
the date of this Agreement and prior to the No Shop Period Start Date; and (ii) whose Acquisition Proposal the Board of Directors of the Company
determines in good faith (after consultation with its outside legal counsel and financial advisors) is, or would reasonably be expected to lead to or
result in, a Superior Proposal. Any Third Party shall cease to be an Excluded Party under this Agreement with respect to a particular Acquisition
Proposal upon such time as such Acquisition Proposal made by such Third Party is withdrawn, cancelled, terminated or otherwise expires or the
Board of Directors of the Company determines in good faith (after consultation with its outside legal counsel and financial advisors) is no longer,
and no longer would reasonably be expected to lead to or result in, a Superior Proposal.
 
50
Table of Contents
Section 6.04. Access to Information. From the date hereof until the earlier of the valid termination of this Agreement or the Effective Time and
subject to Applicable Law (including COVID-19 Measures) and the Confidentiality Agreement, the Company shall during normal business hours and
upon reasonable prior written notice, and solely for purposes of furthering the Merger or integration planning relating thereto, (a) give to Parent, its
counsel, financial advisors, auditors and other authorized Representatives reasonable access during normal business hours to its officers, key
employees, offices, properties, Contracts and books and records and (b) instruct its employees, counsel, financial advisors, auditors and other authorized
Representatives to reasonably cooperate with Parent in such access; provided, however, that (i) the foregoing shall not require the Company or any of its
Subsidiaries to permit access to (A) any information that would give rise to the waiver of any attorney-client privilege or other privilege or trade secret
protection or the work product doctrine (provided that the Company shall use commercially reasonable efforts to make any such information available in
such a way that would not reasonably be expected to jeopardize the attorney-client privilege or other privilege or trade secret protection or the work
product doctrine), (B) any information that in the good faith reasonable opinion of the Company would violate any Applicable Law, (C) such documents
or information that are reasonably pertinent to any pending litigation, suit, action or proceeding between the Company and its Affiliates, on the one hand,
and Parent and its Affiliates, on the other hand, (D) subject to, and without limiting, the requirements of Section 6.03 and Section 8.01(a), any information
related to the negotiation and execution of this Agreement or to transactions potentially competing with or alternative to the transactions contemplated
by this Agreement or proposals from other third parties relating to any competing or alternative transactions (including Acquisition Proposals) and the
actions of the Company’s Board of Directors (or any committee thereof) with respect to any of the foregoing, whether prior to or after execution of this
Agreement, or (E) subject to, and without limiting, the requirements of Section 6.03, any information related to an Adverse Recommendation Change or
the actions of the Company’s Board of Directors (or any committee thereof) with respect thereto, (ii) any such investigation shall be conducted under
reasonable supervision of appropriate personnel of the Company and in such a manner as not to unreasonably interfere with the normal business or
operations of the Company or its Subsidiaries or otherwise result in any unreasonable burden with respect to the prompt and timely discharge by
employees of the Company or its Subsidiaries of their normal duties and Parent shall use its commercially reasonable efforts to minimize to the extent
reasonably practicable any disruption to the businesses of the Company that may result from any such requests for access and (iii) any access to the
properties of the Company and its Subsidiaries will be subject to the Company’s reasonable security measures, policies and insurance requirements and
will not include the right to sample soil, sediment, groundwater, surface water, air or building materials or conduct any other environmental sampling or
analysis. For the avoidance of doubt, nothing in this Section 6.04 will be construed to require the Company, any of its Subsidiaries or any of their
respective Representatives to prepare any reports, analyses, appraisals, opinions or other information that create an unreasonable burden on the
employees of the Company or its Subsidiaries. In addition, the Company, its Subsidiaries and Parent shall cooperate in good faith to arrange for, as
reasonably agreed by Parent and the Company, communication strategies for, and joint meetings of the Company and Parent with, the Company’s
customers, suppliers, and employees; provided, that (y) such meetings do not unreasonably interfere with the operations of the Company and its
Subsidiaries and (z) a Representative of the Company must be present at all times during such meetings. The Company may, as it deems advisable and
necessary, reasonably designate commercially sensitive material provided to the other as “Outside Counsel Only Material” or with similar restrictions,
and such materials and the information contained therein shall be given only to the outside counsel of the recipient, or otherwise as the restriction
indicates, and be subject to any additional confidentiality or joint defense agreement between the parties. Notwithstanding anything to the contrary
herein, with the consent of Parent (which shall not be unreasonably withheld), the Company may satisfy its obligations set forth above by electronic
means if physical access is not reasonably feasible or would not be permitted under Applicable Law (including as a result of COVID-19 Measures).
Section 6.05. Financing Cooperation.
(a) The Company shall use reasonable best efforts to, and shall cause its Subsidiaries to use reasonable best efforts to, and shall use reasonable
best efforts to cause its and their respective Representatives to, provide such
 
51
Table of Contents
cooperation as is reasonably requested by Parent, is necessary in connection with the Debt/Preferred Equity Financing and customarily provided for
borrowers or issuers in financings of the type contemplated by the Debt Commitment Letter (or permanent take-out financing incurred in lieu of the bridge
facility contemplated under the Debt Commitment Letter) or the Preferred Equity Commitment Letter, as applicable (it being understood and agreed that
such information shall not include any information customarily delivered by an investment bank, agent bank or lender in the preparation of such bank
information memoranda or similar documents), including reasonable best efforts in (i) furnishing to Parent (A) the Required Information and (B) such
other pertinent and customary financial and other information regarding the Company and its Subsidiaries as may be reasonably requested by Parent;
provided that, in the case of this clause (B), the Company shall not be obligated to furnish any Excluded Information; (ii) prior to and during the
Marketing Period, upon reasonable prior written notice and at reasonable times, cause members of management (with appropriate seniority) to participate
in a reasonable number of meetings (in each case, which may be held via conference call), drafting sessions, rating agency presentations and due
diligence presentations (including accounting due diligence sessions), presentations, “road shows” and sessions with prospective financing sources
and investors, in each case at times and locations to be mutually agreed; (iii) in advance of and prior to the closing of the Marketing Period, providing
reasonable assistance to Parent and its Debt/Preferred Equity Financing Sources in the preparation of customary bank information memoranda, lender or
investor presentations, rating agency presentations, offering memoranda or private placement memoranda and other customary marketing materials in
connection with the Debt/Preferred Equity Financing (collectively, the “Marketing Material”) including delivering upon request of Parent prior to the
commencement of the marketing of the Debt/Preferred Equity Financing (A) customary executed authorization letter to accompany customary Marketing
Materials regarding the material accuracy of information contained in such Marketing Materials with respect to the Company and its Subsidiaries and,
with respect to any “public version” of such Marketing Materials, the lack of material non-public information with respect to the Company and its
Subsidiaries therein and (B) customary executed management representation letters and CFO certificates with respect to the financial information included
in the Marketing Materials for bond offerings; (iv) causing the Company’s auditors to provide customary comfort letters (including “negative assurance”
comfort) with respect to historical financial information of the Company included in any offering memoranda with respect to any non-convertible high
yield debt securities included in the Debt Financing issued on a “Rule 144A for life” basis; (v) assisting in the preparations for the pledging of collateral,
including possessory collateral (it being understood that no such pledging of collateral will be effective until at or after the Closing), facilitating the
obtaining of guarantees, and assistance in the preparation of any definitive financing documents and other matters ancillary to the Debt Financing as
may be reasonably requested by Parent, including by providing information for the completion of any schedules or certificates thereto; (vi) at least four
(4) Business Days prior to the Closing Date, to the extent requested by Parent on behalf of the Debt/Preferred Equity Financing Sources no later than ten
(10) Business Days prior to the Closing Date, timely furnishing such documentation and other information required by Governmental Authorities under
applicable “know your customer” and anti-money laundering rules and regulations, including the U.S.A. Patriot Act of 2001, including beneficial
ownership certificates; (vii) providing reasonable assistance to facilitate at (but not prior to) the Closing the release of liens on assets of the Company
(other than Permitted Liens) that are collateral for the Debt Financing, (viii) assisting Parent in obtaining any corporate or facility ratings from any ratings
agencies contemplated by the Debt/Preferred Equity Financing and (ix) executing and delivering prepayment notices within the time periods contemplated
by the Credit Agreement. The Company hereby consents to the use of the logos of the Company and its Subsidiaries in connection with such
Debt/Preferred Equity Financing; provided that such logos shall be used solely in a manner that is not intended or reasonably likely to harm, disparage or
otherwise adversely affect the Company and/or its Subsidiaries or their reputation or goodwill.
(b) Notwithstanding the foregoing, neither the Company nor any of its Affiliates shall be required to take or permit the taking of any action
pursuant to this Section 6.05: (A) that would require the Company or any of its Affiliates or any other Persons who are directors or officers of such
entities to pass resolutions or consents to approve or authorize the execution of the Debt/Preferred Equity Financing that are not conditioned upon the
