Document,Section Header,Section Text,Start Page,End Page
contemplated by the Merger Agreement or the Debt/Preferred Equity Financing, (iii) McAfee’s right to receive payment of the Parent Termination Fee
pursuant to the Merger Agreement shall constitute the sole and exclusive remedy of the Company Related Parties against the Parent Related Parties or
any of the Debt/Preferred Equity Financing Sources for all losses and damages suffered as a result of the failure of the transactions contemplated by the
Merger Agreement to be consummated or for a breach or failure to perform thereunder or otherwise, and (iv) upon payment of the Parent Termination Fee,
none of the Parent Related Parties or any of the Debt/Preferred Equity Financing Sources shall have any further liability or obligation to any of the
Company Related Parties relating to, arising out of or in connection with the Merger Agreement, the Debt/Preferred Equity Financing or the transactions
contemplated by the Merger Agreement or the Debt/Preferred Equity Financing; provided, that (a) nothing in this paragraph will impair McAfee’s or
Parent’s right to seek specific performance prior to the valid termination of the Merger Agreement solely to the extent permitted under Section 11.13
thereof, (b) the parties to the Confidentiality Agreement will remain obligated for, and McAfee will be entitled to remedies with respect to, breaches of the
Confidentiality Agreement, (c) nothing in this paragraph will limit or otherwise affect the Sponsors’ obligations under the Fee Funding Agreements or
prior to the valid termination of the Merger Agreement, the Equity Commitment Letters, (d) following a termination of the Merger Agreement, Parent and
Merger Subsidiary will remain liable thereunder, and each Sponsor will remain liable under the applicable Fee Funding Agreement to which it is a party, for
the Parent Termination Fee, any Enforcement Expenses or certain reimbursement obligations of Parent that become due and payable until paid, and (e)
following a termination of the Merger Agreement, McAfee will remain liable thereunder for the Company Termination Fee and any Enforcement Expenses
that become due and payable until paid.
Amendment and Waiver",117,118
McAfee Corp._20220104_DEFM14A_19754815_4361365.Pdf,Amendment and Waiver,"Amendment and Waiver
The Merger Agreement may be amended or waived by the parties in writing and, in the case of an amendment, signed by each party to the Merger
Agreement, at any time prior to the adoption of the Merger Agreement by the McAfee Stockholders. However, after adoption of the Merger Agreement
by the McAfee Stockholders, no amendment or waiver that requires further approval by such McAfee Stockholders pursuant to the DGCL may be made
without such approval. Additionally, any amendment, supplement, waiver or other modification to certain provisions of the Merger Agreement in any
manner that is adverse to the interest of the Debt/Preferred Equity Financing Sources (or their affiliates or their and their affiliates’ current or future
officers, directors, employees, agents, representatives, stockholders, equityholders, controlling persons, limited partners, managers, members or partners
and their successors and assigns) will not be effective without the consent of the Debt/Preferred Equity Financing Sources party to the Debt Commitment
Letter or Preferred Equity Commitment Letter, as applicable.
Governing Law and Venue, Waiver of Jury Trial",118,118
McAfee Corp._20220104_DEFM14A_19754815_4361365.Pdf,"Governing Law and Venue, Waiver of Jury Trial","Governing Law and Venue, Waiver of Jury Trial
The parties agreed that the Merger Agreement will be governed by Delaware law, without regard to the conflicts of law rules of the State of
Delaware. Each party agreed to irrevocably submit to the exclusive jurisdiction of the Court of Chancery of the State of Delaware, the United States
District Court in Wilmington, Delaware and the Superior Court of the State of Delaware, New Castle County, for purposes of any suit, action or other
proceeding arising out of the Merger Agreement, the other agreements contemplated by the Merger Agreement, the transactions contemplated thereby
or the negotiation or performance of any of the foregoing. Each party agreed to commence any action, suit or proceeding relating to the Merger
Agreement either in the Court of Chancery for the State of Delaware, New Castle County and, if such suit, action or other proceeding may not be brought
in such court for jurisdictional reasons, in the United States District Court in Wilmington, Delaware, and, if such suit, action or other proceeding may not
be brought in such court for jurisdictional reasons, in the Superior Court of the State of Delaware, New Castle County. Each party further irrevocably
 
109Table of Contents
waived any right such party may have to a trial by jury with respect to any legal proceeding arising out of or relating to the Merger Agreement or the
transactions contemplated thereby.
The Voting Agreement",118,119
McAfee Corp._20220104_DEFM14A_19754815_4361365.Pdf,The Voting Agreement,"The Voting Agreement
The Supporting Stockholders, which collectively own 65,591,599 shares of Class A Common Stock and 227,349,460 shares of Class B Common
Stock representing approximately 35.86% of the total outstanding Class A Common Stock and 89.40% of the total outstanding Class B Common Stock,
respectively, or approximately 67.91% of the total voting power of the Company Stock as of December 14, 2021, have entered into the Voting Agreement
with Parent. Pursuant to the Voting Agreement, the Supporting Stockholders have agreed, among other things, to (i) vote in favor of the proposal to
approve and adopt the Merger Agreement and any related action reasonably required in furtherance thereof, and (ii) vote against (x) any action that
would reasonably be expected to prevent, materially delay or materially impair the consummation of the Merger or the other transactions contemplated by
the Merger Agreement, including any amendment of McAfee’s or any of its subsidiaries’ organizational documents that would reasonably be expected to
prevent, materially delay or materially impair the ability of Parent or Merger Subsidiary to complete the Merger, or that would or would reasonably be
expected to prevent, materially delay or materially impair the consummation of the Merger and (y) any Acquisition Proposal (other than the Merger
Agreement and the Merger), in each case so long as the Merger Agreement has not been terminated and the Board of Directors has not made an Adverse
Recommendation Change. The Voting Agreement shall terminate upon the earlier to occur of (a) the Effective Time and (b) the termination of the Merger
Agreement.
Subject to certain exceptions, the Supporting Stockholders may not transfer their shares of Company Stock other than to affiliates in the event that
certain conditions are met. This description is qualified in its entirety by reference to the copy of the Voting Agreement, which is attached as Annex B to
this proxy statement.",119,119
McAfee Corp._20220104_DEFM14A_19754815_4361365.Pdf,Amendment to Tax Receivable Agreement and OpCo LLC Agreement,"Amendment to Tax Receivable Agreement and OpCo LLC Agreement
The following summary describes certain relevant provisions of the TRA, the OpCo LLC Agreement and the material provisions of the Amendment.
The descriptions of the TRA, the OpCo LLC Agreement and the Amendment in this summary and elsewhere in this proxy statement are not complete and
are qualified in their entirety by reference to the TRA, the OpCo LLC Agreement and the Amendment, each of which is incorporated into this proxy
statement by reference. We encourage you to read the TRA, the OpCo LLC Agreement and the Amendment carefully and in their entirety because this
summary may not contain all the information about the TRA, the OpCo LLC Agreement and the Amendment that is important to you. The rights and
obligations of the parties are governed by the express terms of the TRA, the OpCo LLC Agreement and the Amendment and not by this summary or any
other information contained in this proxy statement. 
Concurrent with the initial public offering of shares of the Class A Common Stock and related reorganization transactions undertaken in connection
with the initial public offering of McAfee, McAfee entered into a tax receivable agreement with the TRA beneficiaries. McAfee acquired favorable tax
attributes as a result of the reorganization transactions. In addition, exchanges or redemptions of OpCo LLC units for cash or shares of Class A Common
Stock are expected to produce favorable tax attributes for McAfee. When McAfee acquires OpCo LLC units in connection with these exchanges or
redemptions, anticipated tax basis adjustments are likely to increase (for tax purposes) McAfee’s depreciation and amortization deductions, thereby
reducing the amount of income tax that McAfee would be required to pay in the future in the absence of this increased basis. This increased tax basis
may also decrease the gain (or increase the loss) on future dispositions of certain assets to the extent that the tax basis is allocated to those assets. Under
the terms of the TRA, absent a change of control of McAfee, McAfee would generally be required to pay to the TRA beneficiaries 85% of the benefits, if
any, that McAfee is deemed to realize (calculated using certain assumptions) as a result of (i) all or a portion of McAfee’s allocable share of existing tax
basis in the assets of OpCo LLC (and its subsidiaries) acquired in connection with the reorganization transactions undertaken in connection with
McAfee’s initial public offering, (ii) increases in McAfee’s allocable share of existing tax basis in the assets of OpCo LLC (and its subsidiaries) and tax
basis
 
110Table of Contents
adjustments in the assets of OpCo LLC (and its subsidiaries) as a result of sales or exchanges of OpCo LLC units after McAfee’s initial public offering,
(iii) certain tax attributes of the corporations McAfee acquired in connection with such reorganization transactions (including their allocable share of
existing tax basis in the assets of OpCo LLC (and its subsidiaries)), and (iv) certain other tax benefits related to entering into the TRA, including tax
benefits attributable to payments under the TRA. The increases in McAfee’s allocable share of existing tax basis in OpCo LLC assets and tax basis
adjustments generated over time may increase (for tax purposes) depreciation and amortization deductions available to members of OpCo LLC and,
therefore, may reduce the amount of tax that McAfee would otherwise be required to pay in the future in respect of taxable income and gain allocated to
McAfee with respect to OpCo LLC units.
In addition, the TRA provides that if certain mergers, asset sales, other forms of business combination or other changes of control with respect to
McAfee were to occur, then the TRA would terminate and McAfee’s obligations, or McAfee’s successor’s obligations, under the TRA would accelerate
and become due and payable. Absent the Amendment, the amount of such accelerated change of control payment obligations would have been
calculated as aggregate payment obligations under the TRA absent a change of control based on certain assumptions set forth in the TRA, including
(among others) the assumption that McAfee would have sufficient taxable income in each taxable year ending on or after the change of control to fully
utilize all potential future tax benefits that are subject to the TRA. The Merger, upon closing, constitutes a change of control under the TRA that would
cause the payment obligations to accelerate and become due and payable.
On November 5, 2021, in connection with the execution of the Merger Agreement, McAfee, OpCo LLC and certain of their respective affiliates
entered into the Amendment with certain other parties, in accordance with the terms of the TRA and the OpCo LLC Agreement. The Amendment (i)
amends the TRA and the OpCo LLC Agreement (as further described below) and (ii) provides for certain covenants regarding tax reporting and tax-related
actions after the closing of the Merger.
The Amendment provides for (i) the payment of amounts due under the TRA with respect to McAfee’s 2020 U.S. federal income tax year in
accordance with the terms of the TRA up to an aggregate amount of $2,000,000, which payments shall be paid no later than 10 business days prior to the
Closing Date, (ii) the suspension of all other payments under the TRA from and after November 5, 2021 and (iii) the amendment of the TRA by inserting a
new Section 7.19 into the TRA effective as of immediately prior to and contingent upon the occurrence of the Effective Time which will result in the TRA
(and all of McAfee’s payment obligations thereunder, including the obligation to make any of the foregoing suspended payments) terminating
immediately prior to the Effective Time. The Amendment also includes agreements among the parties thereto regarding the preparation of tax returns for
tax periods that end on, before or include the Closing Date and limits actions that may be taken by McAfee, OpCo LLC and certain of their controlled
affiliates after the closing of the Merger to the extent such actions may have an effect on items reflected on such tax returns.
The Amendment also (i) suspends all tax distributions under the OpCo LLC Agreement from and after November 5, 2021 for so long as the
Amendment is in effect, and (ii) provides that from and after the Effective Time, no person or entity shall have any obligation to make or pay tax
distributions under the OpCo LLC Agreement.
In the event the Merger Agreement is terminated in accordance with its terms, the Amendment shall become null and void ab initio and all
payments that were suspended under the TRA pursuant to the Amendment, and all tax distributions that were suspended under the OpCo LLC
Agreement pursuant to the Amendment, shall be made by McAfee and OpCo LLC as if the Amendment had never been executed.
The Amendment will result in (i) the suspension of certain payments under the TRA with respect to McAfee’s 2021 U.S. federal income tax year in
aggregate and (ii) contingent upon the occurrence of the Effective Time under the Merger Agreement, a permanent elimination of certain payments under
the TRA that
 
111
Table of Contents
would have otherwise been payable to the TRA beneficiaries under the TRA with respect to McAfee’s 2021 U.S. federal income tax year. The Amendment
will also eliminate any obligation of McAfee to make a payment under the TRA as a result of a change of control of McAfee, which would be substantial.
The Amendment also will result in (i) the suspension of certain tax distributions by OpCo LLC under the OpCo LLC Agreement with respect to McAfee’s
2021 and 2022 U.S. federal income tax years and (ii) contingent upon the occurrence of the Effective Time under the Merger Agreement, a permanent
elimination of an obligation to make such tax distributions under the OpCo LLC Agreement. Tax distributions under the OpCo LLC Agreement are
intended to be sufficient to cover OpCo LLC members’ respective U.S. federal, state and local income tax liability (as determined in accordance with the
OpCo LLC Agreement). Such tax liability relates to the net amount of taxable income and gain allocated to such members for the relevant taxable period
(or as a result of any capital shifts or guaranteed payments for the use of capital) with respect to OpCo LLC units held by such members. The suspension
and/or elimination of tax distributions under the Amendment will reduce the outflow of cash from OpCo LLC to members of the OpCo LLC each quarter
during the period that the Amendment is in effect.
For more information with respect to the Amendment, please see our other filings with the SEC, including the section in our 2021 Proxy Statement
captioned “Amendment to Tax Receivable Agreement and OpCo LLC Agreement” above and a copy of the Amendment which is included as Exhibit 99.2
to McAfee’s Current Report on Form 8-K, filed on November 8, 2021. A copy of the TRA is included as Exhibit 10.2 to McAfee’s Current Report on Form
8-K, filed on October 26, 2020, and a copy of the OpCo LLC Agreement is included as Exhibit 10.1 to McAfee’s Current Report on Form 8-K, filed on
October 26, 2020. This description is qualified in its entirety by reference to the copy of the Amendment, which is attached as Annex C to this proxy
statement.
The Board of Directors recommends that you vote “FOR” this proposal.
 
112
Table of Contents
PROPOSAL 2: THE MCAFEE COMPENSATION PROPOSAL",119,122
McAfee Corp._20220104_DEFM14A_19754815_4361365.Pdf,PROPOSAL 2: THE McAfee COMPENSATION PROPOSAL,"PROPOSAL 2: THE MCAFEE COMPENSATION PROPOSAL
Under Section 14A of the Exchange Act and the applicable SEC rules issued thereunder, McAfee is required to submit a proposal to McAfee
Stockholders to approve, on a non-binding advisory basis, the compensation that may be paid or become payable to McAfee’s named executive officers
that is based on or otherwise relates to the Merger Agreement and the transactions contemplated by the Merger Agreement. This compensation is
summarized in the section captioned “The Merger—Interests of Executive Officers and Directors of McAfee in the Merger.” The Board of Directors
encourages you to review carefully the named executive officer merger-related compensation information disclosed in this proxy statement. Accordingly,
McAfee is asking you to approve the following resolution:
“RESOLVED, that the McAfee Stockholders approve, on a non-binding advisory basis the compensation that will or may become payable to
McAfee’s named executive officers that is based on or otherwise relates to the Merger as disclosed pursuant to Item 402(t) of Regulation S-K in the
section captioned ‘The Merger—Interests of Executive Officers and Directors of McAfee in the Merger.’”
The vote on this Compensation Proposal is a vote separate and apart from the vote on the proposal to adopt the Merger Agreement. Accordingly,
you may vote to approve the proposal to adopt the Merger Agreement and vote not to approve this Compensation Proposal and vice versa. Because the
vote on the Compensation Proposal is advisory only, it will not be binding on McAfee. Accordingly, if the Merger Agreement is adopted and the Merger
is completed, the compensation will be payable, subject only to the conditions applicable thereto, regardless of the outcome of the vote on this
Compensation Proposal.
Vote Required and Board of Directors Recommendation",122,122
McAfee Corp._20220104_DEFM14A_19754815_4361365.Pdf,Vote Required and Board of Directors Recommendation,"Vote Required and Board of Directors Recommendation
Approval, on a non-binding advisory basis, of the Compensation Proposal requires the affirmative vote of the outstanding shares of Company
Stock representing a majority of the outstanding shares present at the Special Meeting in person or by proxy, provided a quorum is present. Assuming a
quorum is present, (i) a failure to vote in person or by proxy at the Special Meeting will have no effect on the outcome of the Compensation Proposal, (ii)
abstentions will be treated as votes cast and, therefore, will have the same effect as a vote against the Compensation Proposal and (iii) broker “non-
votes” (if any) will have no effect on the outcome of the Compensation Proposal. Shares of Company Stock represented by properly executed, timely
received and unrevoked proxies will be voted in accordance with the instructions indicated thereon. If a McAfee Stockholder returns a signed proxy card
without indicating voting preferences on such proxy card, the shares of Company Stock represented by that proxy will be counted as present for
purposes of determining the presence of a quorum for the Special Meeting and all of such shares will be voted as recommended by the Board of
Directors.
The Board of Directors recommends that you vote “FOR” this proposal.
 
113Table of Contents
PROPOSAL 3: ADJOURNMENT OF THE SPECIAL MEETING",122,123
McAfee Corp._20220104_DEFM14A_19754815_4361365.Pdf,PROPOSAL 3: ADJOURNMENT OF THE SPECIAL MEETING,"PROPOSAL 3: ADJOURNMENT OF THE SPECIAL MEETING
We are asking you to approve a proposal to adjourn the Special Meeting to a later date or dates if necessary or appropriate to solicit additional
proxies if there are insufficient votes to adopt the Merger Agreement at the time of the Special Meeting. If McAfee Stockholders approve the
adjournment proposal, we could adjourn the Special Meeting and any adjourned session of the Special Meeting and use the additional time to solicit
additional proxies, including soliciting proxies from McAfee Stockholders that have previously returned properly executed proxies voting against
adoption of the Merger Agreement. Among other things, approval of the adjournment proposal could mean that, even if we had received proxies
representing a sufficient number of votes against adoption of the Merger Agreement such that the proposal to adopt the Merger Agreement would be
defeated, we could adjourn the Special Meeting without a vote on the adoption of the Merger Agreement and seek to convince the holders of those
shares to change their votes to votes in favor of adoption of the Merger Agreement. Additionally, we may seek to adjourn the Special Meeting if a
quorum is not present or otherwise at the discretion of the chairman of the Special Meeting.
The Board of Directors recommends that you vote “FOR” this proposal.
 
114Table of Contents
SECURITY OWNERSHIP OF CERTAIN BENEFICIAL OWNERS AND MANAGEMENT",123,124
McAfee Corp._20220104_DEFM14A_19754815_4361365.Pdf,SECURITY OWNERSHIP OF CERTAIN BENEFICIAL OWNERS AND MANAGEMENT,"SECURITY OWNERSHIP OF CERTAIN BENEFICIAL OWNERS AND MANAGEMENT
The following table sets forth information, as of the December 25, 2021, regarding ownership of our common stock by:
 
 
•
 each person or group of affiliated persons known by us to be the beneficial owner of more than 5% of our outstanding common stock;
 
 
•
 each of our directors;
 
 
•
 each of our named executive officers (each, an “NEO”); and
 
 
•
 all directors and executive officers as a group.
The amounts for our NEOs and executive officers and directors as a group and our significant stockholders are as of the December 25, 2021 unless
otherwise indicated in a footnote below (and in that case are based upon SEC filings made on behalf of such owners). Beneficial ownership in this table is
determined in accordance with the rules of the SEC, and does not necessarily indicate beneficial ownership for any other purpose. Under these rules, the
number of shares of Company Stock deemed outstanding includes those shares issuable upon exercise of options held by the respective person or group
that may be exercised within 60 days after the December 25, 2021. For purposes of calculating each person’s or group’s percentage ownership, unvested
stock options exercisable within 60 days and all shares of restricted stock are included for that person or group, but not for any other person or group.
Percentage of beneficial ownership is based on the shares of common stock outstanding as of the December 25, 2021. Beneficial ownership representing
less than 1% is denoted with an asterisk (*).
Pursuant to the terms of the stockholders agreement entered into by the Company and certain of our stockholders in connection with our IPO (the
“Stockholders Agreement”), the TPG Funds (as defined below) have the right to appoint a majority of the directors serving on the Board. As a result, the
TPG Funds may be deemed to control the Company’s exercise of its option to settle exchanges of OpCo LLC Units into shares of Class A Common Stock
or cash with respect to any such exchange by the TPG Funds. As a result of this control, the TPG Funds beneficially own all shares of Class A common
stock underlying its OpCo LLC Units. Other than with respect to the TPG Funds, the beneficial ownership of Class A Common Stock in the table below
does not take into account the potential redemption and exchange of a stockholder’s OpCo LLC Units for Class A Common Stock and the corresponding
cancellation of an equivalent number of shares of Class B Common Stock. The TPG Funds’ beneficial ownership of Class A Common Stock in the table
below aggregates both its direct ownership of Class A Common Stock and the number of shares of Class A Common Stock into which its OpCo LLC Units
could be converted. If this were to actually occur, all of the TPG Funds’ Class B Common Stock would be cancelled and its beneficial ownership
percentage of the Class B Common Stock would be 0%.
 
 
 
Class A common stock
beneficially owned(1)
  
Class B common stock
beneficially owned(2)
 
Name of beneficial owner
 
Number
  
Percentage  
Number
  
Percentage 
5% Stockholders
 
 
 
 
Intel Americas, Inc.(3)
 
 
5,969,831  
 
3.1% 
 169,742,322  
 
67.0%
TPG Funds(4)
 
 117,501,906  
 
48.2% 
 57,607,138  
 
22.8%
Thoma Bravo Funds(5)
 
 16,611,135  
 
8.9% 
 24,075,115  
 
9.5%
Snowlake Investment Pte Ltd.(6)
 
 24,411,754  
 
13.1% 
 
—  
 
* 
Directors and Named Executive Officers
 
 
 
 
Peter Leav(7)
 
 
923,525  
 
*  
 
252,464  
 
* 
Venkat Bhamidipati(8)
 
 
456,999  
 
*  
 
37,444  
 
* 
Ashish Agarwal(9)
 
 
297,084  
 
*  
 
66,192  
 
* 
Gagandeep Singh
 
 
—  
 
*  
 
—  
 
* 
Sohaib Abbasi
 
 
78,947  
 
*  
 
—  
 
* 
Mary Cranston
 
 
59,356  
 
*  
 
—  
 
* 
Tim Millikin(10)
 
 
—  
 
*  
 
—  
 
* 
 
115Table of Contents
 
 
Class A common stock
beneficially owned(1)
  
Class B common stock
beneficially owned(2)
 
Name of beneficial owner
 
Number   
Percentage   
Number   
Percentage  
Kathy Willard
 
