Document,Section Header,Section Text,Start Page,End Page
contemplates. In view of the wide variety and complexity of factors considered by the Meridian board of directors in connection with its evaluation of the
merger, the Meridian board of directors did not consider it practical, and did not attempt, to quantify, rank or otherwise assign relative weights to the
specific factors it considered in reaching its decision and did not undertake to make any specific determination as to whether any particular factor, or any
aspect of any factor, was favorable or unfavorable to the ultimate determination of the Meridian board of directors. Rather, the Meridian board of directors
made its recommendation based on the totality of information presented to, and the investigation conducted by, it. In considering the factors discussed
above, individual directors may have given different weights to different individual factors.",71,73
"Meridian Bancorp, Inc._20210622_DEFM14A_19361639_4244116.Pdf",Opinion of Meridian’s Financial Advisor,"Opinion of Meridian’s Financial Advisor
Meridian retained Raymond James as financial advisor on March 5, 2021. Meridian selected Raymond James as a financial advisor because it is a globally-
recognized investment banking firm offering a full range of investment banking services to its clients. In the ordinary course of its investment banking
business, Raymond James is regularly engaged in the valuation of financial institutions and their securities in connection with mergers and acquisitions
and other corporate transactions. Pursuant to that engagement, the Meridian board of directors requested that Raymond James evaluate the fairness,
from a financial point of view, to the holders of Meridian’s outstanding common stock (other than the Exception Shares) of the exchange ratio to be
received by such holders in the merger pursuant to the merger agreement.
At the April 22, 2021 meeting of the Meridian board of directors, representatives of Raymond James rendered its opinion, subsequently confirmed in
writing and dated April 22, 2021, to the Meridian board of directors (in its capacity as such), as to the fairness, as of such date, from a financial point of
view, to the holders of Meridian’s outstanding common stock (other than the Exception Shares) of the exchange ratio to be received by such holders in
the merger pursuant to the merger agreement, based upon and subject to the assumptions made, procedures followed, matters considered and
qualifications and limitations on the scope of review undertaken by Raymond James in connection with the preparation of its opinion.
The full text of the written opinion of Raymond James is attached as Annex B to this joint proxy statement/prospectus. The summary of the opinion of
Raymond James set forth in this joint proxy statement/prospectus is qualified in its entirety by reference to the full text of such written opinion.
Holders of Meridian common stock are urged to read this opinion in its entirety. The opinion of Raymond James speaks only as of the date of the
opinion and does not reflect any developments that may occur or may have occurred after the date of its opinion and prior to the completion of the
merger.
Raymond James provided its opinion for the information of the Meridian board of directors (in its capacity as such) in connection with, and for purposes
of, its consideration of the exchange ratio to be received by holders of Meridian’s outstanding common stock (other than the Exception Shares) in the
merger pursuant to the merger agreement and its opinion only addresses whether the exchange ratio in the merger pursuant to the merger agreement was
fair, from a financial point of view, to the holders of Meridian common stock (other than the Exception Shares). The opinion of Raymond James does not
address any other term or aspect of the merger agreement or the merger contemplated thereby. The Raymond James opinion does not constitute a
recommendation to the Meridian board of directors or to any holder of Meridian common stock as to how the
 
62Table of Contents
Meridian board of directors, such stockholder or any other person should vote or otherwise act with respect to the merger or any other matter. Raymond
James does not express any opinion as to the likely trading range of Independent common stock following the merger, which may vary depending on
numerous factors that generally impact the price of securities or on the financial condition of Independent at that time.
In connection with its review of the proposed merger and the preparation of its opinion, Raymond James, among other things:
 
•
 reviewed the financial terms and conditions as stated in the draft of the Agreement and Plan of Merger by and between Independent and
Meridian dated as of April 21, 2021 (the “merger agreement”);
 
 
•
 reviewed certain information related to the historical condition and prospects of Meridian and Independent, as made available to Raymond
James by or on behalf of Meridian, including, but not limited to, (a) financial projections for each of Meridian and Independent that were
prepared using consensus analyst estimates for the years 2021 and 2022 with further years extrapolated based on appropriate growth rates,
which were reviewed and approved for our use by the management of Meridian (together, the “Projections”) and (b) certain forecasts and
estimates of potential cost savings, operating efficiencies, revenue effects, and other pro forma financial adjustments expected to result from
the merger, as approved and directed for our use by management of Meridian (the “Pro Forma Financial Adjustments”);
 
 
•
 reviewed Meridian’s and Independent’s audited financial statements for the years ended December 31, 2019 and December 31, 2020 and
unaudited financial statements for the three month period ended March 31, 2021;
 
 
•
 reviewed Meridian’s and Independent’s recent public filings and certain other publicly available information regarding Meridian and
Independent;
 
 
•
 reviewed the financial and operating performance of Meridian and Independent and those of other selected public companies that Raymond
James deemed to be relevant;
 
 
•
 considered certain publicly available financial terms of certain transactions Raymond James deemed to be relevant;
 
 
•
 reviewed the then-current and historical market prices for shares of Meridian common stock and shares of Independent common stock, and
the then-current market prices of the publicly traded securities of certain other companies that Raymond James deemed to be relevant;
 
 
•
 conducted such other financial studies, analyses and inquiries and considered such other information and factors as Raymond James
deemed appropriate;
 
 
•
 received a certificate addressed to Raymond James from a member of senior management of Meridian regarding, among other things, the
accuracy of the information, data and other materials (financial or otherwise) provided to, or discussed with, Raymond James by or on
behalf of Meridian; and
 
 
•
 discussed with members of the senior management of Meridian certain information relating to the aforementioned and any other matters
which Raymond James deemed relevant to its inquiry including, but not limited to, the past and then-current business operations of
Meridian and the financial condition and future prospects and operations of Meridian.
With Meridian’s consent, Raymond James assumed and relied upon the accuracy and completeness of all information supplied by or on behalf of
Meridian or otherwise reviewed by or discussed with Raymond James, and Raymond James did not undertake any duty or responsibility to, nor did
Raymond James, independently verify any of such information. Furthermore, Raymond James undertook no independent analysis of any potential or
actual litigation, regulatory action, possible unasserted claims or other contingent liabilities, to which Meridian or Independent was a party or may have
been subject, or of any governmental investigation of any possible unasserted claims or other contingent liabilities to which Meridian or Independent
was a party or may become subject. With Meridian’s consent, the opinion of Raymond James made no assumption concerning, and therefore
 
63
Table of Contents
did not consider, the potential effects of any such litigation, claims or investigations or possible assertions. Raymond James did not make or obtain an
independent appraisal of the assets or liabilities (contingent or otherwise) of Meridian or Independent. With respect to the Projections, Pro Forma
Financial Adjustments, and any other information and data provided to or otherwise reviewed by or discussed with Raymond James, Raymond James,
with Meridian’s consent, assumed that the Projections, Pro Forma Financial Adjustments and such other information and data were reasonably prepared
in good faith on bases reflecting (or, in the case of the Projections with respect to 2021 and 2022, which were prepared using consensus analyst estimates
for the years 2021 and 2022, are consistent with) the best then-currently available estimates and judgments of management of Meridian, and Raymond
James relied upon Meridian to advise Raymond James promptly if any information previously provided became inaccurate or was required to be updated
during the period of its review. Raymond James expressed no opinion with respect to the Projections, the Pro Forma Financial Adjustments or the
assumptions on which they were based. Raymond James assumed that the final form of the merger agreement would be substantially similar to the draft
reviewed by Raymond James, and that the merger would be consummated in accordance with the terms of the merger agreement without waiver or
amendment of any conditions thereto. Furthermore, Raymond James assumed, in all respects material to its analysis, that the representations and
warranties of each party contained in the merger agreement were true and correct and that each such party would perform all of the covenants and
agreements required to be performed by it under the merger agreement without being waived. Raymond James relied upon and assumed, without
independent verification, that (i) the merger would be consummated in a manner that complies in all respects with all applicable international, federal and
state statutes, rules and regulations, and (ii) all governmental, regulatory and other consents and approvals necessary for the consummation of the
merger would be obtained and that no delay, limitations, restrictions or conditions would be imposed or amendments, modifications or waivers made that
would have an effect on the merger, Independent or Meridian that would be material to its analyses or opinion.
Raymond James expressed no opinion as to the underlying business decision to effect the merger, the structure or tax consequences of the merger, or the
availability or advisability of any alternatives to the merger. Raymond James provided advice to the Meridian board of directors with respect to the
proposed merger. Raymond James did not, however, recommend any specific amount of consideration or that any specific consideration constituted the
only appropriate consideration for the merger. Raymond James did not solicit indications of interest with respect to a transaction involving Meridian. The
opinion of Raymond James did not express any opinion as to the likely trading range of Independent common stock following the merger, which may vary
depending on numerous factors that generally impact the price of securities or on the financial condition of Independent at that time. The Raymond
James opinion was limited to the fairness, from a financial point of view, of the exchange ratio to be received by the holders of Meridian common stock
(other than the Exception Shares).
Raymond James expressed no opinion with respect to any other reasons, legal, business, or otherwise, that may support the decision of the Meridian
board of directors to approve or consummate the merger. Furthermore, no opinion, counsel or interpretation was intended by Raymond James on matters
that require legal, accounting or tax advice. Raymond James assumed that such opinions, counsel or interpretations had been or would be obtained from
appropriate professional sources. Furthermore, Raymond James relied, with the consent of the Meridian board of directors, on the fact that Meridian was
assisted by legal, accounting and tax advisors, and, with the consent of the Meridian board of directors, relied upon and assumed the accuracy and
completeness of the assessments by Meridian and its advisors, as to all legal, accounting and tax matters with respect to Meridian and the merger,
including, without limitation, that Meridian’s and Independent’s financial statements had been prepared in accordance with GAAP and that the merger
would qualify as a reorganization within the meaning of Section 368(a) of the Internal Revenue Code of 1986, as amended. Raymond James was not an
expert in the evaluation of allowances for loan and lease losses and had not independently verified such allowances or reviewed or examined any
individual loan or credit files. Raymond James assumed, with Meridian’s consent, that the allowance for loan and lease losses (i) set forth in the
respective financial statements of Meridian and Independent were adequate to cover such losses, (ii) would be adequate on a pro forma basis for the
combined entity and (iii) complied fully with applicable law, regulatory policy and sound banking practices as of the date of such financial statements.
 
64
Table of Contents
In formulating its opinion, Raymond James considered only what it understood to be the exchange ratio to be received by the holders of Meridian
common stock (other than the Exception Shares), and Raymond James did not consider, and did not express an opinion on, the fairness of the amount or
nature of any compensation to be paid or payable to any of Meridian’s officers, directors or employees, or class of such persons, whether relative to the
compensation to be received by the holders of Meridian common stock (other than the Exception Shares) or otherwise. Raymond James was not
requested to opine as to, and its opinion did not express an opinion as to or otherwise address, among other things: (1) the fairness of the merger to the
holders of any class of securities, creditors or other constituencies of Meridian, or to any other party, except and only to the extent expressly set forth in
the last sentence of its opinion or (2) the fairness of the merger to any one class or group of Meridian’s or any other party’s security holders or other
constituents vis-à-vis any other class or group of Meridian’s or such other party’s security holders or other constituents (including, without limitation,
the allocation of any consideration to be received in the merger amongst or within such classes or groups of security holders or other constituents).
Raymond James expressed no opinion as to the impact of the merger on the solvency or viability of Meridian or Independent or the ability of Meridian or
Independent to pay their respective obligations when they come due.
Material Financial Analyses
The following summarizes the material financial analyses reviewed by Raymond James with the Meridian board of directors at its meeting on April 22,
2021, which material was considered by Raymond James in rendering its opinion. No company or transaction used in the analyses described below is
identical or directly comparable to Meridian, Independent or the contemplated merger.
Contribution Analysis. Raymond James analyzed the relative contribution of Meridian and Independent to certain financial and operating metrics for the
pro forma combined company resulting from the merger. The financial and operating metrics included: (i) market capitalization; (ii) total assets; (iii) gross
loans; (iv) non-interest bearing deposits; (v) core deposits; (vi) total deposits; (vii) tangible common equity; (viii) last twelve months net interest income;
(ix) last twelve months operating fee income; (x) last twelve months net income; (xi) consensus estimated 2021 net income; and (xii) consensus estimated
2022 net income. Forward net income estimates were based on median consensus estimates as shown by S&P Global Market Intelligence. The estimates
published by Wall Street research analysts were not prepared in connection with the merger or at the request of Raymond James and may or may not
prove to be accurate. The relative contribution analysis did not give effect to any synergies as a result of the merger. The results of this analysis are
summarized in the table below:
 
 
  
Relative Contribution
 
 
Implied
Exchange Ratio 
 
  
Independent 
 
Meridian 
Market Capitalization
  
 
73.7%  
 
26.3%  
 
0.229x 
Total Assets
  
 
67.9%  
 
32.1%  
 
0.301x 
Gross Loans
  
 
63.7%  
 
36.3%  
 
0.363x 
Non-Interest Bearing Deposits
  
 
84.6%  
 
15.4%  
 
0.119x 
Core Deposits
  
 
73.2%  
 
26.8%  
 
0.235x 
Total Deposits
  
 
69.5%  
 
30.5%  
 
0.281x 
Tangible Common Equity
  
 
60.8%  
 
39.2%  
 
0.411x 
LTM Net Interest Income
  
 
65.3%  
 
34.7%  
 
0.339x 
LTM Operating Fee Income
  
 
90.0%  
 
10.0%  
 
0.074x 
LTM Net Income
  
 
64.1%  
 
35.9%  
 
0.358x 
2021 Estimated Net Income
  
 
64.8%  
 
35.2%  
 
0.347x 
2022 Estimated Net Income
  
 
65.0%  
 
35.0%  
 
0.344x 
Exchange Ratio in the Merger
  
 
 
 
0.275x 
 
65
Table of Contents
Discounted Cash Flow Analysis. Raymond James performed a discounted cash flow analysis of Meridian and Independent based on the Projections.
Consistent with the periods included in the Projections, Raymond James used estimated calendar year 2026 as the final year for the analysis and applied
multiples, ranging from 12.0x to 14.0x for Meridian and 18.0x to 22.0x for Independent, to estimated calendar year 2026 earnings in order to derive a range
of estimated terminal values for Meridian and Independent in 2025.
For Independent, Raymond James used discount rates ranging from 10.1% to 12.1%. For Meridian, Raymond James used discount rates ranging from
10.5% to 12.5%. Raymond James arrived at its discount rate ranges by using the 2020 Duff & Phelps Valuation Handbook. Raymond James reviewed the
ranges of implied per share values indicated by the discounted cash flow analysis for each of Independent and Meridian and calculated a range of implied
exchange ratios by dividing the maximum implied per share value of Meridian common stock by the minimum implied per share value of Independent
common stock to calculate the maximum implied exchange ratio, and by dividing the minimum implied per share value of Meridian common stock by the
maximum implied per share value of Independent common stock to calculate the minimum implied exchange ratio. The results of the discounted cash flow
analysis are summarized in the table below:
 
 
  
Implied Per Share Value
 
  
Implied
Exchange Ratio
 
 
  
Independent    
Meridian
 
 
  
Low    High    
Low    High    Low/High    High/Low 
Net Income Terminal Multiple
  $68.37   $85.70   $19.32   $22.46    
0.225x  -  
0.328x 
Exchange Ratio in the Merger
  
  
  
  
   
0.275x
 
Selected Companies Analysis. Raymond James reviewed certain data for selected companies with publicly traded equity securities that it deemed relevant
for its analysis. The selected group represents companies Raymond James believed to be relevant to each of Independent and Meridian. Raymond James
selected certain companies that: (i) are headquartered in New England (Connecticut, Maine, Massachusetts, New Hampshire, Rhode Island and Vermont)
or the Mid-Atlantic (Delaware, Maryland, New Jersey, New York, Washington D.C. and Pennsylvania); (ii) have total assets between $8.0 billion and
$20.0 billion for Independent and between $3.0 billion and $10.0 billion for Meridian; (iii) have tangible common equity to tangible assets greater than
7.00%; (iv) have a most recent quarter return on average assets of greater than 1.00% for Independent and greater than 0.75% for Meridian; and (v) are
traded on the NASDAQ or NYSE. The aforementioned financial characteristics were shown for the bank subsidiary if consolidated data was unavailable,
and the financial characteristics were based on the most recent quarter period reported as of March 31, 2021, if available, otherwise for the quarter period
reported as of December 31, 2020. The selected groups exclude mutual holding companies and targets of announced mergers. The Meridian selected
group also excludes The Bancorp, Inc. due to its unique business model. No company used in the analysis described below is identical or directly
comparable to either Independent or Meridian. The selected companies Raymond James deemed relevant include the following:
Selected Companies for Independent
 
•  WSFS Financial Corp. (DE)
  
•  Eagle Bancorp, Inc. (MD)
•  Community Bank System, Inc. (NY)
  
•  NBT Bancorp Inc. (NY)
•  Northwest Bancshares, Inc. (PA)
  
•  First Commonwealth Financial Corp. (PA)
•  Provident Financial Services (NJ)
  
•  S&T Bancorp, Inc. (PA)
•  Sandy Spring Bancorp, Inc. (MD)
  
•  Brookline Bancorp, Inc. (MA)
•  OceanFirst Financial Corp. (NJ)
  
 
66
Table of Contents
Selected Companies for Meridian
 
•  First Commonwealth Financial Corp. (PA)
  
•  Northfield Bancorp, Inc. (NJ)
•  S&T Bancorp, Inc. (PA)
  
•  Financial Institutions, Inc. (NY)
•  Brookline Bancorp, Inc. (MA)
  
•  Camden National Corporation (ME)
•  Lakeland Bancorp, Inc. (NJ)
  
•  HarborOne Bancorp, Inc. (MA)
•  Tompkins Financial Corporation (NY)
  
•  Metropolitan Bank Holding Corp (NY)
•  ConnectOne Bancorp, Inc. (NJ)
  
•  Cambridge Bancorp (MA)
•  Kearny Financial Corp. (NJ)
  
•  The First Long Island Corporation (NY)
•  Univest Financial Corporation (PA)
  
•  Enterprise Bancorp, Inc. (MA)
•  Amalgamated Financial Corp. (NY)
  
•  Bar Harbor Bankshares (ME)
•  TrustCo Bank Corp NY (NY)
  
•  Arrow Financial Corporation (NY)
•  Washington Trust Bancorp, Inc. (RI)
  
Raymond James calculated various financial multiples for each selected public company, including price per share at close on April 21, 2021 compared to:
(i) basic tangible book value (“TBV”) per share at March 31, 2021 or December 31, 2020 as shown by S&P Global Market Intelligence; (ii) estimated 2021
earnings per share (“2021 EPS”) based on consensus estimates as shown by S&P Global Market Intelligence; and (iii) estimated 2022 earnings per share
(“2022 EPS”) based on consensus estimates as shown by S&P Global Market Intelligence. The estimates published by Wall Street research analysts were
not prepared in connection with the Merger or at the request of Raymond James and may not prove to be accurate. Raymond James reviewed the median
and the 100th percentile relative valuation multiples of the selected public companies for Independent and the 25th percentile and the 75th percentile
relative valuation multiples of the selected public companies for Meridian. The results of the selected companies’ analysis for each of Independent and
Meridian are summarized below:
 
 
  
Independent Multiples
 
 
Meridian Multiples
 
 
  
Median 
 
100th Pctl. 
 
25th Pctl. 
 
75th Pctl. 
Tangible Book Value
  
 
165%  
 
329%  
 
126%  
 
162% 
2021 EPS
  
 
13.7x  
 
25.3x  
 
12.0x  
 
14.7x 
2022 EPS
  
 
13.5x  
 
25.4x  
 
12.0x  
 
14.3x 
Taking into account the results of the selected companies analysis, Raymond James applied the median and 100th percentile of the price to tangible book
value per share ratio and earnings per share multiples to corresponding financial data for Independent and applied the 25th and 75th percentiles of the
price to tangible book value per share ratio and earnings per share multiples to the corresponding financial data for Meridian. Raymond James reviewed
the ranges of implied per share values and calculated a range of implied exchange ratios by dividing the higher implied per share value of Meridian by the
lower implied per share value of Independent to calculate the implied exchange ratio, and by dividing the lower implied per share value of Meridian by the
higher implied per share value of Independent to calculate the low implied exchange ratio. The results of the selected companies’ analysis are summarized
below:
 
 
  
Implied Per Share Value
 
  
Implied
Exchange Ratio
 
 
  
Independent
   
Meridian
 
 
  
Median   
100th Pctl.   
25th Pctl.   
75th Pctl.   Low/High 
  High/Low 
Tangible Book Value
  $ 59.18   $
118.16   $
18.48   $
23.75   
0.156x  
-  
0.401x 
2021 EPS
  $ 54.52   $
100.60   $
17.26   $
21.14   
0.172x  
-  
0.388x 
2022 EPS
  $ 55.32   $
104.40   $
17.62   $
20.98   
0.169x  
-  
0.388x 
Exchange Ratio in the Merger
   
  
  
  
0.275x
 
 
67
Table of Contents
Selected Transaction Analysis. Raymond James analyzed publicly available information relating to selected national and regional transactions announced
since January 1, 2019 involving targets headquartered in (i) the United States (excluding Puerto Rico) or (ii) New England (Connecticut, Maine,
Massachusetts, New Hampshire, Rhode Island and Vermont) or the Mid-Atlantic (Delaware, Maryland, New Jersey, New York, Washington D.C. and
Pennsylvania), in each case, with target assets between $3.0 billion and $10.0 billion. The selected groups exclude mergers of equals transactions.
Financial data for the selected targets was based on the most recent last twelve month period reported prior to announcement of the respective
