Document,Section Header,Section Text,Start Page,End Page
"Meridian Bancorp, Inc._20210622_DEFM14A_19361639_4244116.Pdf",QUESTIONS AND ANSWERS,"QUESTIONS AND ANSWERS
The following are some questions that you may have about the merger and the Independent special meeting or the Meridian special meeting, and brief
answers to those questions. We urge you to read carefully the remainder of this joint proxy statement/prospectus because the information in this section
does not provide all of the information that might be important to you with respect to the merger, the Independent special meeting or the Meridian
special meeting. Additional important information is also contained in the documents incorporated by reference into this joint proxy
statement/prospectus. See “Where You Can Find More Information” beginning on page 142.
In this joint proxy statement/prospectus, unless the context otherwise requires:
 
 
•
 “Independent” refers to Independent Bank Corp., a Massachusetts corporation;
 
 
•
 “Rockland Trust” refers to Rockland Trust Company, a Massachusetts-chartered trust company and wholly-owned subsidiary of
Independent;
 
 
•
 “Independent bylaws” refers to the amended and restated bylaws of Independent.
 
 
•
 “Independent articles of organization” refers to the restated articles of organization of Independent, as amended.
 
 
•
 “Independent common stock” refers to the common stock of Independent, par value $0.01 per share;
 
 
•
 “Merger Sub” refers to Bradford Merger Sub Inc., a Maryland corporation and a direct, wholly owned subsidiary of Independent;
 
 
•
 “Meridian” refers to Meridian Bancorp, Inc., a Maryland corporation;
 
 
•
 “East Boston” refers to East Boston Savings Bank, a Massachusetts-chartered savings bank and wholly-owned subsidiary of Meridian;
 
 
•
 “Meridian bylaws” refers to the bylaws of Meridian;.
 
 
•
 “Meridian articles of incorporation” refers to the articles of incorporation of Meridian;.
 
 
•
 “Meridian common stock” refers to the common stock of Meridian, par value $0.01 per share;
 
 
•
 “shareholders” refers to holders of shares of common stock of Independent both prior to and following the completion of the merger; and
 
 
•
 “stockholders” refers to holders of shares of the common stock of Meridian.
Questions and Answers About the Merger
 
Q.
Why am I receiving this document?
 
A.
You are receiving this joint proxy statement/prospectus because Independent, Rockland Trust, Merger Sub, East Boston and Meridian entered into
an Agreement and Plan of Merger (as amended from time to time, the “merger agreement”), pursuant to which Merger Sub will merge with and into
Meridian, with Meridian as the surviving entity (the “merger”), and as soon as reasonably practicable following the merger, Meridian will merge
with and into Independent, with Independent as the surviving entity (the “holdco merger”). Immediately following the holdco merger, East Boston
will merge with and into Rockland Trust, with Rockland Trust as the surviving bank (the “bank merger”, and together with the merger and the
holdco merger, the “mergers”). A copy of the merger agreement is attached as Annex A to this joint proxy statement/prospectus and is incorporated
by reference herein. In this joint proxy statement/prospectus, we refer to the closing of the transactions contemplated by the merger agreement as
the “closing” and the date on which the closing occurs as the “closing date.”
 
1Table of Contents
In order to complete the merger, among other things:
 
 
•
 Independent shareholders must approve the proposed issuance of Independent common stock to holders of Meridian common stock
pursuant to the merger agreement in order to comply with applicable Nasdaq Global Select Market (“NASDAQ”) listing rules (the
“Independent share issuance proposal” and such issuance the “Independent share issuance”); and
 
 
•
 Meridian stockholders must adopt the merger agreement (the “Meridian merger proposal”).
Independent is holding a special meeting of Independent shareholders (the “Independent special meeting”) to obtain approval of the Independent
share issuance proposal.
Independent shareholders will also be asked to approve the proposal to adjourn the Independent special meeting to solicit additional proxies (i) if
there are insufficient votes at the time of the Independent special meeting to approve the Independent share issuance proposal or (ii) if
adjournment is necessary or appropriate to ensure that any supplement or amendment to this joint proxy statement/prospectus is timely provided
to Independent shareholders (the “Independent adjournment proposal”).
Meridian is holding a special meeting of Meridian stockholders (the “Meridian special meeting”) to obtain approval of the Meridian merger
proposal.
Meridian stockholders will also be asked to approve, on an advisory (non-binding) basis, the merger-related compensation payments that will or
may be paid to the named executive officers of Meridian in connection with the transactions contemplated by the merger agreement (the “Meridian
compensation proposal”), and to approve the proposal to adjourn the Meridian special meeting to solicit additional proxies (i) if there are
insufficient votes at the time of the Meridian special meeting, to approve the Meridian merger proposal or (ii) if adjournment is necessary or
appropriate, to ensure that any supplement or amendment to this joint proxy statement/prospectus is timely provided to holders of Meridian
common stock (the “Meridian adjournment proposal”).
This document is also a prospectus that is being delivered to holders of Meridian common stock because, pursuant to the merger agreement,
Independent is offering shares of Independent common stock to Meridian stockholders.
This joint proxy statement/prospectus contains important information about the merger and the other proposals being voted on at the Independent
and Meridian special meetings. You should read it carefully and in its entirety. The enclosed materials allow you to have your shares of common
stock voted by proxy without attending your meeting. Your vote is important and we encourage you to submit your proxy as soon as possible.
 
Q.
What will Meridian’s stockholders receive in the merger?
 
A.
In the merger, Meridian stockholders will receive 0.275 of a share of Independent common stock for each share of Meridian common stock held
immediately prior to the completion of the merger.
Independent’s common stock is listed on the Nasdaq Global Select Market under the trading symbol “INDB.” Independent will not issue fractional
shares of its common stock in the merger, but will instead pay cash for any fractional shares at a price determined by the volume weighted average
closing price of Independent common stock on NASDAQ for the five trading days ending on the fifth trading day immediately preceding the
closing date of the merger, which is referred to herein as the Closing VWAP (the exchange ratio, together with cash received in lieu of fractional
shares of Independent common stock, if any, the “merger consideration”).
 
2
Table of Contents
Q.
What will Independent’s shareholders receive in the merger?
 
A.
In the merger, Independent shareholders will not receive any consideration, and their shares of Independent common stock will remain outstanding
and will constitute shares of Independent following the merger. Following the merger, shares of Independent common stock will continue to be
listed on NASDAQ under the trading symbol “INDB.”
 
Q.
What will happen in the merger?
 
A.
In the merger, Merger Sub will merge with and into Meridian, with Meridian as the surviving entity. In the holdco merger, which will occur as soon
as reasonably practicable following the merger, Meridian will merge with and into Independent, with Independent as the surviving entity. In the
bank merger, which will occur immediately following the holdco merger, East Boston will merge with and into Rockland Trust, with Rockland Trust
as the surviving bank.
Each share of Meridian common stock issued and outstanding immediately prior to the effective time of the merger (other than shares held as
treasury stock or shares owned directly by Independent in trust accounts, managed accounts and the like) will be converted into the right to
receive 0.275 (the “exchange ratio”) of a share of Independent common stock. After completion of the merger, (1) Meridian will no longer be a public
company, (2) Meridian common stock will be delisted from NASDAQ and will cease to be publicly traded, and (3) the Meridian common stock will
be deregistered under the Securities Exchange Act of 1934, as amended (the “Exchange Act”). After completion of the holdco merger, Meridian will
cease to exist. Holders of Independent common stock will continue to own their existing shares of Independent common stock. See the information
provided in the section entitled “The Merger Agreement—Structure of the Merger” beginning on page 100 and the merger agreement for more
information about the merger.
 
Q.
How will the merger affect Meridian equity awards?
 
A.
The merger agreement provides that Meridian equity awards that are outstanding immediately prior to the effective time will be treated as follows:
Stock Options. Each stock option, whether vested or unvested, will fully vest and be cancelled at the effective time of the merger. On the
closing date of the merger, East Boston or Meridian will pay to the holders of such stock options cash in an amount equal to the product of
(i) the number of shares of Meridian common stock provided for in each such stock option, multiplied by (ii) the excess, if any, of (x) the per
share cash equivalent consideration (as defined below) over (y) the exercise price. Any stock option for which the exercise price per share
of Meridian common stock provided for in such stock option exceeds the per share cash equivalent consideration will be cancelled at the
effective time of the merger without payment. The cash payment will be paid within five business days after the closing date of the merger,
without interest and less applicable withholding taxes. For purposes of the merger agreement, “per share cash equivalent consideration”
means the product (rounded to the nearest cent) obtained by multiplying (i) the exchange ratio by (ii) the volume-weighted average trading
price of a share of the Independent common stock on Nasdaq for the consecutive period of five full trading days ending on the day
immediately preceding the closing date.
Restricted Stock Awards. Each share of restricted stock will fully vest at the effective time of the merger and be considered an outstanding
share of Meridian common stock entitled to receive the merger consideration. The merger consideration will be issued within five business
days after the closing date of the merger, without interest and less applicable withholding taxes.
 
Q.
How will the merger affect the East Boston ESOP?
 
A.
The East Boston Savings Bank Employee Stock Ownership Plan (which we refer to as the East Boston ESOP) will be terminated at least five
business days and no more than seven business days prior to the effective time of the merger. The East Boston ESOP is funded through a loan to
purchase shares of Meridian
 
3
Table of Contents
 
common stock, which shares are allocated to participants as the loan is repaid. The unallocated shares are held in a separate unallocated stock
fund. Participants’ account balances will become fully vested in connection with the termination of the East Boston ESOP. On the date the East
Boston ESOP is terminated, East Boston will direct the trustee of the East Boston ESOP to remit a sufficient number of shares of Meridian common
stock held in the ESOP loan suspense account back to East Boston to repay the outstanding ESOP loan in full. All remaining shares of Meridian
common stock held by the East Boston ESOP as of immediately prior to the effective time, including any unallocated shares held in the East Boston
ESOP loan suspense account (which will not include any shares of Meridian common stock used for purposes of repaying or forgiving the East
Boston ESOP loan) will be converted into the right to receive the merger consideration. Following the effective time, the unallocated merger
consideration (and any other remaining unallocated assets) will be allocated on a pro rata basis to all participants with an account balance under
the East Boston ESOP based on each participant’s account balance on the termination date.
 
Q.
Will the value of the merger consideration change between the date of this joint proxy statement/prospectus and the time the merger is
completed?
 
A.
Yes. Although the number of shares of Independent common stock that Meridian stockholders will receive is fixed, the value of the merger
consideration will fluctuate between the date of this joint proxy statement/prospectus and the completion of the merger based upon the market
value for Independent common stock. Any fluctuation in the market price of Independent common stock will change the value of the shares of
Independent common stock that Meridian stockholders will receive. Neither Independent nor Meridian is permitted to terminate the merger
agreement as a result of any increase or decrease in the market price of Independent common stock or Meridian common stock.
 
Q.
Are Meridian’s stockholders or Independent’s shareholders entitled to dissenters’ rights?
 
A.
No. Under the provisions of the Maryland General Corporation Law, as amended, Meridian stockholders are not entitled to dissenters’ rights in the
merger. Under the provisions of the Massachusetts Business Corporation Act, Chapter 156D, Section 13, Independent shareholders are not entitled
to dissenters’ rights in the merger.
 
Q.
Are there any risks that I should consider in deciding whether to vote for the approval of the Independent share issuance proposal, the approval of
the Meridian merger proposal, or the other proposals to be considered at the Independent special meeting and the Meridian special meeting,
respectively?
 
A.
Yes. You should read and carefully consider the risk factors set forth in the section in this document titled “Risk Factors” beginning on page 27.
You also should read and carefully consider the risk factors of Independent and Meridian contained in the documents that are incorporated by
reference into this joint proxy statement/prospectus.
 
Q.
Should Meridian’s stockholders send in their stock certificates now?
 
A.
No. Please do not send in your stock certificates with your proxy. After the merger is completed, an exchange agent designated by Independent and
reasonably acceptable to Meridian (the “exchange agent”) will send you instructions for exchanging Meridian stock certificates for the merger
consideration.
 
Q.
What are the material U.S. federal income tax consequences of the merger and the holdco merger to U.S. holders of Meridian common stock?
 
A.
The merger and the holdco merger, taken together, are intended to qualify, and the obligations of the parties to complete the merger are conditioned
upon the receipt of a legal opinion from their respective counsel to the effect that the merger and the holdco merger, taken together, will qualify, as a
reorganization within the meaning of Section 368 of the Internal Revenue Code of 1986, as amended, which is referred to in this joint
 
4
Table of Contents
 
proxy statement/prospectus as the Code. Meridian’s stockholders generally will not recognize gain or loss with respect to the Independent common
stock that they receive in the merger, except with respect to any cash they receive in lieu of receiving a fractional share of Independent common
stock. See “Material U.S. Federal Income Tax Consequences of the Merger and the Holdco Merger” beginning on page 121 . This tax treatment
may not apply to all Meridian stockholders. Determining the actual tax consequences of the merger and the holdco merger to Meridian
stockholders can be complicated and will depend on the particular circumstances of each Meridian stockholder. Meridian stockholders should
consult their own tax advisor for a full understanding of the mergers’ tax consequences that are particular to each stockholder.
 
Q.
What are the interests of Meridian’s directors and executive officers in the merger, if any?
 
A.
In considering the recommendation of the board of directors of Meridian, Meridian’s stockholders should be aware that the directors and executive
officers of Meridian have interests in the merger and holdco merger that are different from, or in addition to, the interests of Meridian’s other
stockholders generally. These interests include rights of certain executive officers under their existing employment and change in control
agreements; rights of certain directors and executive officers to payments of their vested account balances under their existing supplemental
retirement arrangements; rights of certain executive officers under consulting agreements and an offer letter with Rockland Trust executed in
connection with the merger agreement; rights under Meridian’s equity-based benefit programs and awards, including the acceleration of vesting of
stock options and restricted stock; a 2021 pro-rata bonus; a 2021 grant of restricted stock awards; rights under the East Boston ESOP; and rights to
continued indemnification and insurance coverage by Independent after the merger for acts and omissions occurring before the merger. In addition,
following the merger, Independent will invite all of the independent directors serving on Meridian’s board of directors immediately prior to the
merger to become members of a transition advisory board for two years following the closing. The board of directors of Meridian was aware of
these interests and considered them, among other matters, in approving the merger agreement and related transactions.
 
Q.
When will the merger be completed?
 
A.
Independent and Meridian expect the merger to close in the fourth quarter of 2021. However, neither Independent nor Meridian can predict the
actual date on which the merger will be completed, or if the merger will be completed at all, because completion is subject to conditions and factors
outside the control of both companies. Meridian must first obtain the approval of Meridian stockholders for the Meridian merger proposal, and
Independent must obtain approval of Independent shareholders for the Independent share issuance proposal. Independent and Meridian must also
obtain necessary regulatory approvals and satisfy certain other closing conditions.
 
Q.
What are the conditions to complete the merger?
 
A.
The obligations of Independent and Meridian to complete the merger are subject to the satisfaction or waiver of certain closing conditions
contained in the merger agreement, including the receipt of required regulatory approvals and the expiration of all statutory waiting periods without
the imposition of any materially burdensome regulatory condition, the receipt of certain tax opinions, approval by Independent shareholders of the
Independent share issuance proposal and approval by Meridian stockholders of the Meridian merger proposal. For more information, see “The
Merger Agreement—Conditions to Complete the Merger” beginning on page 115.
 
Q.
What happens if the merger is not completed?
 
A.
If the merger is not completed, holders of Meridian common stock will not receive any consideration for their shares of Meridian common stock in
connection with the merger. Instead, Meridian will remain an independent public company, Meridian common stock will continue to be listed and
traded on NASDAQ, and Independent will not complete the issuance of shares of Independent common stock pursuant to the merger agreement. In
addition, if the merger agreement is terminated in certain circumstances, a termination
 
5
Table of Contents
 
fee of $44,145,000 will be payable by either Independent or Meridian, as applicable. See “The Merger Agreement—Termination Fees” beginning on
page 117 for a more detailed discussion of the circumstances under which a termination fee will be required to be paid.
 
Q.
Where can I find more information about the companies?
 
A.
You can find more information about Independent and Meridian from the various sources described under the section of this document titled
“Where You Can Find More Information” beginning on page 142.
 
Q.
What is a “broker non-vote”?
 
A.
A “broker non-vote” occurs on an item when a nominee or intermediary is not permitted to vote on that item without instructions from the beneficial
owner of the shares, and the beneficial owner fails to provide the nominee or intermediary with such instructions.
 
Q.
What is householding and how does it affect me?
 
A.
The SEC permits companies to send a single set of proxy materials to any household at which two (2) or more shareholders reside, unless contrary
instructions have been received, but only if the applicable shareholders provide advance notice and follow certain procedures. In such cases, each
shareholder continues to receive a separate notice of the meeting and proxy card. Certain brokerage firms may have instituted householding for
beneficial owners of Independent common stock and Meridian common stock, as applicable, held through brokerage firms. If your family has
multiple accounts holding Independent common stock or Meridian common stock, as applicable, you may have already received a householding
notification from your broker. Please contact your broker directly if you have any questions or require additional copies of this joint proxy
statement/prospectus. The broker will arrange for delivery of a separate copy of this joint proxy statement/prospectus promptly upon your written
or oral request. You may decide at any time to revoke your decision to household, and thereby receive multiple copies.
Questions and Answers About the Special Meeting of Meridian Stockholders
 
Q.
When and where will Meridian’s stockholders meet?
 
A.
The Meridian special meeting will be held at 67 Prospect Street, Peabody, Massachusetts 01960 on August 5, 2021 at 11:00 a.m., Eastern Time.
Even if you plan to attend the Meridian special meeting, Meridian recommends that you vote your shares in advance as described below so that
your vote will be counted if you later decide not to or become unable to attend the applicable special meeting.
 
Q.
What matters are Meridian’s stockholders being asked to approve at the Meridian special meeting pursuant to this joint proxy
statement/prospectus?
 
A.
At the Meridian special meeting, Meridian’s stockholders will be asked to consider and vote on the following proposals:
 
 
•
 Meridian Proposal 1: The Meridian merger proposal;
 
 
•
 Meridian Proposal 2: The Meridian compensation proposal; and
 
 
•
 Meridian Proposal 3: The Meridian adjournment proposal.
In order to complete the merger, among other things, Meridian stockholders must approve the Meridian merger proposal. None of the approvals of
the Meridian compensation proposal or the Meridian adjournment proposal is a condition to the obligations of Independent or Meridian to
complete the merger.
 
6
Table of Contents
Q.
What does Meridian’s board of directors recommend with respect to the three proposals?
 
A.
The Meridian board of directors unanimously recommends that you vote “FOR” the Meridian merger proposal, “FOR” the Meridian compensation
proposal and “FOR” the Meridian adjournment proposal.
In considering the recommendations of the Meridian board of directors, Meridian stockholders should be aware that Meridian directors and
executive officers may have interests in the merger that are different from, or in addition to, the interests of Meridian stockholders generally. For a
more complete description of these interests, see the information provided in the section entitled “The Merger—Interests of Meridian’s Executive
Officers and Directors in the Merger” beginning on page 88.
 
Q.
Who is eligible to vote at the Meridian special meeting of stockholders?
 
A.
Only holders of record of Meridian common stock at the close of business on June 17, 2021 which is the record date for the Meridian special
meeting of stockholders, are entitled to vote at the Meridian special meeting.
Attendance at the special meeting is not required to vote. See below and the section entitled “The Special Meeting of Meridian Stockholders—
Voting of Proxies” beginning on page 46 for instructions on how to vote your shares of Meridian common stock without attending the Meridian
special meeting.
 
Q.
How many votes must be represented in person or by proxy at the Meridian special meeting to have a quorum?
 
A.
The holders of a majority of the shares of Meridian common stock outstanding and entitled to vote at the Meridian special meeting of stockholders,
present in person or represented by proxy, will constitute a quorum at the Meridian special meeting.
 
Q.
What vote by Meridian’s stockholders is required to approve the Meridian special meeting proposals?
 
A.
Meridian Proposal 1: Meridian merger proposal. Approval of the Meridian merger proposal requires the affirmative vote of the holders of a
majority of the shares of Meridian common stock outstanding and entitled to vote. Accordingly, an abstention or a broker non-vote or other failure
to vote will have the same effect as a vote cast “AGAINST” the merger proposal.
Meridian Proposal 2: Meridian compensation proposal. Approval of the Meridian compensation proposal requires the affirmative vote of a
