Document,Section Header,Section Text,Start Page,End Page
vote or the requisite Independent vote, by the mutual consent of Independent and Meridian if authorized by each of their boards of directors, as
determined by a majority vote of each, or in the following circumstances:
 
 
•
 by either Independent or Meridian if any governmental entity that must grant a requisite regulatory approval has denied approval of the
merger, the holdco merger or the bank merger and such denial has become final and nonappealable or any governmental entity of competent
jurisdiction has issued a final and nonappealable order, injunction, decree or other legal restraint or prohibition permanently enjoining or
otherwise prohibiting or making illegal the merger, the holdco merger or the bank merger, unless the failure to obtain a requisite regulatory
approval is due to the failure of the party seeking to terminate the merger agreement to perform or observe its obligations, covenants and
agreements under the merger agreement;
 
 
•
 by either Independent or Meridian (provided that the terminating party is not then in material breach of any representation, warranty,
obligation, covenant or other agreement contained in the merger agreement) if there is a breach of any of the obligations, covenants or
agreements or any of the representations or warranties (or any such representation or warranty ceases to be true) set forth in the merger
agreement on the part of Meridian, in the case of a termination by Independent, or Independent or Merger Sub, in the case of a termination
by Meridian, which either individually or in the aggregate would constitute, if occurring or continuing on the date the merger is completed,
the failure of a closing condition of the terminating party and which is not cured within thirty (30) days following written notice to the party
committing such breach, or by its nature or timing cannot be cured during such period (or such fewer days as remain prior to the end date);
 
 
•
 by either Independent or Meridian if the merger has not been completed on or before April 22, 2022, unless the failure of the merger to be
completed by such date is due to the failure of the party seeking to terminate the merger agreement to perform or observe its obligations,
covenants and agreements under the merger agreement;
 
 
•
 by either Meridian or Independent (provided Independent is not in material breach of its obligations related to shareholder approval and the
Independent board recommendation), if the approval of the Independent share issuance proposal is not obtained because of the failure to
obtain the required vote at the Independent special meeting;
 
 
•
 by either Independent or Meridian (provided Meridian is not in material breach of its obligations related to non-solicitation of acquisition
proposals or the Meridian stockholder approval and board recommendation), if the approval of the Meridian merger proposal is not
obtained because of the failure to obtain the required vote at the Meridian special meeting;
 
116Table of Contents
 
•
 by Meridian, if, prior to the requisite Independent vote being obtained, Independent or the Independent board of directors (1) withholds,
withdraws, modifies or qualifies in a manner adverse to Meridian the Independent board recommendation, (2) fails to make the Independent
board recommendation in the joint proxy statement/prospectus, (3) adopts, approves, recommends or endorses an acquisition proposal with
respect to Independent or publicly announces an intention to adopt, approve, recommend or endorse an acquisition proposal with respect
to Independent, (4) fails to publicly and without qualification (A) recommend against any acquisition proposal with respect to Independent
or (B) reaffirm the Independent board recommendation, in each case within ten (10) Business Days (or such fewer number of days as
remains prior to the Independent special meeting) after an acquisition proposal with respect to Independent is made public or any request
by Meridian to do so, or (5) materially breaches its obligations with respect to the Independent shareholder approval and board
recommendation; or
 
 
•
 by Independent, if prior to the requisite Meridian vote being obtained, Meridian or the Meridian board of directors (1) withholds, withdraws,
modifies or qualifies in a manner adverse to Independent the Meridian board recommendation, (2) fails to make the Meridian board
recommendation in the joint proxy statement/prospectus, (3) adopts, approves, recommends or endorses an acquisition proposal with
respect to Meridian or publicly announces an intention to adopt, approve, recommend or endorse an acquisition proposal with respect to
Meridian, (4) fails to publicly and without qualification (A) recommend against any acquisition proposal with respect to Meridian or
(B) reaffirm the Meridian board recommendation, in each case within ten (10) Business Days (or such fewer number of days as remains prior
to the Meridian special meeting) after an acquisition proposal with respect to Meridian is made public or any request by Independent to do
so, or (5) materially breaches its obligations relating to non-solicitation of acquisition proposals or the Meridian stockholder approval and
board recommendation.",127,128
"Meridian Bancorp, Inc._20210622_DEFM14A_19361639_4244116.Pdf",Termination Fees,"Termination Fees
Meridian will pay Independent a termination fee equal to $44,145,000 in cash (the “termination fee”) if the merger agreement is terminated in the following
circumstances:
 
 
•
 in the event that the merger agreement is terminated by Independent pursuant to the last bullet set forth under “—Termination of the
Merger Agreement” above. In such case, the termination fee must be paid to Independent within three (3) business days of the date of
termination.
 
 
•
 in the event, after the date of the merger agreement and prior to the termination of the merger agreement, a bona fide acquisition proposal
has been communicated to or otherwise made known to the Meridian board of directors or Meridian’s senior management or has been made
directly to the Meridian stockholders generally, or any person has publicly announced (and not withdrawn at least two (2) business days
prior to the Meridian special meeting) an acquisition proposal with respect to Meridian, and (i) (a) thereafter the merger agreement is
terminated by either Independent or Meridian because (1) the merger has not been completed prior to the end date, and Meridian has not
obtained the requisite Meridian vote or (2) Meridian has not received the requisite Meridian vote as a result of the failure to obtain such
vote at the Meridian special meeting or (b) thereafter the merger agreement is terminated by Independent pursuant to the second bullet set
forth under “—Termination of the Merger Agreement” above, and (ii) prior to the date that is twelve (12) months after the date of such
termination, Meridian enters into a definitive agreement or consummates a transaction with respect to an acquisition proposal (whether or
not the same acquisition proposal as that referred to above), provided that for purposes of the foregoing, all references in the definition of
acquisition proposal to “twenty percent (20%)” will instead refer to “fifty percent (50%).” In such case, the termination fee must be paid to
Independent on the earlier of the date Meridian enters into such definitive agreement and the date of consummation of such transaction.
 
117Table of Contents
Independent will pay Meridian the termination fee if the merger agreement is terminated in the following circumstances:
 
 
•
 in the event that the merger agreement is terminated by Meridian pursuant to the second to last bullet set forth under “—Termination of the
Merger Agreement” above. In such case the termination fee must be paid to Meridian within three (3) business days of the date of
termination.
 
 
•
 in the event, after the date of the merger agreement and prior to the termination of the merger agreement, a bona fide acquisition proposal
has been communicated to or otherwise made known to the Independent board of directors or Independent’s senior management or has
been made directly to the Independent shareholders generally, or any person has publicly announced (and not withdrawn at least two
(2) business days prior to the Independent special meeting) an acquisition proposal with respect to Independent, and (i) (a) thereafter the
merger agreement is terminated by either Meridian or Independent because (1) the merger has not been completed prior to the end date, and
Independent has not obtained the requisite Independent vote or (2) Independent has not received the requisite Independent vote as a
result of the failure to obtain such vote at the Independent special meeting or (b) thereafter the merger agreement is terminated by Meridian
pursuant to the second bullet set forth under “—Termination of the Merger Agreement” above, and (ii) prior to the date that is twelve
(12) months after the date of such termination, Independent enters into a definitive agreement or consummates a transaction with respect to
an acquisition proposal (whether or not the same acquisition proposal as that referred to above), provided that for purposes of the
foregoing, all references in the definition of acquisition proposal to “twenty percent (20%)” will instead refer to “fifty percent (50%).” In
such case, the termination fee must be paid to Meridian on the earlier of the date Independent enters into such definitive agreement and the
date of consummation of such transaction.
Effect of Termination",128,129
"Meridian Bancorp, Inc._20210622_DEFM14A_19361639_4244116.Pdf",Effect of Termination,"Effect of Termination
If the merger agreement is terminated, it will become void and have no effect, except that none of the parties will be relieved or released from any liabilities
or damages arising out of its fraud or any willful and material breach of any provision of the merger agreement; provided that in no event will a party be
liable for any punitive damages. For purposes of the merger agreement, “willful and material breach” means a material breach that is a consequence of an
act undertaken by the breaching party with the knowledge (actual or constructive) that the taking of such act would, or would be reasonably expected to,
cause a breach of the merger agreement.
Waiver or Amendment of the Merger Agreement",129,129
"Meridian Bancorp, Inc._20210622_DEFM14A_19361639_4244116.Pdf",Waiver or Amendment of the Merger Agreement,"Waiver or Amendment of the Merger Agreement
Subject to compliance with applicable law, the merger agreement may be amended by the parties at any time before or after the receipt of the requisite
Independent vote or the requisite Meridian vote, except that after the receipt of the requisite Independent vote or the requisite Meridian vote, there may
not be, without further approval of Independent shareholders or Meridian stockholders, as applicable, any amendment of the merger agreement that
requires such further approval under applicable law.
At any time prior to the effective time, each of the parties may, to the extent legally allowed, extend the time for the performance of any of the obligations
or other acts of the other parties, waive any inaccuracies in the representations and warranties of the other parties contained in the merger agreement or
in any document delivered by such other parties pursuant to the merger agreement, and waive compliance with any of the agreements or satisfaction of
any conditions for its benefit contained in the merger agreement, except that after the receipt of the requisite Independent vote or the requisite Meridian
vote, there may not be, without further approval of Independent shareholders or Meridian stockholders, as applicable, any extension or waiver of the
merger agreement or any portion thereof that requires such further approval under applicable law.
Fees and Expenses",129,129
"Meridian Bancorp, Inc._20210622_DEFM14A_19361639_4244116.Pdf",Fees and Expenses,"Fees and Expenses
Except as otherwise described above, each party will bear all expenses incurred by it in connection with the merger agreement and the transactions it
contemplates, including fees and expenses of its own financial
 
118Table of Contents
consultants, accountants and legal counsel, provided that nothing contained in the merger agreement shall limit either party’s rights to recover any
liabilities or damages arising out of the other party’s willful breach of any provision of the merger agreement.
Governing Law",129,130
"Meridian Bancorp, Inc._20210622_DEFM14A_19361639_4244116.Pdf",Governing Law,"Governing Law
The merger agreement is governed by and will be construed in accordance with the laws of the Commonwealth of Massachusetts, without regard to any
applicable conflicts of law principles.
Specific Performance",130,130
"Meridian Bancorp, Inc._20210622_DEFM14A_19361639_4244116.Pdf",Specific Performance,"Specific Performance
Independent and Meridian will be entitled to an injunction or injunctions to prevent breaches or threatened breaches of the merger agreement or to
enforce specifically the performance of the terms and provisions of the merger agreement (including the parties’ obligations to consummate the merger),
in addition to any other remedy to which they are entitled at law or in equity.
 
119Table of Contents
VOTING AGREEMENTS",130,131
"Meridian Bancorp, Inc._20210622_DEFM14A_19361639_4244116.Pdf",VOTING AGREEMENTS,"VOTING AGREEMENTS
The following section summarizes material provisions of the separate voting agreements (each, a “voting agreement”), dated as of April 22, 2021, by and
between Independent and the directors and executive officers of Meridian. A form of the voting agreements is attached to this proxy statement as
Annex D and is incorporated by reference herein in its entirety, and qualifies the following summary in its entirety. The rights and obligations of parties to
the voting agreements are governed by the voting agreement and not by this summary or any other information contained in or incorporated by reference
into this joint proxy statement/prospectus. Independent shareholders and Meridian stockholders are urged to read the form of voting agreement carefully
and in its entirety, as well as this joint proxy statement/prospectus and the information incorporated by reference into this joint proxy
statement/prospectus, before making any decisions regarding the proposals.
Pursuant to the separate voting agreements between Independent and each of the Meridian directors and executive officers, which were executed
concurrently with the execution of the merger agreement, the directors and executive officers of Meridian agreed, with respect to shares of Meridian
common stock that they own solely or jointly or have direct or indirect control over, to:
 
 
•
 restrict their ability to sell, transfer, pledge, assign or dispose of their shares of Meridian common stock during the term of the voting
agreement;
 
 
•
 appear at the Meridian stockholder meeting or otherwise cause their shares of Meridian common stock to be counted as present at the
stockholder meeting for purposes of calculating a quorum;
 
 
•
 vote their shares of Meridian common stock in favor of adoption and approval of the merger agreement and the transactions it
contemplates;
 
 
•
 vote their shares of Meridian common stock against any action or agreement that would reasonably be expected to result in a breach of any
covenant, representation or warranty, or other obligation or agreement, of Meridian contained in the merger agreement or of the director or
executive officer contained in his or her respective voting agreement;
 
 
•
 vote their shares of Meridian common stock against any proposal to acquire Meridian by any person other than Independent or against any
action, agreement or transaction that is intended, or could reasonably be expected, to impede, interfere or be inconsistent with, delay,
postpone, discourage or materially and adversely affect the consummation of the transactions contemplated by the merger agreement; and
 
 
•
 not to vote or execute any written consent to rescind or amend in any manner any prior vote or written consent, as a stockholder of
Meridian, to approve or adopt the merger agreement unless the merger agreement is terminated in accordance with its terms.
The voting agreements were executed as a condition of Independent’s willingness to enter into the merger agreement.
On the record date of June 17, 2021, these directors and executive officers solely or jointly and directly or indirectly owned an aggregate of 1,868,586
shares, which they have agreed to vote in favor of the merger agreement at the Meridian stockholder meeting. These shares represent approximately
3.55% of the outstanding shares of Meridian common stock.
No separate consideration was paid to any of the directors or executive officers for entering into these voting agreements. However, the directors and
executive officers of Meridian may be deemed to have interests in the merger as directors and executive officers that are different from or in addition to
those of other Meridian stockholders. See “The Merger—Interests of Meridian’s Executive Officers and Directors in the Merger” beginning on page 88 of
this proxy statement/prospectus.
 
120Table of Contents
MATERIAL U.S. FEDERAL INCOME TAX CONSEQUENCES OF THE MERGER AND THE HOLDCO MERGER",131,132
"Meridian Bancorp, Inc._20210622_DEFM14A_19361639_4244116.Pdf",MATERIAL U.S. FEDERAL INCOME TAX CONSEQUENCES OF THE MERGER AND THE HOLDCO MERGER,"MATERIAL U.S. FEDERAL INCOME TAX CONSEQUENCES OF THE MERGER AND THE HOLDCO MERGER
The following section describes the anticipated material U.S. federal income tax consequences of the merger and the holdco merger to U.S. holders (as
defined below) of Meridian common stock. This discussion addresses only those holders that hold their Meridian common stock as a capital asset within
the meaning of Section 1221 of the Code (generally, property held for investment), and does not address all of the U.S. federal income tax consequences
that may be relevant to particular holders in light of their individual circumstances or to holders that are subject to special rules, such as, for example:
 
 
•
 financial institutions;
 
 
•
 insurance companies;
 
 
•
 retirement plans;
 
 
•
 individual retirement and other tax-deferred accounts;
 
 
•
 mutual funds;
 
 
•
 persons subject to the alternative minimum tax provisions of the Code;
 
 
•
 entities treated as partnerships or other flow-through entities for U.S. federal income tax purposes or investors in such partnerships or other
flow-through entities;
 
 
•
 tax-exempt organizations or government organizations;
 
 
•
 dealers or brokers in securities or foreign currencies;
 
 
•
 controlled foreign corporations or passive foreign investment companies;
 
 
•
 persons whose functional currency is not the U.S. dollar;
 
 
•
 traders in securities that elect to use a mark to market method of accounting;
 
 
•
 regulated investment companies, real estate investment trusts and regulated mortgage investment conduits;
 
 
•
 persons whose Meridian common stock is qualified small business stock for purposes of Section 1202 of the Code;
 
 
•
 certain former U.S. citizens or long-term residents of the United States;
 
 
•
 persons that immediately before the merger actually or constructively own at least five percent of Meridian common stock (by vote or
value);
 
 
•
 persons required to accelerate the recognition of any item of gross income as a result of such income being recognized on an applicable
financial statement;
 
 
•
 persons that hold Meridian common stock as part of a straddle, hedge, constructive sale or conversion transaction; or
 
 
•
 persons who acquired their shares of Meridian common stock through the exercise of an employee stock option or otherwise as
compensation, through the exercise of warrants, or through a tax-qualified retirement plan.
In addition, this discussion does not address the tax consequences of the merger and the holdco merger to holders of Meridian stock other than U.S.
holders.
The following is based upon the Code, its legislative history, Treasury regulations promulgated pursuant to the Code and published rulings and
decisions, all as currently in effect as of the date of this document, and all of which are subject to change, possibly with retroactive effect, and to differing
interpretations. Any such change or
 
121Table of Contents
differing interpretation could affect the accuracy of the statements and conclusions set forth in this discussion. Tax considerations under state, local and
foreign laws, or federal laws other than those pertaining to U.S. federal income tax, and any tax consequences arising under the unearned income
Medicare contribution tax, are not addressed in this discussion.
For purposes of this discussion, the term “U.S. holder” means a beneficial owner of Meridian common stock that is:
 
 
•
 an individual U.S. citizen or resident, as determined for U.S. federal income tax purposes;
 
 
•
 a corporation, or other entity taxable as a corporation for U.S. federal income tax purposes, created or organized in or under the laws of the
United States or any of its political subdivisions;
 
 
•
 a trust that is a U.S. resident trust for U.S. federal income tax purposes, i.e., a trust if (i) a court within the United States is able to exercise
primary supervision over the administration of the trust and the control over all substantial decisions of such trust is vested in one or more
U.S. persons or (ii) such trust has a valid election in effect under applicable U.S. Treasury regulations to be treated as a U.S. person for U.S.
federal income tax purposes; or
 
 
•
 an estate the income of which is subject to U.S. federal income tax regardless of its source.
If an entity or arrangement treated as a partnership for U.S. federal income tax purposes holds Meridian common stock, the U.S. federal income tax
consequences of a partner in such a partnership generally will depend on the status of the partner and the activities of the partnership. Any entity treated
as a partnership for U.S. federal income tax purposes that holds Meridian common stock, and any partners in such partnership, should consult their own
tax advisors regarding the tax consequences of the merger and the holdco merger to their specific circumstances.
The following discussion is a summary of material U.S. federal income tax consequences of the merger and the holdco merger under current law and is
for general information only. This discussion is not intended to be tax advice to any particular holder of Meridian common stock. Tax matters regarding
the merger and the holdco merger are complicated, and the tax consequences of the merger and the holdco merger to each Meridian stockholder will
depend on their particular situation. Meridian stockholders are urged to consult their tax advisors as to the particular tax consequences of the merger
and the holdco merger to them, including the application and effect of state, local, federal, foreign and other tax laws.
Tax Consequences of the Merger Generally",132,133
"Meridian Bancorp, Inc._20210622_DEFM14A_19361639_4244116.Pdf",Tax Consequences of the Merger Generally,"Tax Consequences of the Merger Generally
Independent and Meridian have structured the merger and the holdco merger, taken together, to qualify as a reorganization within the meaning of
Section 368(a) of the Code, and it is anticipated that they will qualify as such. It is a condition to Independent’s obligation to complete the merger that
Independent receive an opinion of its legal counsel, Wachtell, Lipton, Rosen & Katz, dated as of the closing date of the merger, to the effect that the
merger and the holdco merger, taken together, will be treated as a reorganization within the meaning of Section 368(a) of the Code. It is a condition to
Meridian’s obligation to complete the merger that Meridian receive an opinion of its legal counsel, Luse Gorman, PC, dated as of the closing date of the
merger, to the effect that the merger and the holdco merger, taken together, will be treated as a reorganization within the meaning of Section 368(a) of the
Code. These opinions will be based on, among other things, certain facts, assumptions, representations, warranties and covenants, including those
contained in the merger agreement and in letters and certificates provided by Meridian and Independent. If any of the facts, assumptions,
representations, warranties or covenants upon which the opinions are based are inaccurate or inconsistent with the actual facts, the U.S. federal income
tax consequences of the merger and the holdco merger could be adversely affected. None of the tax opinions given in connection with the merger and the
holdco merger or the opinions described below will be binding on the Internal Revenue Service. Neither Independent nor Meridian has requested or
intends to request any ruling from the Internal Revenue Service as to the U.S. federal income tax consequences of the merger and
 
122Table of Contents
the holdco merger. Consequently, no assurance can be given that the Internal Revenue Service will not assert, or that a court would not sustain, a
position contrary to any of those set forth below.
Assuming that the merger and the holdco merger, taken together, qualify as a reorganization within the meaning of Section 368(a) of the Code, the material
U.S. federal income tax consequences of the merger and the holdco merger will generally be as follows:
