Document,Section Header,Section Text,Start Page,End Page
Buyer or any of its Subsidiaries, has reported evidence of a material violation of securities Laws, breach of fiduciary duties, or similar violation by Buyer
or any of its officers, directors, employees, or agents to the board of directors of Buyer or any committee of the board of directors or to any director or
officer of Buyer.
Section 4.07 Financial Statements; Undisclosed Liabilities.
(a) The financial statements of Buyer (including any related notes and schedules) included in the Buyer Reports complied as to form, as of
their respective dates of filing with the SEC (or, if amended or superseded by a subsequent filing prior to the date of this Agreement, as of the date of
such subsequent filing), in all material respects, with all applicable accounting requirements and with the published rules and regulations of the SEC
(except, in the case of unaudited statements, as permitted by the rules of the SEC), have been prepared in accordance with GAAP applied on a consistent
basis during the periods involved (except as may be expressly disclosed in the financial statements or in the notes to them), and fairly present, in all
material respects, the consolidated financial position of Buyer and its Subsidiaries and the consolidated results of operations, changes in shareholders’
equity and cash flows of Buyer and its Subsidiaries as of the dates and for the periods shown. The books and records of Buyer and its Subsidiaries have
been, and are being, maintained in all material respects in accordance with GAAP and any other applicable legal and accounting requirements and reflect
only actual transactions.
(b) Except for (i) those liabilities that are fully reflected or reserved for in the audited consolidated financial statements of Buyer included in
its Annual Report filed on Form 10-K for the fiscal year ended December 31, 2020, as filed with the SEC, (ii) liabilities or obligations incurred in the
ordinary course of business since December 31, 2020 in amounts consistent with past practice (including such liabilities contained in the Buyer Reports);
(iii) liabilities that have been discharged or paid in full before the Effective Date; or (iv) liabilities or obligations incurred directly as a result of this
Agreement, neither Buyer nor any of its Subsidiaries has incurred any liability of any nature whatsoever (whether absolute, accrued, or contingent or
otherwise and whether due or to become due), and there is no existing condition, situation or set of circumstances that would reasonably be expected to
result in such a liability that, either alone or when combined with all other liabilities of a type not described in clause (i) or (ii), has had, or would be
reasonably expected to have, a Material Adverse Effect with respect to Buyer.
(c) Ernst and Young LLP, which has expressed its opinion with respect to the financial statements of Buyer and its Subsidiaries (including
the related notes), is and has been throughout the periods covered by such
 
A-30
Table of Contents
financial statements “independent” with respect to Buyer within the meaning of the rules of applicable bank regulatory authorities and the Public
Company Accounting Oversight Board.
Section 4.08 Regulatory Approvals; No Defaults.
(a) No consents or approvals of, or waivers by, or filings or registrations with, any Governmental Authority or with any third party are
required to be made or obtained by Buyer or any of its Subsidiaries or Affiliates in connection with the execution, delivery, or performance by Buyer of
this Agreement, or to consummate the transactions contemplated by this Agreement (including the Holdco Merger and the Bank Merger), except for (i) as
applicable, filings of, applications or notices with, and consents, approvals or waivers by, or the making of satisfactory arrangements with, the FRB, the
FDIC, the Massachusetts Housing Partnership Fund, the Massachusetts Commissioner of Banks; (ii) the Requisite Buyer Shareholder Approval; (iii) the
approval of the Holdco Merger by Buyer, as sole shareholder of the Interim Surviving Entity, (iv) the approval of the Bank Merger and Plan of Bank
Merger by Buyer, as sole shareholder of Buyer Bank, (v) the filing and effectiveness of the Registration Statement with the SEC; (vi) the approval of the
listing on Nasdaq of the Buyer Common Stock to be issued in the Merger (vii) the filing of the Articles of Merger with the Maryland Department of
Assessments and Taxation and (viii) the filing of the Articles of Holdco Merger with the Secretary of the Commonwealth of Massachusetts and the
Maryland Department of Assessments and Taxation. To Buyer’s Knowledge as of the date of this Agreement, there is no fact or circumstance relating to
Buyer that could reasonably be expected to result in any of the approvals set forth above and referred to in Section 6.01(b) not being received in order to
permit consummation of the Merger, the Holdco Merger and Bank Merger on a timely basis or will include a Burdensome Condition as defined in
Section 5.06(a).
(b) Subject to receipt, or the making, of the consents, approvals, waivers and filings referred to in the immediately preceding paragraph and
the expiration of the related waiting periods, the execution, delivery, and performance of this Agreement by Buyer, Merger Sub and Buyer Bank, as
applicable, and the consummation of the transactions contemplated by this Agreement do not and will not (i) constitute a breach or violation of, or a
default under, the articles of organization or bylaws (or similar governing documents) of Buyer or any of its Subsidiaries or Affiliates, (ii) violate any
statute, code, ordinance, rule, regulation, judgment, order, writ, decree or injunction applicable to Buyer or any of its Subsidiaries, or any of their
respective properties or assets or (iii) violate, conflict with, result in a breach of any provision of or the loss of any benefit under, constitute a default (or
an event which, with notice or lapse of time, or both, would constitute a default) under, result in the termination of or a right of termination or cancellation
under, accelerate the performance required by, or result in the creation of any Lien upon any of the respective properties or assets of Buyer or any of its
Subsidiaries or Affiliates under, any of the terms, conditions, or provisions of any note, bond, mortgage, indenture, deed of trust, license, lease, contract,
agreement or other instrument or obligation to which Buyer or any of its Subsidiaries or Affiliates is a party, or by which they or any of their respective
properties or assets may be bound or affected, except, in the case of clauses (ii) and (iii) above, for violations, conflicts, breaches, defaults, terminations,
cancellations, accelerations or creations which would not reasonably be expected to have, either individually or in the aggregate, a Material Adverse
Effect with respect to Buyer.
Section 4.09 Agreements with Regulatory Agencies. Neither Buyer nor any of its Subsidiaries is subject to any cease-and-desist or other order
issued by, or is a party to any written agreement, consent agreement or memorandum of understanding with, or is a party to any commitment letter or
similar undertaking to, or is a recipient of any extraordinary supervisory letter from, or is subject to any order or directive by, or has adopted any board
resolutions at the request of any Governmental Authority that currently restricts in any material respect the conduct of its business or that in any manner
relates to its capital adequacy, its credit or risk management policies, its dividend policies, its management, its business or its operations (each, a “Buyer
Regulatory Agreement”), nor has Buyer or any of its Subsidiaries been advised in writing or orally, by any Governmental Authority that it is considering
issuing, initiating, ordering, or requesting any Buyer Regulatory Agreement. To Buyer’s Knowledge, there are no investigations relating to any material
regulatory matters pending before any Governmental Authority with respect to Buyer or any of its Subsidiaries.
 
A-31
Table of Contents
Section 4.10 Absence of Certain Changes or Events. Except as reflected in Buyer’s audited balance sheet as of December 31, 2020 or in the Buyer
Reports filed prior to the date of this Agreement, since December 31, 2020, there has been no change or development or combination of changes or
developments which, individually or in the aggregate, has had or is reasonably expected to have a Material Adverse Effect with respect to Buyer or its
Subsidiaries, and to Buyer’s Knowledge, no fact or condition exists which is reasonably likely to cause a Material Adverse Effect with respect to Buyer in
the future.
Section 4.11 Compliance With Laws.
(a) Buyer and each of its Subsidiaries is and since December 31, 2017 has been in compliance with all applicable federal, state, local statutes,
Laws, regulations, ordinances, rules, judgments, orders, or decrees or applicable to Buyer, its Subsidiaries and their respective employees, including
without limitation, all Laws related to data protection or privacy, the USA PATRIOT Act, the Bank Secrecy Act, the Equal Credit Opportunity Act, the Fair
Housing Act, the Community Reinvestment Act, the Fair Credit Reporting Act, the Truth in Lending Act and any other Law relating to discriminatory
lending, financing or leasing practices, Sections 23A and 23B of the Federal Reserve Act, the Sarbanes-Oxley Act, and the Dodd-Frank Act.
(b) Buyer and each of its Subsidiaries has all material permits, licenses, authorizations, orders, and approvals of, and have made all filings,
applications and registrations with, all Governmental Authorities that are required in order to permit it to own or lease their properties and to conduct their
business as presently conducted; all such permits, licenses, certificates of authority, orders, and approvals are in full force and effect and, to Buyer’s
Knowledge, no suspension or cancellation of any of them is threatened.
(c) Neither Buyer nor any of its Subsidiaries has received, since December 31, 2017, notification or communication from any Governmental
Authority (i) asserting that it is not in compliance with any of the statutes, regulations, or ordinances which such Governmental Authority enforces or
(ii) threatening to revoke any license, franchise, permit, or governmental authorization (nor, to Buyer’s Knowledge, do any grounds for any of the
foregoing exist).
Section 4.12 Joint Proxy Statement-Prospectus Information; Registration Statement. As of the date of the Joint Proxy Statement-Prospectus and the
date of the Buyer Meeting to which such Joint Proxy Statement-Prospectus relates, none of the information supplied or to be supplied by Buyer
specifically for inclusion or incorporation by reference in the Joint Proxy Statement-Prospectus and the Registration Statement, or any amendment or
supplement thereto, will contain any untrue statement of a material fact or omit to state a material fact necessary to make the statements contained in the
Joint Proxy Statement-Prospectus, as so amended or supplemented, in light of the circumstances under which they were made, not misleading; provided,
however, that that information as of a later date shall be deemed to modify information as of an earlier date. Notwithstanding the foregoing, no
representation or warranty is made by Buyer with respect to statements made or incorporated by reference therein based on information provided or
supplied by or on behalf of Company or its Subsidiaries for inclusion in the Joint Proxy Statement-Prospectus.
Section 4.13 Legal Proceedings.
(a) Neither Buyer nor any of its Subsidiaries is a party to any, nor are there any pending or, to Buyer’s Knowledge, threatened, civil,
criminal, administrative or regulatory actions, suits, demand letters, claims, hearings, notices of violation, arbitrations, investigations, orders to show
cause, market conduct examinations, notices of non-compliance or other proceedings of any nature against Buyer or any of its Subsidiaries that would
reasonably be expected to have, either individually or in the aggregate, a Material Adverse Effect with respect to Buyer, or challenge the validity or
propriety of the transactions contemplated by this Agreement.
(b) There is no injunction, order, judgment, or decree imposed upon Buyer, any of its Subsidiaries, or the assets of Buyer or any of its
Subsidiaries, and neither Buyer nor any of its Subsidiaries has been advised of, or is aware of, the threat of any action.
 
A-32
Table of Contents
Section 4.14 Brokers. Except for the fees and expenses of Keefe, Bruyette & Woods, Inc. (which will be paid by Buyer), none of Buyer, Merger Sub
Buyer Bank, or any of their officers or directors has employed any broker or finder or incurred any liability for any broker’s fees, commissions or finder’s
fees in connection with any of the transactions contemplated by this Agreement.
Section 4.15 Employee Benefit Plans.
(a) All benefit and compensation plans, contracts, policies, or arrangements (whether or not written) (i) covering current or former
employees of Buyer or any of its Subsidiaries, (ii) covering current or former directors of Buyer or any of its Subsidiaries, or (iii) with respect to which
Buyer or any Subsidiary has or may have any liability or contingent liability (including liability arising from affiliation under Section 414 of the Code or
Section 4001 of ERISA) including, but not limited to, “employee benefit plans” within the meaning of Section 3(3) of ERISA, and deferred compensation,
stock option, stock purchase, stock appreciation rights, stock based, incentive and bonus plans (the “Buyer Benefit Plans”), are identified on Buyer
Disclosure Schedule 4.15(a). True and complete copies of all Buyer Benefit Plans including, but not limited to, any trust instruments and insurance
contracts forming a part of any Buyer Benefit Plans and all amendments to them, IRS Forms 5500 (for the three most recently completed plan years),
current summary plan descriptions, and the most recent IRS determination or opinion letters with respect to them, have been made available to Company,
in each case, to the extent applicable.
(b) All Buyer Benefit Plans are in compliance in form and operation with all applicable Laws, including ERISA and the Code. Each Buyer
Benefit Plan which is an “employee pension benefit plan” within the meaning of Section 3(2) of ERISA (a “Buyer Pension Plan”) and which is intended to
be qualified under Section 401(a) of the Code, has received a favorable determination or opinion letter from the IRS that is currently in effect, and no
circumstance exists could result in revocation of any such favorable determination letter or the loss of the qualification of the Buyer Pension Plan under
Section 401(a) of the Code. There is no pending or, to Buyer’s Knowledge, threatened litigation relating to the Buyer Benefit Plans. Neither Buyer nor any
of its Subsidiaries has engaged in, or is aware of, a transaction with respect to any Buyer Benefit Plan or Buyer Pension Plan that, assuming the taxable
period of the transaction expired as of the date of this Agreement, could subject Buyer or any of its Subsidiaries to a tax or penalty imposed by either
Section 4975 of the Code or Section 502(i) of ERISA.
(c) Except as described in Buyer Disclosure Schedule 4.15(c), no liability under Subtitle C or D of Title IV of ERISA has been or is expected
to be incurred by Buyer or any of its Subsidiaries with respect to any ongoing, frozen or terminated “single employer plan,” within the meaning of
Section 4001(a)(15) of ERISA (including any multiple employer plan as described in 29 C.F.R. Section 4001.2), currently or formerly maintained or
contributed to by Buyer, any of its Subsidiaries or any ERISA Affiliate. Neither Buyer nor any ERISA Affiliate has contributed to (or been obligated to
contribute to) a “multiemployer plan” within the meaning of Section 3(37) of ERISA at any time during the six-year period ending on the Closing Date, and
neither Buyer nor any of its Subsidiaries has incurred, and does not expect to incur, any withdrawal liability with respect to a multiemployer plan under
Subtitle E of Title IV of ERISA (regardless of whether based on contributions of an ERISA Affiliate). No notice of a “reportable event,” within the meaning
of Section 4043 of ERISA for which the 30-day reporting requirement has not been waived, has been required to be filed for any Buyer Pension Plan or by
any ERISA Affiliate within the 36 month period ending on the date hereof or will be required to be filed in connection with the transactions contemplated
by this Agreement.
(d) All contributions required to be made with respect to all Buyer Benefit Plans have been timely made or have been reflected on the
financial statements of Buyer to the extent required by GAAP. No Buyer Pension Plan or single-employer plan of an ERISA Affiliate has an “accumulated
funding deficiency” (whether or not waived) within the meaning of Section 412 of the Code or Section 302 of ERISA or has otherwise failed to satisfy the
minimum funding requirements of Section 412 of the Code or Sections 302 and 303 of ERISA, and none of Buyer or any ERISA Affiliate has an
outstanding funding waiver. No Buyer Benefit Plan is considered to be an “at-risk” plan within the meaning of Section 430 of the Code or Section 303 of
ERISA.
 
A-33
Table of Contents
(e) To Buyer’s Knowledge, other than as set forth on Buyer Disclosure Schedule Section 4.15(e), neither Buyer nor any of its Subsidiaries
has any material obligations for retiree health or life benefits under any Buyer Benefit Plan, other than coverage as may be required under Section 4980B
of the Code or Part 6 of Title I of ERISA, or under the continuation of coverage provisions of the Laws of any state or locality. All Buyer Benefit Plans
that are group health plans have been, in all material respects, operated in compliance with the group health plan continuation requirements of
Section 4980B of the Code and Sections 601-609 of ERISA, the certification of prior coverage and other requirements of Sections 701-702 and 711-713 of
ERISA and the terms and conditions of the Patient Protection and Affordable Care Act.
(f) No Buyer Benefit Plan provides for the gross-up or reimbursement of Taxes under Section 4999 of the Code. The execution of this
Agreement, stockholder approval of this Agreement or consummation of any of the transactions contemplated by this Agreement will not constitute a
change in control, as such term is defined under any applicable Buyer Benefit Plan.
(g) To Buyer’s Knowledge, Buyer and its Subsidiaries have correctly classified all individuals who directly or indirectly perform services for
Buyer or any of its Subsidiaries for purposes of each Buyer Benefit Plan, ERISA, the Code, tax withholding, unemployment compensation Laws, workers’
compensation Laws and all other applicable Laws.
Section 4.16 Labor Matters; Employment.
(a) Neither Buyer nor any of its Subsidiaries is a party to or bound by any collective bargaining agreement, contract, or other agreement or
understanding with a labor union or labor organization, nor is there any proceeding pending or, to Buyer’s Knowledge threatened, asserting that Buyer or
any of its Subsidiaries has committed an unfair labor practice (within the meaning of the National Labor Relations Act) or seeking to compel Buyer or any
of its Subsidiaries to bargain with any labor organization as to wages or conditions of employment, nor is there any strike or other labor dispute involving
it pending or, to Buyer’s Knowledge, threatened, nor, to Buyer’s Knowledge, any activity involving its employees seeking to certify a collective
bargaining unit or engaging in other organizational activity.
(b) Buyer and its Subsidiaries are in compliance in all material respects with, and since December 31, 2017 have complied in all material
respects with, all Laws regarding employment and employment practices, terms and conditions of employment, wages and hours, plant closing
notification, classification of employees and independent contractors, equitable pay practices, privacy right, labor disputes, employment discrimination,
sexual harassment or discrimination, workers’ compensation or long-term disability policies, retaliation, immigration, family and medical leave,
occupational safety and health and other Laws in respect of any reduction in force (including notice, information and consultation requirements).
(c) (i) To Buyer’s Knowledge, no written allegations of sexual harassment or sexual misconduct have been made in the past five (5) years
against any person who is a current member of the Board of Directors of Buyer or a current officer of Buyer or its Subsidiaries categorized at or above
Senior Vice President, (ii) in the past five (5) years neither Buyer nor any of its Subsidiaries has entered into any settlement agreement related to
allegations of sexual harassment or sexual misconduct by any current member of the Board of Directors of Buyer or any current officer at or above Senior
Vice President, and (iii) there are no proceedings currently pending or, to the Knowledge of Buyer, threatened related to any allegations of sexual
harassment or sexual misconduct by any current member of the board of directors of Buyer, any current Section 16 officer or any Senior Vice President.
Section 4.17 Tax Matters.
(a) Buyer and each of its Subsidiaries has timely filed all income, franchise, and other material Tax Returns that it was required to file under
applicable Laws prior to the Effective Time, other than Tax Returns that
 
A-34
Table of Contents
are not yet due or for which a request for extension was filed consistent with requirements of applicable Laws. All such Tax Returns are correct and
complete in all material respects and were prepared in substantial compliance with all applicable Laws. All Taxes due and owing by Buyer or any of its
Subsidiaries (whether or not shown on any Tax Return) have been timely paid, other than any Taxes that have been reserved or accrued on the balance
sheet of Buyer or which Buyer is contesting in good faith. Neither Buyer nor any Subsidiary is the beneficiary of any extension of time within which to
file any Tax Return, and neither Buyer nor any of its Subsidiaries currently has any open tax years for which the applicable statute of limitations has been
extended or suspended. No written claim has ever been made by an authority in a jurisdiction where Buyer or any Subsidiary does not file Tax Returns
that it is or may be subject to taxation by, or required to file a Tax Return in, that jurisdiction. There are no Liens for Taxes (other than statutory liens for
Taxes not yet due and payable, or Taxes that are being contested in good faith and for which adequate provision has been made on the balance sheet of
Buyer) upon any of the assets of Buyer or any of its Subsidiaries.
(b) Buyer and each Subsidiary has withheld and paid all Taxes required to have been withheld and paid in connection with any amounts
paid or owing to any employee, independent contractor, creditor, shareholder, or other third party.
(c) No foreign, federal, state, or local Tax audits or administrative or judicial Tax proceedings are being conducted or to Buyer’s Knowledge
are pending or threatened with respect to Buyer or any Subsidiary. Other than with respect to audits that have already been completed and resolved,
neither Buyer nor any of its Subsidiaries has received from any foreign, federal, state, or local Taxing Authority (including jurisdictions where Buyer or its
Subsidiaries has not filed Tax Returns) any (i) notice indicating an intent to open an audit or other review, (ii) request for information related to Tax
matters, or (iii) written notice of deficiency or proposed adjustment for any amount of Tax proposed, asserted, or assessed by any Taxing Authority
against Buyer or any of its Subsidiaries.
(d) Buyer and each Subsidiary have timely and properly taken such actions in response to and in compliance with notices Buyer or any
Subsidiary has received from the IRS in respect of information reporting and backup and nonresident withholding as are required by Law. Buyer has not
waived any statute of limitations in respect of Taxes or agreed to any extension of time with respect to a Tax assessment or deficiency and no request to
waive or extend such a statute of limitations or time period has been filed or is currently pending.
(e) Neither Buyer nor any Subsidiary has been a United States real property holding corporation within the meaning of Section 897(c)(2) of
the Code during the applicable period specified in Section 897(c)(1)(A)(ii) of the Code.
(f) The unpaid Taxes of Buyer and each Subsidiary (i) did not, as of December 31, 2020, exceed the reserve for Tax liability (which is distinct
and different from any reserve for deferred Taxes established to reflect timing differences between book and Tax income) set forth on the face of the
financial statements of Buyer as of December 31, 2020 (rather than in any notes to such financial statements), and (ii) do not exceed that reserve as
adjusted for the passage of time through the Effective Time in accordance with the past practice of Buyer in filing its Tax Returns. Since December 31,
2020 neither Buyer nor any Subsidiary has incurred any liability for Taxes arising from extraordinary gains or losses, as that term is used in GAAP.
(g) Buyer and each Subsidiary have disclosed on its federal income Tax Returns all positions taken therein that could give rise to a
