Document,Section Header,Section Text,Start Page,End Page
"Nuance Communications, Inc._20210517_DEFM14A_19281720_4221662.Pdf",TERMS OF THE MERGER AGREEMENT,"TERMS OF THE MERGER AGREEMENT
The following summary describes certain material provisions of the merger agreement. The descriptions of the
merger agreement in this summary and elsewhere in this proxy statement are not complete and are qualified in their
entirety by reference to the merger agreement, a copy of which is attached to this proxy statement as Annex A and
incorporated into this proxy statement by reference. We encourage you to read the merger agreement carefully and
in its entirety because this summary may not contain all the information about the merger agreement that is
important to you. The rights and obligations of the parties are governed by the express terms of the merger
agreement and not by this summary or any other information contained in this proxy statement.
The representations, warranties, covenants and agreements described below and included in the merger agreement
(1) were made only for purposes of the merger agreement and as of specific dates; (2) were made solely for the
benefit of the parties to the merger agreement; (3) may be subject to important qualifications, limitations and
supplemental information agreed to by Nuance, Microsoft and Sub in connection with negotiating the terms of the
merger agreement; and (4) may also be subject to a contractual standard of materiality different from those
generally applicable to reports and documents filed with the SEC and in some cases were qualified by confidential
matters disclosed to Microsoft and Sub by Nuance in connection with the merger agreement. In addition, the
representations and warranties may have been included in the merger agreement for the purpose of allocating
contractual risk between Nuance, Microsoft and Sub rather than to establish matters as facts, and may be subject
to standards of materiality applicable to such parties that differ from those applicable to investors. Further, the
representations and warranties were negotiated with the principal purpose of establishing the circumstances in
which a party to the merger agreement may have the right not to consummate the merger if the representations and
warranties of the other party prove to be untrue due to a change in circumstance or otherwise. Nuance
stockholders are not third-party beneficiaries under the merger agreement and should not rely on the
representations, warranties, covenants and agreements or any descriptions thereof as characterizations of the
actual state of facts or condition of Nuance, Microsoft or Sub or any of their respective affiliates or businesses.
Moreover, information concerning the subject matter of the representations and warranties may change after the
date of the merger agreement and subsequent developments or new information qualifying a representation or
warranty may have been included in this proxy statement. In addition, you should not rely on the covenants in the
merger agreement as actual limitations on the respective businesses of Nuance, Microsoft and Sub, because the
parties may take certain actions that are either expressly permitted in the confidential disclosure letter to the
merger agreement or as otherwise consented to by the appropriate party, which consent may be given without prior
notice to the public. The merger agreement is described below, and included as Annex A, only to provide you with
information regarding its terms and conditions, and not to provide any other factual information regarding
Nuance, Microsoft, Sub or their respective businesses. Accordingly, the representations, warranties, covenants and
other agreements in the merger agreement should not be read alone, and you should read the information provided
elsewhere in this document and in our filings with the SEC regarding Nuance and our business.",68,68
"Nuance Communications, Inc._20210517_DEFM14A_19281720_4221662.Pdf",Closing and Effective Time of the Merger,"Closing and Effective Time of the Merger
The closing of the merger will take place no later than the third business day following the satisfaction or waiver of all
conditions to closing of the merger (described in the section of this proxy statement captioned “Terms of the Merger
Agreement - Conditions to the Closing of the Merger” beginning on page 73), other than conditions that by their
terms are to be satisfied at the closing of the merger, but subject to the satisfaction or waiver of each of such
conditions, or such other time agreed to in writing by Microsoft, Nuance and Sub. Concurrently with the closing of
the merger, the parties will file a certificate of merger with the Secretary of State of the State of Delaware as provided
under the DGCL. The merger will become effective upon the filing of a certificate of merger, or at such later time
agreed to in writing by the parties and specified in such certificate of merger.
Effects of the Merger; Certificate of Incorporation; Bylaws; Directors and Officers",68,68
"Nuance Communications, Inc._20210517_DEFM14A_19281720_4221662.Pdf",Effects of the Merger; Certificate of Incorporation; Bylaws; Directors and Officers,"Effects of the Merger; Certificate of Incorporation; Bylaws; Directors and Officers
The merger agreement provides that, subject to the terms and conditions of the merger agreement, and in accordance
with the DGCL, at the effective time of the merger, (1) Sub will be merged with and into Nuance and Nuance will
become a wholly owned subsidiary of Microsoft and (2) the separate corporate existence of Sub will cease. From and
after the effective time of the merger, all of the property, rights, privileges, powers and franchises of Nuance and Sub
will vest in the surviving corporation, and all of the debts, liabilities and duties of Nuance and Sub will become the
debts, liabilities and duties of the surviving corporation.
59TABLE OF CONTENTS
At the effective time of the merger, the certificate of incorporation of Nuance as the surviving corporation will be
amended and restated in its entirety in the form attached to the merger agreement. The parties will take all necessary
action to ensure that, at the effective time of the merger, the bylaws of Sub, as in effect immediately prior to the
effective time of the merger, will become the bylaws of the surviving corporation, until thereafter amended.
The parties will take all necessary action to ensure that, effective as of, and immediately following, the effective time
of the merger, the board of directors of the surviving corporation will consist of the directors of Sub as of immediately
prior to the effective time of the merger, to hold office in accordance with the certificate of incorporation and bylaws
of the surviving corporation until their successors are duly elected or appointed and qualified. The parties will take all
necessary action to ensure that at the effective time of the merger, the officers of the Company as of immediately prior
to the effective time of the merger will be the officers of the surviving corporation, until their successors are duly
appointed.
Conversion of Shares",68,69
"Nuance Communications, Inc._20210517_DEFM14A_19281720_4221662.Pdf",Conversion of Shares,"Conversion of Shares
Common Stock
At the effective time of the merger, each outstanding share of Nuance common stock (other than shares held by (1)
Nuance as treasury stock; (2) Microsoft, Sub or their respective subsidiaries; and (3) Nuance stockholders who have
properly and validly exercised and perfected their appraisal rights under Delaware law with respect to such shares)
will be cancelled and automatically converted into the right to receive the per share merger consideration (which is
$56.00 per share, without interest thereon and subject to applicable withholding taxes).
At the effective time of the merger, each outstanding share of common stock held by (1) Nuance or (2) Microsoft, Sub
or their respective subsidiaries shall be cancelled and shall cease to exist, and no consideration shall be delivered in
exchange therefor.
Treatment of Equity Compensation
Pursuant to our equity incentive plans, we have granted equity awards with respect to Nuance common stock in the
form of stock options and stock units. Our executive officers hold RSUs, which represent a right to receive shares of
Nuance common stock based on service over a time-based vesting schedule, and PSUs, which represent a right to
receive shares of Nuance common stock ranging from 0% to 200% of the target number of shares based on both
service and achievement of performance goals for a specified performance period. Our non-employee directors hold
RSUs and DSUs, which represents a right to receive shares of Nuance common stock, subject to vesting
requirements of the underlying equity award, on a specified future date or event, such as separation from service. Our
executive officers and non-employee directors do not hold stock options. The merger agreement provides for the
treatment set forth below with respect to outstanding equity awards:
Stock Options
Each stock option that is outstanding as of immediately prior to the effective time will, at the effective time, be
cancelled and converted into the right to receive the merger consideration for each share of Nuance common stock
that would have been issuable upon exercise of the option, less the exercise price of the option and any applicable
withholding taxes. If the exercise price of a stock option is equal to or greater than the merger consideration, the
option will be cancelled as of the effective time for no consideration.
Stock Units
•
Each award of stock units that is outstanding and vested immediately prior to the effective time or that will
become vested by its terms at the effective time and, in each case, by its terms is to be settled upon the
occurrence of vesting or the effective time will, as of the effective time, be deemed to be vested and will be
cancelled and converted into the right to receive the merger consideration with respect to each share of
Nuance common stock subject to the award, less any applicable withholding taxes.
60TABLE OF CONTENTS
•
Each outstanding and unvested award of stock units will, as of the effective time, be converted into a
Rollover RSU as follows:
○
Each RSU will be converted into a Rollover RSU that is subject to the same time-based vesting
schedule as the RSU.
○
Each PSU will be converted into a Rollover RSU that, following the effective time, will vest based
solely on time at the conclusion of the original performance period of the PSU.
○
The number of shares of common stock of Microsoft subject to each Rollover RSU will be equal to the
product (rounded down to the nearest whole share) of the number of Nuance shares of common stock
subject to the corresponding RSU or PSU as of immediately prior to the effective time, multiplied by a
specified exchange ratio (see below). The number of Nuance shares of common stock subject to each
PSU immediately prior to the effective time will be determined based on (i) maximum performance, for
any PSU that was subject to relative total shareholder return performance goals, and (ii) target
performance, for any PSU that was subject to financial and/or operational performance goals. For each
PSU that is subject to relative total shareholder return performance goals, Nuance is currently
performing at a level that would result in maximum performance payout.
○
Notwithstanding the treatment of awards of outstanding and unvested stock units described above,
Microsoft may elect to treat some or all of the awards as if they were vested (i.e., by cancelling and
converting an award into the right to receive the merger consideration with respect to each share of
Nuance common stock subject to the award, less any applicable withholding taxes).
•
If the treatment described above of an award of stock units held by a non-U.S. employee would be
prohibited or subject to onerous regulatory requirements or adverse tax treatment under the laws of the
applicable jurisdiction (as reasonably determined by Microsoft in consultation with Nuance), Microsoft will
provide compensation to the employee that is equivalent in value to the value that otherwise would have
been provided to the employee under the treatment described above, to the extent practicable and as would
not result in the imposition of additional taxes under section 409A of the Internal Revenue Code. This
compensation will be provided in the form of a cash payment (less any applicable taxes) or a new equity
award, as reasonably determined by Microsoft in consultation with Nuance.
•
For purposes of the conversion of Nuance stock units described above, the “exchange ratio” is defined as
a fraction, the numerator of which is the merger consideration and the denominator of which is the volume
weighted average price per share rounded to four decimal places (with amounts of 0.00005 and above
rounded up) of Microsoft common stock on Nasdaq for the five consecutive trading days ending with the
last trading day immediately prior to the closing.
Employee Stock Purchase Plan
In accordance with the plan terms, each ESPP participant in the current offering period, which began on February 16,
2021, may not increase his or her payroll contribution rate or make separate non-payroll contributions, and no new
participants may enroll in the current offering period. In connection with the transaction with Microsoft, Nuance will
take all actions necessary to provide that:
•
if the closing occurs prior to August 13, 2021, which is the last day of the current offering period:
○
cause the current offering period to terminate no later than five business days prior to the closing
date;
○
make any pro-rata adjustments necessary to reflect the shortened offering period; and
○
cause the exercise (as of no later than one business day before the effective time) of each outstanding
purchase right and apply the funds credited to each participant’s payroll withholding account to the
purchase of whole shares of Nuance common stock;
•
provide that no new offering period or purchase period will commence; and
•
terminate the ESPP in its entirety, effective as of the effective time.
61
TABLE OF CONTENTS
Exchange and Payment Procedures",69,71
"Nuance Communications, Inc._20210517_DEFM14A_19281720_4221662.Pdf",Exchange and Payment Procedures,"Exchange and Payment Procedures
Prior to the closing of the merger, Microsoft will designate a bank or trust company, which we refer to as the “paying
agent,” to make payments of the merger consideration to Nuance stockholders. At or promptly following the effective
time of the merger, Microsoft will deposit or cause to be deposited with the paying agent cash sufficient to pay the
aggregate per share merger consideration to Nuance stockholders in accordance with the merger agreement.
As soon as reasonably practicable following the effective time of the merger, the paying agent will send to each
holder of record of shares of common stock a letter of transmittal and instructions advising stockholders how to
surrender stock certificates and book-entry shares in exchange for the per share merger consideration. Upon receipt
of (1) surrendered certificates (or an appropriate affidavit for lost, stolen or destroyed certificates, together with any
required bond) with respect to shares of common stock represented by stock certificates or a customary “agent’s
message” with respect to book-entry shares representing the shares of common stock and (2) a signed letter of
transmittal (in the case of common stock represented by stock certificates) and such other documents as may be
required pursuant to such instructions, the holder of such shares will be entitled to receive the per share merger
consideration in exchange therefor, without interest. The amount of any per share merger consideration paid to
Nuance stockholders may be reduced by any applicable withholding taxes or other amounts required by applicable
law to be withheld.
If any cash deposited with the paying agent is not claimed within one year following the effective time of the merger,
such cash will be returned to Microsoft, upon demand, and any stockholders who have not complied with the
exchange procedures in the merger agreement will thereafter look only to Microsoft for satisfaction of their claims for
payment. None of Microsoft, Sub, Nuance, the surviving corporation or the paying agent will be liable to any Nuance
stockholder with respect to any cash amounts properly delivered to any public official pursuant to any applicable
abandoned property law, escheat law or similar law.
The letter of transmittal will include instructions if a stockholder has lost a share certificate or if such certificate has
been stolen or destroyed. In the event that any certificates have been lost, stolen or destroyed, then before such
stockholder will be entitled to receive the per share merger consideration, Microsoft or the paying agent may, in its
discretion and as a condition precedent to the payment of the merger consideration, require such stockholder to make
an affidavit of the loss, theft or destruction, and to deliver a bond in such amount as Microsoft or the paying agent
may direct as indemnity against any claim that may be made against Microsoft, the surviving corporation or the
paying agent with respect to such certificate.",71,71
