Document,Section Header,Section Text,Start Page,End Page
potential next steps. The advisors then left the meeting and the Board went into executive session. Following additional discussion, the Board determined
that each of the three bidders should be requested to reconsider their proposals and provide indications of interest at an increased price.
Following the May 7, 2021 Board meeting, at the direction of the Company, representatives of J.P. Morgan informed each of CNH Industrial, Bidder 1 and
Bidder 2 that such bidder was invited to submit a revised indication of interest at an increased price by May 13, 2021 and that, following the submission of
such revised indication of interest, the Board would determine whether to admit such bidder into the second and final round of the bidding process.
On May 11, 2021, Bidder 1 submitted a revised non-binding proposal to acquire the Company for consideration per share of $54.00.
On May 13, 2021, CNH Industrial submitted a revised non-binding proposal to acquire the Company for consideration per share of $51.50, and Bidder 2
submitted a revised non-binding proposal to acquire the Company for consideration per share in a range of between $48.00 to $52.00.
On May 13, 2021, the Board met virtually, with certain members of the Company’s senior management and representatives of J.P. Morgan in attendance.
Representatives of J.P. Morgan provided an update to the Board regarding the sale process, including the revised proposals submitted by CNH Industrial,
Bidder 1 and Bidder 2. Following discussion, the Board approved the invitation of all three companies to the second round of the bidding process.
On May 14, 2021, at the direction of the Company, J.P. Morgan sent process letters to CNH Industrial, Bidder 1 and Bidder 2 describing the requirements for
the second round of the bidding process. The letters instructed bidders to submit a final definitive and binding offer by June 15, 2021 specifying the bidder’s
proposed form of consideration, key conditions and assumptions, intended business and management strategy for the Company, financing sources, required
approvals, anticipated timing and certainty of closing (including confirmation of the completion of substantive due diligence), closing conditions and
proposed transaction structure. The letters also instructed bidders to submit a mark-up by June 8, 2021 of the bid draft merger agreement that would be
provided by Davis Polk.
Also on May 14, 2021, the three bidders received access to a virtual data room that contained detailed and confidential business, financial, operational, legal
and other information concerning the Company. The due diligence process with each of the bidders continued through June 14, 2021. During this period,
representatives of the Company and its advisors responded to numerous diligence requests from, and conducted several diligence calls with, each of the
bidders and their respective advisors.
29
Table of Contents
Between May 18, 2021 and May 20, 2021, members of the Company’s senior management team hosted a management presentation with each of the three
bidders in Sioux Falls, South Dakota.
On May 19, 2021, at the direction of the Company, representatives of J.P. Morgan shared a bid draft merger agreement with each bidder. The bid draft merger
agreement furnished to each bidder was identical, except that with respect to CNH Industrial, the draft incorporated provisions concerning regulatory
approvals that would apply to a non-U.S. buyer.
On June 8, 2021, CNH Industrial and Bidder 2 each submitted mark-ups of the merger agreement.
On June 9, 2021, at the direction of the Company, representatives of J.P. Morgan shared an initial draft of the Company’s disclosure schedules to the bid draft
merger agreement with each bidder.
On June 9, 2021, Bidder 1 submitted a mark-up of the merger agreement.
On June 10, 2021, the Board met virtually, with certain members of the Company’s senior management and representatives of J.P. Morgan and Davis Polk in
attendance. The Board discussed with representatives of Davis Polk the terms of the bid draft merger agreement and the key issues raised in the mark-ups
received from each of the bidders. In particular, Davis Polk reviewed with the Board each bidder’s proposed revisions to the regulatory efforts covenant and
regulatory termination fee. All three bidders proposed limiting the buyer’s obligation under the regulatory efforts covenant to “reasonable best efforts” with
an additional proviso (i) in the case of CNH Industrial, that the buyer was under no obligation to (a) divest any material portion of the assets of the Applied
Technology operating segment of the Company (the “Applied Technology Division”) or agree to any restrictions on the business operations of the buyer
with respect to the Applied Technology Division in any material respect or (b) take any action that would have a material adverse effect on CNH Industrial
and its subsidiaries, taken as a whole (measured on a scale relative to Raven and its subsidiaries, taken as a whole), and (ii) in the case of each of Bidder 1 and
Bidder 2, that the buyer was under no obligation to (a) agree to any divestiture or restrictions on business operations or (b) contest any proceeding relating
to the proposed transaction. Coupled with these proposed revisions to the regulatory efforts covenant, CNH Industrial proposed a 5% regulatory termination
fee, Bidder 1 did not make a proposal regarding the size of the regulatory termination fee, and Bidder 2 proposed a 3% regulatory termination fee. Following
discussion of these and other terms in the bidders’ mark-ups, the Board determined that the Company should provide feedback to each of the bidders with
respect to the key issues raised in such bidder’s mark-up and invite each bidder to submit a revised mark-up with its final bid.
On June 11, 2021, at the direction of the Company, representatives of Davis Polk held teleconference calls with the legal advisors of CNH Industrial and Bidder
1 to communicate the Company’s feedback on key issues raised in each bidder’s mark-up. Davis Polk also contacted the legal advisor of Bidder 2 to schedule
a teleconference call to discuss the key issues raised in Bidder 2’s mark-up. Bidder 2’s legal advisor indicated to Davis Polk that the legal advisor would need
to consult with Bidder 2 prior to scheduling a call, but there was no further contact between the legal advisors following that communication.
On June 14, 2021, Bidder 2 communicated to the Company that it would not be submitting a final offer.
On June 15, 2021, CNH Industrial submitted a final offer to acquire the Company for $58.00 per share in cash. The final offer from CNH Industrial was
accompanied by a revised mark-up of the draft merger agreement. Among other things, in the revised mark-up CNH Industrial (i) agreed to take all actions
required by a governmental entity to consummate the Merger so long as such action would not have a material adverse effect on the Applied Technology
Division or on CNH Industrial and its subsidiaries, taken as a whole (measured on a scale relative to Raven and its subsidiaries, taken as a whole) and (ii)
proposed a 6% regulatory termination fee (approximately $120 million).
Also on June 15, 2021, Bidder 1 submitted a final offer to acquire the Company for an implied value of $55.50 per share, with such consideration to be
comprised of (i) $37.00 per share in cash and (ii) a fixed number of shares of Bidder 1’s common stock equivalent to $18.50 per share (based on the volume-
weighted average price of Bidder 1’s common stock, measured over the five-day trading period prior to announcement of the transaction). The final offer from
Bidder 1 was also accompanied by a revised mark-up of the draft merger agreement. Among other things, the revised mark-up (i) did not reflect any changes
to the regulatory efforts covenant proposed in Bidder 1’s initial mark-up but indicated in a footnote that Bidder 1 would be open to removing the proviso that
the buyer is under no obligation to contest any proceedings relating to the proposed transaction if the Company agreed to extend the outside date until any
such litigation is resolved and (ii) proposed a $100 million regulatory termination fee.
30
Table of Contents
On June 15, 2021, the Board met virtually, with certain members of the Company’s senior management and representatives of J.P. Morgan and Davis Polk in
attendance. The Board discussed with the representatives of J.P. Morgan and Davis Polk the details of the two final offer packages that were received and
potential next steps. Following discussion, the Board authorized the Company to continue discussions with each of CNH Industrial and Bidder 1.
On June 16, 2021, at the direction of the Company, Davis Polk sent Sullivan & Cromwell LLP, legal counsel to CNH Industrial, a mark-up of the draft merger
agreement that was submitted with CNH Industrial’s final bid. From June 16, 2021 until the execution of the Merger Agreement on June 20, 2021, the parties
and their respective legal advisors exchanged several drafts of, and engaged in numerous discussions and negotiations concerning the terms of, the Merger
Agreement and the Company’s disclosure schedules to the Merger Agreement. Primary areas of discussion and negotiation included the scope of CNH
Industrial’s undertaking to obtain required regulatory approvals, the “no-shop” provisions, and various employee-related and intellectual property-related
matters. In connection with these negotiations, on June 17, 2021, CNH Industrial agreed to increase its regulatory termination fee to $200 million. During this
time, representatives of CNH Industrial and its advisors also performed additional confirmatory due diligence.
On June 17, 2021, at the direction of the Company, Davis Polk held a teleconference call with the legal advisors of Bidder 1 to communicate the Company’s
feedback on key issues in the revised mark-up of the draft merger agreement that was submitted with Bidder 1’s final bid. Significant areas of discussion
included the scope of Bidder 1’s undertaking to obtain required regulatory approvals, each party’s assessment of the antitrust risk associated with a
combination of the parties, the size of the proposed regulatory termination fee, the requirement proposed by Bidder 1 that the Company cooperate with Bidder
1 to facilitate the sale of certain assets or ownership interests held by the Company following the signing of a definitive merger agreement, the status of
Bidder 1’s financing arrangements and Bidder 1’s anticipated timing to reach a position to sign a definitive merger agreement. In connection with those
conversations, representatives of Bidder 1’s legal counsel informed representatives of Davis Polk that Bidder 1 would need approximately seven to ten days
before Bidder 1 would be in a position to sign a definitive merger agreement.
On June 18, 2021, the Board met virtually, with certain members of the Company’s senior management and representatives of J.P. Morgan and Davis Polk in
attendance. Representatives of Davis Polk and J.P. Morgan provided an update to the Board on their respective conversations with the legal and financial
advisors of CNH Industrial and Bidder 1.
On June 19, 2021, the Board received a letter from Bidder 1 reaffirming its interest in acquiring the Company and communicating certain changes that Bidder 1
was willing to make to its final offer package in an effort to address the concerns, as communicated between the parties’ legal advisors, with respect to the
potential antitrust risk associated with a combination of the Company with Bidder 1, including an increase in the regulatory termination fee proposed by
Bidder 1 from $100 million to $150 million and certain revisions to the scope of Bidder 1’s undertaking to obtain required regulatory approvals. There was no
change in Bidder 1’s previously communicated offer price of $55.50 per share. In its June 19 letter, Bidder 1 reiterated that announcement of a transaction with
the Company would not occur prior to one week from its June 19 letter.
On June 20, 2021, the Board met virtually, with certain members of the Company’s senior management and representatives of J.P. Morgan and Davis Polk in
attendance. Prior to the meeting, the directors had received (i) a substantially final draft of the Merger Agreement negotiated with CNH Industrial, together
with a summary thereof prepared by Davis Polk, and (ii) a financial presentation prepared by J.P. Morgan. Representatives of Davis Polk reviewed with the
directors the fiduciary duties applicable to the Board’s consideration of the Merger Agreement and the Merger. The Board then discussed the June 19 letter
received from Bidder 1 with representatives of J.P. Morgan and Davis Polk. Following those discussions, the Board determined to proceed with a discussion
of the CNH Industrial transaction because it had both a superior price and superior terms compared to the proposal of Bidder 1 and could be executed
immediately. Representatives of J.P. Morgan then reviewed with the Board the strategic review process it had undertaken at the request of the Board and its
financial analyses of the Merger Consideration in the proposed transaction with CNH Industrial. J.P. Morgan then rendered to the Board its oral opinion,
which was subsequently confirmed by the delivery of J.P. Morgan’s written opinion addressed to the Board dated June 20, 2021 to the effect that, as of such
date, and based upon and subject to the assumptions made, matters considered, qualifications and limitations set forth therein, the Merger Consideration of
$58.00 per share to be paid to the holders of the Company’s common stock in the proposed merger was fair, from a financial point of view, to such
shareholders. Representatives of Davis Polk then reviewed with the directors the terms of the Merger Agreement. Based on the discussions and deliberations
at this meeting and prior meetings, the various discussions and reviews with representatives of Davis Polk and J.P. Morgan, and various other factors,
including those described in “The Merger (Proposal 1)—Raven’s Reasons for the Merger; Recommendation of the Raven Board of Directors,” the Board
unanimously (1) determined that the Merger Agreement, the Merger and the other transactions contemplated thereby were fair to, and in the best interests of,
the
31
Table of Contents
Company and its shareholders, (2) approved the execution and delivery of the Merger Agreement and (3) recommended that the Company’s shareholders
approve the Merger Agreement, the Merger and the other transactions contemplated thereby.
Shortly after the Board meeting on June 20, 2021, the Company, CNH Industrial and Merger Subsidiary finalized the Company’s disclosure schedules to the
Merger Agreement and entered into the Merger Agreement.
Shortly after the execution of the Merger Agreement on June 20, 2021, the Company sent a letter to Bidder 1 communicating its decision to terminate further
discussions with Bidder 1.
Later on June 20, 2021, after the execution of the Merger Agreement, the Board received a letter from Bidder 1 reaffirming its interest in acquiring the Company
and revising the proposed purchase price from its letter on June 19, 2021 from $55.50 per share in cash and stock to $59.00 per share in cash. The letter also
requested exclusivity through the end of the day on June 28, 2021.
On June 21, 2021, the Company and CNH Industrial issued a joint press release before markets in the U.S. and Europe opened announcing their execution of
the Merger Agreement.
Also on June 21, 2021, the Company sent a letter to Bidder 1 informing Bidder 1 of the Company’s entry into the Merger Agreement with CNH Industrial prior
to its receipt of the letter from Bidder 1 on June 20, 2021. The Company’s response noted that the Company’s ability to discuss the revised offer from Bidder 1
was limited by the terms of the Merger Agreement, which was also publicly filed on June 21, 2021 as an exhibit to a Form 6-K filed by CNH Industrial. There
has been no further contact between the Company and Bidder 1 regarding the acquisition of the Company since the Company’s June 21, 2021 letter.",18,20
RAVEN INDUSTRIES INC_20210806_DEFM14A_19454710_4273900.Pdf,Raven’s Reasons for the Merger,"Raven’s Reasons for the Merger
At a meeting duly called and held on June 20, 2021, the Board determined that the Merger and the other transactions contemplated by the Merger Agreement
are fair to, and in the best interests of, Raven and its shareholders and approved the Merger Agreement and the Merger and the other transactions
contemplated by the Merger Agreement. The Board also resolved that the Merger Agreement be submitted for consideration by the shareholders of Raven at
a special meeting of shareholders and to recommend that the shareholders of Raven vote to approve the Merger Agreement. The Raven Board consulted withRaven’s outside financial and legal advisors and senior management at various times and considered a number of factors, including the following principal
factors (not in any relative order of importance) that the Board believed to support its decision:
·
Raven’s business, current and projected financial performance and condition and future prospects in relation to the Merger Consideration of $58.00
per share,
·
the current and historical market prices of Raven common stock, including the market performance of Raven common stock relative to other
participants in Raven’s industry and general market indices, and the fact that the Merger Consideration represented an attractive premium of
approximately 33.6% to Raven’s four-week volume-weighted average stock price,
·
the fact that J.P. Morgan, at the Board’s instruction, contacted six prospective buyers, that of these prospective buyers, four entered into
confidentiality agreements with respect to a potential transaction with the Company, two of which (including CNH Industrial) continued pursuing an
acquisition of the Company after conducting due diligence, and that the Company did not receive a more attractive alternative bid during the sale
process and prior to the execution of the Merger Agreement than the one submitted by CNH Industrial,
·
the fact that Raven did not enter into any exclusivity arrangements with CNH Industrial and did not negotiate with CNH Industrial on a contractually
exclusive basis,
·
the Board’s belief that its negotiations had resulted in the highest price per share for the common stock of the Company that CNH Industrial was
willing to pay,
·
the Board’s belief that the process conducted by the Company had resulted in the highest price reasonably available to the shareholders of the
Company,
32
Table of Contents
·
the Board’s belief that the Merger was more favorable to Raven’s shareholders than the alternative of remaining a standalone independent company,
which belief was based on and informed by consideration of a number of factors, risks and uncertainties, including:
o
general industry, economic and market conditions, both on a historical and on a prospective basis,
o
the risks and uncertainties associated with maintaining Raven’s performance as a standalone company, including the risks and uncertainties
described in Raven’s SEC filings, and
o
the uncertain returns to Raven’s shareholders if Raven were to remain independent, taking into account, in particular, management’s
financial projections of the future financial performance and earnings of Raven, including those set forth below under “The Merger
(Proposal 1)—Certain Financial Projections” and the risks involved in achieving those returns.
·
the Board’s belief that the risks and challenges to Raven’s business described above, and in Raven’s SEC filings, create substantial execution risks
relative to the $58.00 per share price in the Merger,
·
the oral opinion of J.P. Morgan rendered to the Board on June 20, 2021, which was subsequently confirmed by a written opinion, dated as of the
same date, addressed to the Board that, as of the date of such opinion, and based upon and subject to the various factors, assumptions, limitations,
qualifications and conditions set forth in J.P. Morgan’s written opinion, the Merger Consideration to be paid to the holders of the Raven common
stock in the proposed Merger was fair, from a financial point of view, to such shareholders, as described further under “The Merger (Proposal 1)—
Opinion of Raven’s Financial Advisor” and Annex B to this proxy statement,
·
the fact that the Merger Consideration is all cash, so that the transaction will allow Raven’s shareholders to realize a fair value, in cash, for their
investment and provides such shareholders certainty of value for their shares,
·
the Board’s belief that absent a superior proposal, the Merger represented a transaction that would likely be consummated based on, among other
factors, the limited closing conditions to the completion of the transaction, the absence of a financing condition or similar contingency that is based
on CNH Industrial’s ability to obtain financing and the strong commitment made by CNH Industrial to obtain regulatory approvals, as further
described in the section entitled “The Merger Agreement—Regulatory Clearances and Approvals Required for the Merger,” and
·
the material terms and conditions of the Merger Agreement, including:
o
the conditions to the consummation of the Merger, including the requirement that the Merger Agreement be adopted by Raven’s
shareholders,
o
the Board’s “fiduciary out” with respect to third-party acquisition proposals likely to result in superior proposals, the Board’s ability to
negotiate with another party regarding a superior proposal and, subject to paying a termination fee to CNH Industrial in the amount of $64
million, accept a superior proposal,
o
the Board’s belief that, if triggered, the termination fee payable by Raven to CNH Industrial is consistent with fees payable in comparable
transactions and would not be likely to preclude another party from making a competing proposal,
o
the fact that Raven and CNH Industrial agreed to use their respective reasonable best efforts to consummate the Merger, including
preparing and filing as promptly as practicable all necessary filings and obtaining certain specified regulatory approvals; CNH Industrial
has further agreed to take any such actions necessary to consummate the Merger that do not constitute a materially burdensome regulatory
condition (as described in the section entitled “The Merger Agreement—Regulatory Clearances and Approvals Required for the Merger”),
o
the requirement that, in the event of a failure of the Merger to be consummated under certain circumstances, CNH Industrial must pay
Raven a termination fee of $200 million,
33
Table of Contents
o
the scope of the representations, warranties and covenants being made by Raven, CNH Industrial and Merger Subsidiary,
o
the fact that the Merger Agreement is not subject to a financing condition and, in particular, that CNH Industrial had represented in the
Merger Agreement that it has, or will have at the Effective Time, sufficient cash, available lines of credit or other sources of immediately
available funds to consummate the Merger, and
o
Raven’s ability to specifically enforce CNH Industrial’s obligation to cause the completion of the Merger to occur.
The Board also considered various potentially countervailing factors in its deliberations related to the Merger, including the following principal factors (not in
any relative order of importance):
·
the fact that the holders of common stock will not have an opportunity to participate in any future earnings or growth of the combined company
following the Merger,
·
the possibility that the Merger might not be completed and the effect the termination of the transaction may have on the trading price of Raven
common stock, its business, operating results and prospects, which effect is likely to be exacerbated the longer the time period between the signing
and any termination of the Merger Agreement,
·
that Raven cannot solicit other acquisition proposals, and must pay CNH Industrial a termination fee in the amount of $64 million if the Merger
Agreement is terminated under certain circumstances, including if the Board changes its recommendation to Raven’s shareholders to adopt the
Merger Agreement or exercises its right to enter into a transaction that constitutes a superior proposal, which may deter others from proposing an
alternative transaction that may be more advantageous to Raven’s shareholders,
·
that the restrictions imposed by the Merger Agreement on the conduct of Raven’s business prior to completion of the Merger, requiring Raven to
conduct its business only in the ordinary course and imposing additional specific restrictions, may delay, limit or prevent Raven from undertaking
business opportunities that may arise during that period,
·
the possible effects of the pendency (or termination) of the Merger Agreement on Raven’s business, operating results, prospects, employees,
customers and suppliers,
·
the fact that if the Merger is not consummated, Raven will be required to pay its own expenses associated with the Merger Agreement,
·
the fact that the receipt of cash in exchange for shares of common stock pursuant to the Merger will generally be a taxable transaction for U.S.
federal income tax purposes,
·
the fact that Raven is subject to various remedies available to CNH Industrial should it fail to complete the Merger or breach the Merger Agreement,
and
·
