Document,Section Header,Section Text,Start Page,End Page
they were made, not misleading. The representations and warranties contained in this ​​Section 4.09 will not apply to statements or omissions included or
incorporated by reference in the Proxy Statement based upon information supplied by Parent, Merger Subsidiary or any of their respective representatives or
advisors specifically for use or incorporation by reference therein.
Section 4.10. Absence of Certain Changes. i) From the Company Balance Sheet Date to the date of this Agreement, the business of the Company and its
Subsidiaries has been conducted in the ordinary course, consistent with past practice (other than as a result of COVID-19 and COVID-19 Measures).
(b) Since the Company Balance Sheet Date, there has not been any event, occurrence, development or state of circumstances or facts that has had or would
reasonably be expected to have, individually or in the aggregate, a Material Adverse Effect.
23
Table of Contents
Section 4.11. No Undisclosed Material Liabilities. There are no liabilities or obligations of the Company or any of its Subsidiaries of any kind (whether
absolute, accrued, contingent or otherwise, and whether due or to become due), other than: (i) liabilities or obligations disclosed and provided for in the
Company Balance Sheet or in the notes thereto; (ii) liabilities or obligations incurred in the ordinary course of business consistent with past practice since the
Company Balance Sheet Date; (iii) liabilities or obligations incurred in connection with the transactions contemplated hereby; and (iv) liabilities or obligations
that would not reasonably be expected to have, individually or in the aggregate, a Material Adverse Effect.
Section 4.12. Compliance with Laws and Court Orders; Licenses. (c) The Company and each of its Subsidiaries is, and has been at all times since January 1,
2019, in compliance with all Applicable Laws, except for failures to comply or violations that would not reasonably be expected to have, individually or in the
aggregate, a Material Adverse Effect. Neither the Company nor any of its Subsidiaries or Affiliates has received any written communication or, to the
knowledge of the Company, any oral communication that any proceeding, investigation or review by any Governmental Authority is pending with respect to
any violation of Applicable Law, except for such proceedings, investigations or reviews the outcomes of which would not reasonably be expected to have,
individually or in the aggregate, a Material Adverse Effect. Except as would not reasonably be expected to have, individually or in the aggregate, a Material
Adverse Effect, no injunction, judgment, writ, temporary restraining order, decree or any order of any nature to which the Company or any of its Subsidiaries
or their respective properties or assets is subject has been issued by any court or other Governmental Authority.
(b) Each of the Company and its Subsidiaries holds all federal, state, local, provincial and foreign governmental licenses, consents, authorizations, clearances,
registrations, waivers, privileges, exemptions, qualifications, quotas, certificates, filings, franchises, notices, rights and permits that are necessary to conduct
their respective businesses in all material respects as are presently being conducted or for the lawful ownership of their respective properties and assets
(collectively, the “Permits”), except those the absence of which would not reasonably be expected to have a Material Adverse Effect.
(c) Since January 1, 2019, neither the Company nor any of its Subsidiaries, nor any of its or their respective directors or officers, nor, to the Company’s
knowledge, any employee, agent or representative of the Company or of any of its Subsidiaries, has taken any action in furtherance of an offer, payment,
promise to pay, or authorization of the payment of any money, or offer, gift, promise to give, or authorization of the giving of anything of value directly, or
indirectly through an intermediary, to any “government official” (including any
24
Table of Contents
officer or employee of a government or government-owned or -controlled entity or of a public international organization, or any person acting in an official
capacity for or on behalf of any of the foregoing, or any political party or party official or candidate for political office) in order to influence official action
which would result in a violation by such persons of the FCPA, except as would not reasonably be expected to have, individually or in the aggregate, a
Material Adverse Effect. The Company and its Subsidiaries have instituted and maintained and will continue to maintain policies and procedures that are
reasonably designed to achieve compliance with such laws, in each case, except as would not reasonably be expected to have, individually or in the
aggregate, a Material Adverse Effect.
(d) Except as would not reasonably be expected to have, individually or in the aggregate, a Material Adverse Effect, neither the Company nor any of its
Subsidiaries, nor any of its or their respective directors or officers, nor, to the Company’s knowledge any of the employees, agents or representatives of the
Company or any of its Subsidiaries, is, or is 50% or more owned or controlled by one or more Persons that are: (i) the subject of any sanctions administered
by the U.S. Department of Treasury’s Office of Foreign Assets Control (OFAC) or the U.S. Department of State, the United Nations Security Council, the
European Union, or other relevant sanctions authority (collectively, “Sanctions”), or (ii) located, organized or resident in a country or territory that is the
subject of Sanctions (including, without limitation, the Crimea region of Ukraine, Cuba, Iran, North Korea, and Syria), except as otherwise authorized pursuant
to Sanctions. Since January 1, 2019, neither the Company nor any of its Subsidiaries has engaged in, directly or indirectly, any dealings or transactions with
any Person, or in any country or territory, that, at the time of the dealing or transaction, is or was the subject of Sanctions, except as (i) otherwise authorized
pursuant to Sanctions or (ii) would not reasonably be expected to have, individually or in the aggregate, a Material Adverse Effect.
(e) Except as would not reasonably be expected to, individually or in the aggregate, have a Material Adverse Effect, (i) the Company and its Subsidiaries
conduct their respective businesses in compliance with all applicable Trade Controls Laws, (ii) the Company is registered with the DDTC as an entity that
engages in the United States in the business of manufacturing or exporting “defense articles” or furnishing “defense services” as those terms are defined in
the ITAR, in connection with the operation of its business; and (iii) neither the Company nor any of its Subsidiaries exported “defense articles” or furnished
“defense services” or “technical data” to foreign nationals in the United States or elsewhere, as those terms are defined in 22 C.F.R. part 120, except in
accordance with Applicable Law.
Section 4.13. Litigation. As of the date hereof, there is no civil, criminal or administrative action, suit, claim, arbitration or other proceeding (each, a
“Proceeding”) pending against, or, to the Company’s knowledge, threatened in writing against, the Company or any of its Subsidiaries before (or in the case
of threatened Proceedings, that would be before) or by any Governmental Authority or arbitrator, that would reasonably be expected to have, individually or
in the aggregate, a Material Adverse Effect or would reasonably be expected to prevent
25
Table of Contents
or materially delay the consummation of the Merger and the transactions contemplated by this Agreement.
Section 4.14. Properties. (d) Except as would not reasonably be expected to have, individually or in the aggregate, a Material Adverse Effect, the Company
and its Subsidiaries have good title to, free and clear of any Lien (other than Permitted Liens), or valid leasehold interests in, all property and assets reflected
on the Company Balance Sheet or acquired after the Company Balance Sheet Date, except as have been disposed of since the Company Balance Sheet Date
in the ordinary course of business.
(b) Except as would not reasonably be expected to have, individually or in the aggregate, a Material Adverse Effect, (i) each lease, sublease or license (each, a
“Lease”) under which the Company or any of its Subsidiaries leases, subleases or licenses any real property is valid and in full force and effect, (ii) neither the
Company nor any of its Subsidiaries, nor to the Company’s knowledge any other party to a Lease, is in violation of any provision of any Lease and (iii) no
event has occurred which, with notice, lapse of time or both, would constitute a breach or default by any of the Company or its Subsidiaries or permit
termination, modification or acceleration by any third party thereunder.
Section 4.15. Intellectual Property. (e) Section 4.15(a) of the Company Disclosure Schedule contains a list of all Company Intellectual Property for which
applications have been filed or registrations have been obtained in each case, whether in the United States or internationally (“Company Registered
Intellectual Property”). Except as would not reasonably be expected to have, individually or in the aggregate, a Material Adverse Effect, (i) each item of
Company Registered Intellectual Property (other than pending applications for registration or issuance) that is material to the operation of business of the
Company and its Subsidiaries is subsisting and, to the Company’s knowledge, valid and enforceable; (ii) the Company or one of its Subsidiaries (A) solely
owns all right, title, and interest in and to the Company Intellectual Property, free and clear of any Liens (other than Permitted Liens) and (B) has the right to
use pursuant to a written license, sublicense, agreement or permission, all other Intellectual Property used in the operation of the business of the Company
and its Subsidiaries, as currently conducted (“Licensed Intellectual Property”); (iii) the Company Intellectual Property and the Licensed Intellectual Property
constitute all of the Intellectual Property necessary and sufficient to enable the Company and its Subsidiaries to conduct their respective businesses as
currently conducted; and (iv) none of the Company Intellectual Property or, to the knowledge of the Company, any other Intellectual Property exclusively
licensed to the Company or any of its Subsidiaries, is subject to any pending or outstanding injunction, directive, order, or judgment that adversely restricts
in any material respect the use, transfer, registration, or licensing of any such Intellectual Property.
(b) Except as would not reasonably be expected to have, individually or in the aggregate, a Material Adverse Effect, (i) to the Company’s knowledge,
26
Table of Contents
the conduct of the businesses of the Company and its Subsidiaries are not infringing upon, misappropriating or otherwise violating any Intellectual Property
rights of any Person, and, since January 1, 2019, have not infringed upon, misappropriated or otherwise violated any material Intellectual Property rights of
any Person; (ii) to the Company’s knowledge, no third party is infringing upon, misappropriating or otherwise violating or, since January 1, 2019, has infringed
upon, misappropriated, or otherwise violated any Company Intellectual Property; (iii) the Company and its Subsidiaries are not the subject of any pending or,
to the knowledge of the Company, threatened Proceedings; and (iv) the Company and its Subsidiaries have not received from any Person at any time after
January 1, 2019 any written notice (A) alleging that the Company or any of its Subsidiaries is infringing upon, misappropriating or otherwise violating or has
infringed upon, misappropriated, or otherwise violated, any Intellectual Property rights of any Person or (B) challenging the ownership, use, validity or
enforceability of any Company Intellectual Property.
(c) Except as would not reasonably be expected to have, individually or in the aggregate, a Material Adverse Effect, (i) to the knowledge of the Company, the
Company and its Subsidiaries take, and have taken, commercially reasonable actions and measures to protect and maintain: (A) the ownership and
confidentiality of their material Company Intellectual Property and (B) the security, confidentiality, operation and integrity of their IT Systems and Software
(and all data stored therein or transmitted thereby); (ii) the Software owned by the Company does not incorporate “open source” Software in a manner that
requires the disclosure to any third party of any material portion of the Company’s proprietary source code; and (iii) neither the Company nor any of its
Subsidiaries is a party to (or is obligated to enter into) any source code escrow agreement or any other agreement requiring the deposit of any source code or
related materials for any Software, and no such escrow has since January 1, 2019 been released to any applicable beneficiary.
(d) Except as would not reasonably be expected to have, individually or in the aggregate, a Material Adverse Effect (i) the Company has implemented and
maintained commercially reasonable back-up, security and disaster recovery arrangements to protect the confidentiality, integrity and security of its IT
Systems (and all information and transactions stored or contained therein or transmitted thereby) against any unauthorized use, access, interruption,
modification or corruption, at a level that is in accordance with standard industry practice; (ii) to the knowledge of the Company, there have been no security
breaches in the IT Systems used in the business of the Company or its Subsidiaries; and (iii) to the knowledge of the Company, the Company’s Software is
free of any malicious or disabling Software including viruses, worms, trojan horses, bugs, faults or other devices, errors, contaminants (“Malware”) or
material vulnerabilities, which may be used to gain access to, materially alter, delete, destroy or disable any of its or any third party’s IT Systems or Software
or which may in other ways cause damage to or abuse such IT Systems or Software.
27
Table of Contents
(e) The Company and its Subsidiaries have at all times since January 1, 2019 complied and are currently in compliance with all Applicable Laws relating to
privacy, data protection and the collection, use, storage, processing and disclosure of any personally identifiable information and user information gathered
or accessed in the course of the operations of the Company or any of its Subsidiaries, except as would not reasonably be expected to have, individually or in
the aggregate, a Material Adverse Effect. Since January 1, 2019, no claims have been asserted or, to the Company’s knowledge, threatened in writing, against
the Company or any of its Subsidiaries by any Person alleging a violation of such Person’s privacy, personal or confidentiality rights under any such
Applicable Laws, except as would not reasonably be expected to have, individually or in the aggregate, a Material Adverse Effect.
Section 4.16. Taxes.
(a) All material Tax Returns required by Applicable Law to be filed with any Taxing Authority by, or on behalf of, the Company or any of its Subsidiaries have
been filed when due in accordance with all Applicable Law, and all such Tax Returns are, or shall be at the time of filing, true and correct in all material
respects.
(b) The Company and each of its Subsidiaries has paid (or has had paid on its behalf) or has withheld and remitted to the appropriate Taxing Authority all
material amounts of Taxes required to be paid or withheld, or, where payment is not yet due, has established (or has had established on its behalf and for its
sole benefit and recourse) in accordance with GAAP an adequate accrual for all Taxes through the end of the last period for which the Company and its
Subsidiaries ordinarily record items on their respective books.
(c) There is no claim, audit, action, suit or proceeding now pending or threatened in writing against or with respect to the Company or its Subsidiaries in
respect of any material Tax.
(d) Neither the Company nor any of its Subsidiaries has executed any waiver of any statute of limitations with respect to any material Tax Return or extension
of time with respect to a material Tax assessment or deficiency, in each case, that is currently effective.
(e) There are no Liens for material Taxes upon any property or assets of the Company or any of its Subsidiaries other than Permitted Liens. No deficiency for
any material amount of Taxes has been proposed or asserted in writing or assessed by any Governmental Authority against the Company or any of its
Subsidiaries that remains unpaid or unresolved. Within the last three years, no written claim has been received by the Company or any of its Subsidiaries from
a Governmental Authority in a jurisdiction in which neither the Company nor any of its Subsidiaries files Tax Returns that the Company or any of its
28
Table of Contents
Subsidiaries are or may be subject to taxation by, or required to file any income or franchise Tax Return in, that jurisdiction.
(f) During the two-year period ending on the date hereof, neither the Company nor any of its Subsidiaries was a distributing corporation or a controlled
corporation in a transaction intended to be governed by Section 355 of the Code.
(g) Neither the Company nor any of its Subsidiaries is or will be required to include any material amount in taxable income for any Tax period ending after the
Closing Date or in any Tax Return not yet filed as a result of any (1) change in a method of accounting pursuant to Section 481 of the Code made prior to the
date of this Agreement, (2) installment sale made prior to the date of this Agreement, or (3) election under Section 108(i) of the Code made prior to the date of
this Agreement.
(h) Neither the Company nor any of its Subsidiaries has been a member of an affiliated group (within the meaning of Section 1504(a) of the Code) filing a
United States consolidated federal income Tax Return (other than an affiliated group the common parent of which is or was the Company or any of its
Subsidiaries). Neither the Company nor any of its Subsidiaries (1) has any material liability for Taxes of any other Person (other than the Company or any of
its Subsidiaries) under Treasury Regulations Section 1.1502-6 or any similar provision of state, local or foreign Tax law; (2) has transferee or successor liability
for any material unpaid Taxes of any other Persons (other than the Company or any of its Subsidiaries) by operation of Applicable Law; or (3) is a party to
any Tax sharing agreement other than (i) any agreement or arrangement solely among the Company and its Subsidiaries or (ii) commercial agreements entered
into in the ordinary course of business and the primary purposes of which is unrelated to Taxes.
(i) There are no material closing agreements, gain recognition agreements, private letter rulings, technical advance memoranda or similar agreements or rulings
that have been entered into or issued by any Tax authority with respect to the Company or any of its Subsidiaries that will be binding on the Company or any
of its Subsidiaries with respect to any taxable period ending after the Closing Date.
(j) Neither the Company nor any of its Subsidiaries has participated in a “listed transaction” within the meaning of the Treasury Regulation Section 1.6011-
4(b).
(k) The representations and warranties set forth in this ​​Section 4.16 and ​​Section 4.17 are the only representations and warranties of the Company and its
Subsidiaries with respect to Taxes.
29
Table of Contents
Section 4.17. Employee Benefit Plans; Labor and Employment.
(a) Section 4.17(a) of the Company Disclosure Schedule contains a correct and complete list of each material Company Employee Plan. Copies of each
Company Employee Plan and all material amendments thereto, and written interpretations thereof, have been furnished to Parent together with the most recent
annual report on Form 5500, if any.
(b) Except as would not reasonably be expected to have, individually or in the aggregate, a Material Adverse Effect, neither the Company nor any of its
Subsidiaries sponsors, maintains or is required to contribute to, or has in the past six years sponsored, maintained or been required to contribute to, any plan
subject to Section 412 of the Code or Section 302 or Title IV of ERISA.
(c) Each Company Employee Plan that is intended to be qualified under Section 401(a) of the Code has received a favorable determination letter or opinion
letter, or has pending or has time remaining in which to file, an application for such determination or opinion from the Internal Revenue Service (the “IRS”)
and, to the Company’s knowledge, nothing has occurred that would adversely affect the qualification or tax exemption of any such Company Employee Plan.
The Company has made available to Parent a copy of the most recent IRS determination and opinion letter with respect to each such Company Employee
Plan.
(d) Except for failures to comply that would not reasonably be expected to have, individually or in the aggregate, a Material Adverse Effect, each Company
Employee Plan has been maintained and operated in compliance with its terms and with the requirements prescribed by all statutes and regulations, including
ERISA and the Code, which are applicable to such Company Employee Plan. Except as would not reasonably be expected to have, individually or in the
aggregate, a Material Adverse Effect, no claim (other than routine claims for benefits), action, suit or proceeding (including an audit) is pending against or
involves or, to the Company’s knowledge, is threatened against or reasonably expected to involve, any Company Employee Plan before any court or arbitrator
or any Governmental Authority, including the IRS, the U.S. Department of Labor or the PBGC.
(e) Neither the execution and delivery of this Agreement, shareholder or other approval of this Agreement nor the consummation of the transactions
contemplated by this Agreement would, either alone or together with any other event: Article 17 entitle any Company Employee to any material payment or
benefit, including any material bonus, retention, severance, retirement or job security payment or benefit, Article 18 accelerate the time of payment or vesting
or trigger any payment or funding (through a grantor trust or otherwise) of material compensation or benefits under, or materially increase the amount payable
or trigger any other material obligation under, any Company Employee Plan or (iii) result in the payment of any amount that could, individually or in
30
Table of Contents
combination with any other such payment, constitute an “excess parachute payment” as defined in Section 280G(b)(1) of the Code.
(f) Neither the Company nor any Subsidiary has any obligation to provide, and no Company Employee Plan or other agreement provides any individual with
the right to, a gross up, indemnification, reimbursement or other payment for any excise or additional taxes, interest or penalties incurred pursuant to Section
409A of the Code or Section 4999 of the Code.
(g) Within ten (10) Business Days after the date of this Agreement, the Company shall notify Parent if the execution and delivery of this Agreement,
shareholder or other approval of this Agreement or the consummation of the transactions contemplated by this Agreement, either alone or in combination
with another event, will entitle any labor organization or works council to any material information, bargaining, consent or consultation rights.
(h) Except as would not reasonably be expected to have, individually or in the aggregate, a Material Adverse Effect, there are no unfair labor practice
complaints pending or, to the Company’s knowledge, threatened against the Company or any of its Subsidiaries before the U.S. National Labor Relations
Board or any other Governmental Authority or any current union representation questions involving any Company Employee. There is no labor strike,
slowdown, stoppage, picketing, interruption of work or lockout pending or, to the Company's knowledge, threatened against the Company or any of its
Subsidiaries.
(i) Except as would not reasonably be expected to have, individually or in the aggregate, a Material Adverse Effect, (i) the Company and its Subsidiaries are in
compliance with all Applicable Laws relating to labor and employment, including those relating to labor management relations, wages, hours, overtime, worker
classification, discrimination, sexual harassment, work authorization, immigration, safety and health, workers compensation, continuation coverage under
group health plans, wage payment and the payment and withholding of Taxes and (ii) neither the Company nor any of its Subsidiaries has incurred any
liability or obligation under the Worker Adjustment and Retraining Notification Act and the regulations promulgated thereunder or any similar state or local
Applicable Law that remains unsatisfied.
Section 4.18. Environmental Matters. (a) Except as would not reasonably be expected to have, individually or in the aggregate, a Material Adverse Effect:
(i) no written notice, order, complaint or penalty has been received by the Company or any of its Subsidiaries arising out of any Environmental Laws,
and there are no judicial, administrative or other actions, suits or proceedings pending or, to the Company’s knowledge, threatened which allege
