Document,Section Header,Section Text,Start Page,End Page
RAVEN INDUSTRIES INC_20210806_DEFM14A_19454710_4273900.Pdf,SUMMARY,"SUMMARY
This summary highlights information contained elsewhere in this proxy statement and may not contain all the information that is important to you with
respect to the Merger. We urge you to read carefully the remainder of this proxy statement, including the attached annexes, and the other documents to
which we have referred you. For additional information on Raven included in documents incorporated by reference into this proxy statement, see the
section entitled “Where You Can Find More Information” beginning on page 80 of this proxy statement. We have included page references in this summary
to direct you to a more complete description of the topics presented below.
All references to “the Company,” “Raven,” “we,” “us” or “our” in this proxy statement refer to Raven Industries, Inc., a South Dakota corporation; all
references to “CNH Industrial” refer to CNH Industrial N.V., a Netherlands public limited liability company; all references to “Merger Subsidiary” refer to
CNH Industrial South Dakota, Inc., a South Dakota corporation and a wholly owned subsidiary of CNH Industrial formed for the sole purpose of effecting
the Merger; all references to “Raven common stock” refer to the common stock, par value $1.00 per share, of Raven; all references to the “Board” refer to
the board of directors of Raven; all references to the “Merger” refer to the merger of Merger Subsidiary with and into Raven with Raven surviving as a
wholly owned subsidiary of CNH Industrial; and, unless otherwise indicated or as the context requires, all references to the “Merger Agreement” refer to
the Agreement and Plan of Merger, dated as of June 20, 2021, as may be amended from time to time, by and among Raven, CNH Industrial and Merger
Subsidiary, a copy of which is included as Annex A to this proxy statement. Raven, following the completion of the Merger, is sometimes referred to in this
proxy statement as the “surviving corporation.”
THE COMPANIES
Raven Industries, Inc. (see page 20)
Raven is a diversified technology company providing a variety of products to customers within the industrial, agricultural, geomembrane, construction,
commercial lighter-than-air, and aerospace and defense markets. Raven markets its products around the world and has its principal operations in the United
States of America. Raven began operations as a manufacturer of high-altitude research balloons before diversifying into product lines that extended from
technologies and production methods of this original balloon business.
Raven’s principal executive office is located at 205 E. 6th Street, Sioux Falls, South Dakota 57104. Raven’s telephone number is (605) 336-2750. Raven’s
internet website address is www.ravenind.com. The information provided on the Raven website is not part of this proxy statement and is not incorporated inthis proxy statement by reference by this or any other reference to its website provided in this proxy statement.
Shares of Raven common stock are listed and trade on the Nasdaq Global Select Market (the “Nasdaq”) under the symbol “RAVN.”
CNH Industrial N.V. (see page 20)
CNH Industrial is a global leader in the capital goods sector with established industrial experience, a wide range of products and a worldwide presence. Each
of the individual brands belonging to the Company is a major international force in its specific industrial sector: Case IH, New Holland Agriculture and Steyr
for tractors and agricultural machinery; Case and New Holland Construction for earth moving equipment; Iveco for commercial vehicles; Iveco Bus and
Heuliez Bus for buses and coaches; Iveco Astra for quarry and construction vehicles; Magirus for firefighting vehicles; Iveco Defence Vehicles for defence
and civil protection; and FPT Industrial for engines and transmissions. CNH Industrial is engaged in the design, production, marketing, sale, and financing of
agricultural and construction equipment, trucks, commercial vehicles, buses and specialty vehicles for firefighting, defense and other uses, as well as engines,
transmissions and axles for those vehicles and engines for marine and power generation applications. CNH Industrial has industrial and financial services
companies located in 44 countries and a commercial presence in approximately 180 countries.
CNH Industrial’s principal executive office is located at 25 St. James’s Street, London, SW1A 1HA, United Kingdom. CNH Industrial’s telephone number is
+44-207-7660-346. CNH Industrial’s website address is www.cnhindustrial.com.
Shares of CNH Industrial’s common stock are listed and trade on the New York Stock Exchange and the Mercato Telematico Azionario of the Borsa Italiana
under the symbol “CNHI.”
1
Table of Contents
CNH Industrial South Dakota, Inc. (see page 20)
Merger Subsidiary is a wholly owned subsidiary of CNH Industrial and was formed in June of 2021 solely for the purpose of completing the Merger with
Raven. Merger Subsidiary has not carried out any activities to date, except for activities incidental to its formation and activities undertaken in connection
with the transactions contemplated by the Merger Agreement.
Merger Subsidiary’s principal executive office is located at 700 State Street, Racine, WI 53404. Merger Subsidiary’s telephone number is (630) 887-2096.
THE MERGER
A copy of the Merger Agreement is attached as Annex A to this proxy statement. We encourage you to read the entire Merger Agreement carefully because it
is the principal document governing the Merger. For more information on the Merger Agreement, see the section entitled “The Merger Agreement”
beginning on page 50 of this proxy statement.
Effects of the Merger (see page 26)
If the Merger is completed, then, at the effective time of the Merger (the “Effective Time”), Merger Subsidiary will be merged with and into Raven in
accordance with the South Dakota Business Corporation Act (“South Dakota Law”). As a result of the Merger, the separate existence of Merger Subsidiary
will cease, and Raven will survive the Merger as a wholly owned subsidiary of CNH Industrial.
Upon consummation of the Merger, your shares of Raven common stock will be converted into the right to receive the Merger Consideration described
below. As a result, you will not own any shares of the surviving corporation, and you will no longer have any interest in its future earnings or growth. As a
result of the Merger, Raven will cease to be a publicly traded company and will be wholly owned by CNH Industrial. Following consummation of the Merger,
Raven’s common stock will be de-listed from the Nasdaq and Raven will no longer be subject to reporting obligations under the Securities Exchange Act of
1934, as amended (the “Exchange Act”).
Merger Consideration (see page 51)
Upon the terms and subject to the conditions of the Merger Agreement, at the Effective Time, Raven shareholders will have the right to receive $58.00 in cash,
without interest (the “Merger Consideration”), for each share of Raven common stock that they own immediately prior to the Effective Time (except for shares
owned by Raven, CNH Industrial or any of their respective subsidiaries).
Treatment of Company Equity and Performance-Based Cash Awards (see page 52)
The Merger Agreement provides that, at or immediately prior to the Effective Time, the outstanding equity awards of the Company will be treated as follows:
Each restricted stock unit entitling the holder to the delivery of Raven common stock upon satisfaction of vesting or other forfeiture conditions, whether
settled in cash or in Raven common stock (a “Raven RSU”) that is outstanding under Raven’s 2019 Equity Incentive Plan, Raven’s Amended and Restated
2010 Stock Incentive Plan or Raven’s Deferred Stock Compensation Plan for Directors of Raven (together, the “Raven Stock Plans”), whether vested or not
vested, will automatically be canceled in exchange for the right to receive an amount in cash equal to the product of the Merger Consideration and the number
of shares of Raven common stock represented by the Raven RSU. Any accrued but unpaid dividends granted with respect to a Raven RSU will automatically
vest and be paid or distributed to the holder of such Raven RSU. To the extent the number of shares of Raven common stock underlying a Raven RSU is
based on the satisfaction of performance conditions, such performance conditions will be deemed to have been earned at the greater of (i) the target amount
under the terms of the applicable award agreement and (ii) the amount based on the actual performance level achieved under such award agreement based on
performance through the Effective Time, such performance to be determined by Raven’s reasonable determination of performance as of immediately prior to
the Effective Time. Any payment in respect of Raven RSUs and dividends accrued with respect to Raven RSUs that constitute nonqualified deferred
compensation subject to Section 409A of the Internal Revenue Code of 1986, as amended (the “Code”), and that are not permitted to be paid without
triggering a tax or penalty under Section 409A of the Code will be made at the earliest time permitted under the applicable Raven Stock Plan and applicable
award agreement that will not trigger a tax or penalty under Section 409A of the Code.
2
Table of Contents
Each director deferred stock unit entitling a director to the delivery of Raven common stock upon satisfaction of vesting or other forfeiture conditions,
whether settled in cash or in Raven common stock (a “Raven DSU”), that is outstanding under a Raven Stock Plan, whether vested or not vested, will
automatically be canceled in exchange for the right to receive an amount in cash equal to the product of the Merger Consideration and the number of shares
of Raven common stock represented by the Raven DSU. Any accrued but unpaid dividends granted with respect to a Raven DSU will automatically vest and
be paid or distributed to the holder of such Raven DSU. Any payment in respect of Raven DSUs and dividends accrued with respect to Raven DSUs that
constitute nonqualified deferred compensation subject to Section 409A of the Code and that are not permitted to be paid without triggering a tax or penalty
under Section 409A of the Code will be made at the earliest time permitted under the applicable Raven Stock Plan and applicable award agreement that will not
trigger a tax or penalty under Section 409A of the Code.
Each option to acquire shares of Raven common stock (a “Raven Stock Option”) that is outstanding under a Raven Stock Plan, whether or not vested or
exercisable, will automatically be canceled in exchange for the right to receive an amount in cash (without interest) determined by multiplying (i) the excess, if
any, of the Merger Consideration over the applicable exercise price of such Raven Stock Option by (ii) the number of shares of Raven common stock
underlying the Raven Stock Option. Any Raven Stock Option for which the exercise price is equal to or greater than the Merger Consideration will be
canceled without any consideration.
Recommendation of the Raven Board of Directors (see page 35)
After careful consideration, the Board approved the Merger Agreement, the Merger and the other transactions contemplated by the Merger Agreement.
Certain factors considered by the Board in reaching its decision to approve the Merger Agreement, the Merger and the other transactions contemplated by
the Merger Agreement can be found in the section entitled “The Merger (Proposal 1)—Raven’s Reasons for the Merger” beginning on page 32 of this proxy
statement.
The Board recommends that Raven shareholders vote:
·
“FOR” the proposal to approve the Merger Agreement;
·
“FOR” the proposal to approve, on a non-binding, advisory basis, certain compensation that will or may be paid by Raven to its named
executive officers that is based on or otherwise relates to the Merger; and
·
“FOR” the proposal to approve an adjournment of the special meeting, including if necessary to solicit additional proxies in favor of the
proposal to approve the Merger Agreement, if there are not sufficient votes at the time of such adjournment to approve the Merger Agreement.
Opinion of Raven’s Financial Advisor (see page 35)
Pursuant to an engagement letter dated April 8, 2021, Raven retained J.P. Morgan as its financial advisor in connection with the proposed Merger and to
deliver a fairness opinion in connection with the proposed Merger.
At the meeting of the Board on June 20, 2021, J.P. Morgan rendered its oral opinion to the Board that, as of such date and based upon and subject to the
various factors, assumptions, limitations, qualifications and conditions set forth in its written opinion, the Merger Consideration to be paid to the holders of
Raven common stock in the proposed Merger was fair, from a financial point of view, to such holders. J.P. Morgan confirmed its June 20, 2021 oral opinion by
delivering its written opinion to the Board, dated June 20, 2021, that, as of such date, the Merger Consideration to be paid to the holders of Raven common
stock in the proposed Merger was fair, from a financial point of view, to such holders.
The full text of the written opinion of J.P. Morgan dated June 20, 2021, which sets forth, among other things, the assumptions made, matters considered and
limits on the review undertaken, is attached as Annex B to this proxy statement and is incorporated herein by reference. The summary of the opinion of J.P.
Morgan set forth in this proxy statement is qualified in its entirety by reference to the full text of such opinion. Raven’s shareholders are urged to read the
opinion in its entirety. J.P. Morgan’s written opinion was addressed to the Board (in its capacity as such) in connection with and for the purposes of its
evaluation of the proposed Merger, was directed only to the Merger Consideration to be paid in the proposed
3
Table of Contents
Merger and did not address any other aspect of the Merger. J.P. Morgan expressed no opinion as to the fairness of the Merger Consideration to the holders
of any class of securities, creditors or other constituencies of Raven or as to the underlying decision by Raven to engage in the proposed Merger. The
opinion does not constitute a recommendation to any shareholder of Raven as to how such shareholder should vote with respect to the proposed Merger or
any other matter.
For additional information, see the section entitled “The Merger (Proposal 1)—Opinion of Raven’s Financial Advisor” beginning on page 35 and Annex B to
this proxy statement.
Financing of the Merger (see page 48)
Completion of the Merger is not subject to a financing condition. CNH Industrial has represented in the Merger Agreement that it has, or will have at the
Effective Time, sufficient cash, available lines of credit or other sources of immediately available funds to enable it to consummate the Merger.
Material U.S. Federal Income Tax Consequences of the Merger (see page 77)
The exchange of Raven common stock for cash in the Merger will be a taxable transaction for U.S. federal income tax purposes and may also be taxable under
state and local and other tax laws. You should read the section entitled “Material U.S. Federal Income Tax Consequences of the Merger” beginning on page
77 of this proxy statement and consult your tax advisors regarding the U.S. federal income tax consequences of the Merger to you in your particular
circumstances, as well as tax consequences arising under the laws of any state, local or foreign taxing jurisdiction.
Regulatory Clearances and Approvals Required for the Merger (see page 48)
The completion of the Merger is conditioned on, among other things, certain specified regulatory approvals having been obtained and remaining in full force
and effect (or, in the case of certain specified regulatory approvals that are statutory waiting periods, having expired or been terminated), including the
expiration or termination of any applicable waiting period under the HSR Act and the receipt of CFIUS approval.
Under the terms of the Merger Agreement, each of Raven and CNH Industrial have agreed to use their respective reasonable best efforts to take, or cause to
be taken, all actions and to do, or cause to be done, all things necessary, proper or advisable under applicable law to consummate the transactions
contemplated by the Merger Agreement, including preparing and filing as promptly as practicable with any government authority or other third party all
documentation to effect all necessary filings and obtaining certain specified regulatory approvals.
The Company and CNH Industrial filed their respective Notification and Report Forms with the Antitrust Division and the FTC on July 12, 2021. The waiting
period under the HSR Act is expected to expire on August 11, 2021. The parties submitted to CFIUS a draft Joint Voluntary Notice on July 30, 2021. The parties
submitted to DDTC the required 60-day Pre-Notification of the Merger on July 30, 2021. In accordance with the National Industrial Security Program
Operating Manual, the parties notified DCSA of the Merger on July 8, 2021.
Under the Austrian Cartel Act, the Merger may not be completed until the expiration of a four-week waiting period following the filing of a notification with
the Austrian Federal Competition Authority (“FCA”). CNH Industrial filed such notification with the FCA in connection with the Merger formally on August
2, 2021. Unless extended or earlier terminated, the applicable waiting period will expire on August 30, 2021.
See the section entitled “The Merger Agreement—Regulatory Clearances and Approvals Required for the Merger” beginning on page 62 of this proxy
statement for a more detailed discussion of the parties’ obligations with respect to obtaining regulatory approvals in connection with the Merger.
Expected Timing of the Merger (see page 67)
We expect to complete the Merger in the fourth quarter of 2021. The Merger is subject to various conditions, however, and it is possible that factors outside
the control of Raven or CNH Industrial could result in the Merger being completed at a later time, or not at all. There may be a substantial amount of time
between the special meeting and the completion of the Merger. We expect to complete the Merger promptly following the satisfaction or, to the extent
permitted, waiver of the other conditions to the consummation of the Merger. See the section entitled “The Merger Agreement—Conditions to Completion of
the Merger” beginning on page 67 of this proxy statement.
Conditions to Completion of the Merger (see page 67)
As more fully described in this proxy statement and in the Merger Agreement, each party’s obligation to consummate the Merger depends on a number of
conditions being satisfied, including:
·
approval of the Merger Agreement by an affirmative vote of a majority of the votes cast by the holders of outstanding shares of Raven common
stock at Raven’s shareholder meeting (the “Shareholder Approval”) in accordance with South Dakota Law;
4
Table of Contents
·
no order or injunction issued by any court of competent jurisdiction in the United States preventing the consummation of the Merger having
taken effect after the date of the Merger Agreement and still being in effect;
·
any applicable waiting period under the Hart-Scott-Rodino Antitrust Improvements Act of 1976, as amended (the “HSR Act”), relating to the
Merger having expired or been terminated;
·
CFIUS approval (as described in the section entitled “The Merger Agreement— Regulatory Clearances and Approvals Required for the
Merger”) having been obtained and remaining in full force and effect;
·
certain specified regulatory approvals having been obtained and, in each case, such approvals are not conditioned on CNH Industrial taking
any action that would constitute a materially burdensome regulatory condition (as described in the section entitled “The Merger Agreement—
Regulatory Clearances and Approvals Required for the Merger”);
·
subject to certain qualifications, the other party having performed in all material respects all of its obligations under the Merger Agreement
contemplated to be performed by it at or prior to the Effective Time; and
·
subject to certain qualifications, the accuracy of representations and warranties made by the other party in the Merger Agreement (subject
generally to a material adverse effect standard, with different standards applicable to certain representations and warranties).
Restrictions on Solicitation of Acquisition Proposals (see page 59)
Subject to certain exceptions, Raven has agreed that from the date of the Merger Agreement until the Effective Time or, if earlier, the termination of the Merger
Agreement in accordance with its terms, except as otherwise set forth below, Raven and its subsidiaries will not, and will cause their respective directors,
officers and employees, and instruct their investment bankers, attorneys, accountants, consultants and other advisors or representatives not to, directly or
indirectly:
·
solicit, initiate or take any action to knowingly facilitate or encourage the submission of any “acquisition proposal” (as described in the section
entitled “The Merger Agreement—Restrictions on Solicitation of Acquisition Proposals”) or offer or inquiry that would reasonably be expected
to lead to any acquisition proposal;
·
enter into or participate in any discussions or negotiations with, furnish any information relating to Raven or any of its subsidiaries or afford
access to the business, properties, assets, books or records of Raven or any of its subsidiaries to, otherwise knowingly cooperate in any way
with, or knowingly assist or participate in any effort by any third party that is seeking to make, or has made, an acquisition proposal;
·
make an adverse recommendation change (as described in the section entitled “The Merger Agreement—Restrictions on Solicitation of
Acquisition Proposals”);
·
fail to enforce or grant a waiver or release under a standstill or similar agreement with respect to any class of equity securities of Raven or any of
its subsidiaries;
·
approve any transaction under, or any person becoming an “interested shareholder” under, the business combination provisions of South
Dakota Law (Section 47-33-17 to Section 47-33-19, inclusive);
5
Table of Contents
·
enter into any agreement in principle, letter of intent, term sheet, merger agreement, acquisition agreement, option agreement or other similar
instrument relating to an acquisition proposal; or
·
publicly propose to do any of the foregoing.
Raven also agreed in the Merger Agreement to (and agreed to cause its subsidiaries to) cease immediately and cause to be terminated any and all existing
activities, discussions or negotiations, if any, with any third party and its representatives with respect to any acquisition proposal and to send written notice
demanding that any such third party or its representatives in possession of non-public information in respect of Raven or its subsidiaries return or destroy all
such information, and that it would promptly terminate all physical and electronic data access previously granted to such persons.
Notwithstanding the restrictions described above, if at any time prior to obtaining the Shareholder Approval, (i) Raven or any of its representatives receives a
bona fide acquisition proposal that the Board reasonably believes, after consultation with Raven’s financial advisor, constitutes or is reasonably likely to lead
to a “superior proposal” (as described in the section entitled “The Merger Agreement—Restrictions on Solicitation of Acquisition Proposals”) and (ii) the
Board determines in good faith, after consultation with its outside legal counsel, that the failure to take such action would reasonably be expected to be
inconsistent with its fiduciary duties under applicable law, then Raven may provide information to and engage in discussions or negotiations with a third
party. Raven must deliver prior written notice to CNH Industrial advising that it intends to provide such information or engage in such discussions or
negotiations, and Raven must keep CNH Industrial promptly informed of the status and material terms of any such discussions or negotiations with the
applicable third party with respect to any acquisition proposal.
Changes in Board Recommendation (see page 61)
At any time prior to obtaining the approval of Raven’s shareholders, the Board is permitted to make an adverse recommendation change (i) following receipt
of a superior proposal that did not result from a willful and material breach of the no-shop covenant or (ii) in response to an “intervening event” (as described
in the section entitled “The Merger Agreement—Changes in Board Recommendation”), in each case, only if the Board determines in good faith, after
consultation with its outside legal counsel, that the failure to take such action would reasonably be expected to be inconsistent with its fiduciary duties under
applicable law; provided that:
·
Raven promptly notifies CNH Industrial in writing at least five business days before taking such action, attaching (A) in the case of an adverse
recommendation change to be made following receipt of a superior proposal, the most current version of the proposed agreement under which
such superior proposal is proposed to be consummated and the identity of the third party making the superior proposal, or (B) in the case of an
