Document,Section Header,Section Text,Start Page,End Page
bullet, an “adverse recommendation change”);
·
fail to enforce or grant a waiver or release under a standstill or similar agreement with respect to any class of equity securities of Raven or any of
its subsidiaries;
·
approve any transaction under, or any person becoming an “interested shareholder” under the business combination provisions of South
Dakota Law (Section 47-33-17 to Section 47-33-19, inclusive);
·
enter into any agreement in principle, letter of intent, term sheet, merger agreement, acquisition agreement, option agreement or other similar
instrument relating to an acquisition proposal; or
·
publicly propose to do any of the foregoing.
Raven also agreed in the Merger Agreement to (and agreed to cause its subsidiaries to) cease immediately and cause to be terminated any and all existing
activities, discussions or negotiations, if any, with any third party and its representatives with respect to any acquisition proposal and to send written notice
demanding that any such third party or its representatives in possession of nonpublic information in respect of Raven or its subsidiaries return or destroy all
such information, and that it would promptly terminate all physical and electronic data access previously granted to such persons.
Notwithstanding the restrictions described above, if at any time prior to obtaining the Shareholder Approval, (i) Raven or any of its representatives receives a
bona fide acquisition proposal that the Board reasonably believes, after consultation with Raven’s financial advisor, constitutes or is reasonably likely to lead
to a “superior proposal” (as described below) and (ii) the Board determines in good faith, after consultation with its outside legal counsel, that the failure to
take such action would reasonably be expected to be inconsistent with its fiduciary duties under applicable law, then Raven may:
·
Enter into or engage in negotiations or discussions with such third party and its representatives; and
·
Furnish to such third party or its representatives nonpublic information relating to Raven or any of its subsidiaries pursuant to a confidentiality
agreement that meets certain standards; provided that Raven is required to promptly provide to CNH Industrial any such information that is
provided to any such person which was not previously provided to or made available to CNH Industrial.
In addition, the Board is not permitted to take any of the actions referred to in the above bullets unless Raven has first delivered to CNH Industrial prior
written notice advising CNH Industrial that it intends to take such action.
Raven is required to keep CNH Industrial promptly informed after taking any action referred to in the above bullets of the status and material terms of any
discussions and negotiations with the applicable third party with respect to any acquisition proposal. In addition, Raven is required to notify CNH Industrial
promptly (but in no event later than 24 hours) after receipt by Raven (or any of its representatives) of any acquisition proposal or any request for information
relating to Raven or any of its subsidiaries or for access to the business, properties, assets, books or records of Raven or any of its subsidiaries by any third
party that is considering making, or has made, an acquisition proposal, which notice must include the material terms and conditions of any such acquisition
proposal or request. Raven is required to keep CNH Industrial
60Table of Contents
informed as to the status and details of any such acquisition proposal or request on a reasonably prompt basis, including promptly (but in no event later than
24 hours of receipt) providing to CNH Industrial copies of all correspondence and written materials sent or provided to Raven or any of its subsidiaries that
describes any terms or conditions of any acquisition proposal (as well as written summaries of any material oral communications addressing such matters) or
any amendment thereto.
For purposes of the Merger Agreement, “acquisition proposal” means any proposal, offer, inquiry or indication of interest from any third party providing for:
·
Any acquisition or purchase, direct or indirect, of 25% or more of the consolidated assets of Raven or 25% or more of any class of equity or
voting securities of Raven or any of its subsidiaries, whose assets, individually or in the aggregate, constitute 25% or more of the consolidated
assets of Raven;
·
Any tender offer or exchange offer that, if consummated, would result in such third party beneficially owning 25% or more of any class of equity
or voting securities of Raven or any of its subsidiaries, whose assets, individually or in the aggregate, constitute 25% or more of the
consolidated assets of Raven; or
·
A merger, consolidation, share exchange, business combination, sale of substantially all the assets, reorganization, recapitalization, liquidation,
dissolution or similar transaction involving Raven or any of its subsidiaries, whose assets, individually or in the aggregate, constitute 25% or
more of the consolidated assets of Raven.
For purposes of the Merger Agreement, “superior proposal” means a bona fide, written acquisition proposal for at least a majority of the outstanding shares
of Raven common stock or all or substantially all of the consolidated assets of Raven and its subsidiaries on terms that the Board determines in good faith,
after considering the advice of a financial advisor and outside legal counsel, are more favorable to Raven’s shareholders than those provided in the Merger
Agreement (taking into account (x) any proposal by CNH Industrial to amend the terms of the Merger Agreement and (y) all of the terms and conditions of
such acquisition proposal (including any legal, financial, regulatory and governmental approval and stockholder approval requirements and the financing
thereof)).
Changes in Board Recommendation",34,35
RAVEN INDUSTRIES INC_20210806_DEFM14A_19454710_4273900.Pdf,Changes in Board Recommendation,"Changes in Board Recommendation
At any time prior to obtaining the approval of Raven’s shareholders, the Board is permitted to make an adverse recommendation change (i) following receipt
of a superior proposal that did not result from a willful and material breach of the no-shop covenant or (ii) in response to an “intervening event” (as described
below), in each case, only if the Board determines in good faith, after consultation with its outside legal counsel, that the failure to take such action would
reasonably be expected to be inconsistent with its fiduciary duties under applicable law; provided that:
·
Raven promptly notifies CNH Industrial in writing at least five business days before taking such action, attaching (A) in the case of an adverse
recommendation change to be made following receipt of a superior proposal, the most current version of the proposed agreement under which
such superior proposal is proposed to be consummated and the identity of the third party making the superior proposal, or (B) in the case of an
adverse recommendation change to be made pursuant to an intervening event, a reasonably detailed description of the reasons for making such
adverse recommendation change;
·
Raven negotiates in good faith with CNH Industrial (if requested by CNH Industrial) for five business days following such notice regarding any
proposal by CNH Industrial to amend the terms of the Merger Agreement in response to such potential adverse recommendation change; and
·
The Board determines in good faith, after consultation with its outside legal counsel and Raven’s financial advisor, that CNH Industrial has not
made, within such five business day period, an offer that (A) in the case of any adverse recommendation change to be made following receipt of
a superior proposal, is at least as favorable
61
Table of Contents
to Raven’s shareholders as such superior proposal (it being understood and agreed that any amendment to the financial terms or other material
terms of such superior proposal shall require a new written notification from Raven and a new three business day period) or (B) in the case of an
adverse recommendation change to be made pursuant to an intervening event, obviates the need for such adverse recommendation change.
Nothing in the Merger Agreement prevents Raven or its Board from:
·
taking and disclosing to its shareholders a position contemplated by Rule 14d-9 and Rule 14e-2(a) promulgated under the 1934 Act;
·
making any legally required disclosure to shareholders with regard to the transactions contemplated by the Merger Agreement or an acquisition
proposal provided that any adverse recommendation change involving or relating to an acquisition proposal may only be made in accordance
with the terms of the Merger Agreement;
·
issuing a “stop, look and listen” disclosure or similar communication of the type contemplated by Rule 14d-9(f) under the 1934 Act; or
·
contacting and engaging in discussions with any person or group and their respective representatives who has made an acquisition proposal
that was not solicited in breach of the no-shop covenant solely for the purpose of clarifying such acquisition proposal and the terms thereof.
For purposes of the Merger Agreement, an “intervening event” means any material event, change, occurrence, effect or development arising after the date of
the Merger Agreement that was not known by nor was reasonably foreseeable (with respect to substance or timing) to the Board as of the date of the Merger
Agreement; provided, that in no event shall any of the following events, changes, occurrences, effects or developments be taken into account for purposes
of determining whether an intervening event has occurred: (x) the receipt of an acquisition proposal or a superior proposal or any inquiry or communications
or matters relating thereto; or (y) the announcement, pendency and consummation of the Merger Agreement or the Merger or any actions expressly required
to be taken or to be refrained from being taken pursuant to the Merger Agreement.
Regulatory Clearances and Approvals Required for the Merger
The completion of the Merger is conditioned on, among other things, certain specified regulatory approvals having been obtained and remaining in full force
and effect (or, in the case of certain specified regulatory approvals that are statutory waiting periods, having expired or been terminated), including the
expiration or termination of any applicable waiting period under the HSR Act and the receipt of CFIUS approval. Under the terms of the Merger Agreement,
each of Raven and CNH Industrial agrees to use their respective reasonable best efforts to take, or cause to be taken, all actions and to do, or cause to be
done, all things necessary, proper or advisable under applicable law to consummate the transactions contemplated by the Merger Agreement, including (i)
preparing and filing as promptly as practicable with any governmental authority all documentation to effect all necessary filings, notices, petitions,
statements, registrations, submissions of information, applications and other documents and (ii) obtaining and maintaining all approvals, consents,
registrations, permits, authorizations and other confirmations required to be obtained from any governmental authority that are necessary, proper or advisable
to consummate the transactions contemplated by the Merger Agreement.
CNH Industrial acknowledges and agrees that its obligation to use reasonable best efforts to obtain such regulatory clearances includes taking, or causing to
be taken, and doing, or causing to be done, all things necessary, proper or advisable under applicable law to consummate the transactions contemplated by
the Merger Agreement, including divestitures, hold separate arrangements, the termination, assignment, novation or modification of contracts or other
business relationships, the acceptance of restrictions on business operations, the entry into other commitments and limitations, and litigation, including with
governmental authorities, to obtain the approvals, consents, registrations, permits, authorizations, orders, waivers,
62
Table of Contents
non-objections and other confirmations required to be obtained from any governmental authority to consummate the transactions contemplated by the
Merger Agreement; provided that CNH Industrial will not be required to (x) proffer to, agree to, or take any action, including accept any restrictions on
business operations or enter into other commitments or limitations on the freedom of action of CNH Industrial and its subsidiaries (including, after the closingof the Merger, Raven and its subsidiaries), that, individually or in the aggregate, would reasonably be expected to have a material adverse effect on the
business, properties, assets, liabilities, results of operations or financial condition of the Applied Technology Division, or (y) proffer to, agree to or take any
action that, individually or in the aggregate, would reasonably be expected to have a material adverse effect on the business, properties, assets, liabilities,
results of operations or financial condition of CNH Industrial and its subsidiaries, taken as a whole, after giving effect to the Merger (measured on a scale
relative to Raven and its subsidiaries, taken as a whole) (any action set forth in clause (x) or (y), a “materially burdensome regulatory condition”).
CNH Industrial and Raven will (i) make an appropriate filing of a Notification and Report Form pursuant to the HSR Act with respect to the transactions
contemplated by the Merger Agreement as promptly as practicable and in any event within fifteen business days after the date of the Merger Agreement, (ii)
make all appropriate filings, notices, applications or similar documents required under any non-U.S. antitrust law as promptly as practicable, and (iii) take all
actions with the Committee on Foreign Investment in the United States (“CFIUS”) as may be advisable under applicable law to obtain CFIUS approval,
including (A) submitting a draft CFIUS joint voluntary notice in accordance with Section 721 of the Defense Production Act of 1950 (50 U.S.C. § 4565), and all
rules and regulations thereunder, including those codified at 31 C.F.R. Part 800 et seq. (the “DPA”) as promptly as practicable after the signing of the Merger
Agreement, (B) submitting a final CFIUS joint notice to CFIUS after promptly resolving all comments to the draft CFIUS joint voluntary notice from CFIUS and
(C) in the case of a CFIUS declaration, submitting a CFIUS joint voluntary notice if CFIUS so requests or informs CNH Industrial and Raven that it is not able
to conclude action under the DPA with respect to the Merger on the basis of such CFIUS declaration. Each of CNH Industrial and Raven shall (i) respond as
promptly as practicable to any inquiries received from any governmental authority for additional information or documentation and to all inquiries and
requests in connection with the matters contemplated by this section, including responding to any request for information from CFIUS in the applicable
timeframe set forth in the DPA, subject to any extensions of such time that may be granted by CFIUS staff upon the request of a party to the CFIUS joint
notice and (ii) not extend any waiting period under the HSR Act or enter into any agreement with any governmental authority not to consummate the
transactions contemplated by the Merger Agreement, except with the prior written consent of the other parties to the Merger Agreement. CNH Industrial
agrees that it shall not agree to withdraw or resubmit the final filing submitted to CFIUS without the prior written consent of Raven. For purposes of the
Merger Agreement, “CFIUS approval” means that any of the following shall have occurred: (a) CFIUS has concluded that none of the transactions
contemplated by the Merger Agreement (including the Merger) is a “covered transaction” subject to review under the DPA; (b) CFIUS has issued a written
notice that it has completed a review or investigation of the notification voluntarily provided pursuant to the DPA with respect to the transactions
contemplated by the Merger Agreement (including the Merger), and has concluded all action under the DPA; or (c) CFIUS has sent a report to the President
of the United States requesting the President’s decision on the CFIUS joint notice and (i) the President has announced a decision not to take any action to
suspend or prohibit the transactions contemplated by the Merger Agreement (including the Merger) or (ii) the President has announced a decision not to
exercise authority under the DPA to prohibit the transactions contemplated by the Merger Agreement (including the Merger) within 15 days after the date on
which the President received such report from CFIUS.
As promptly as possible, Raven and CNH Industrial will submit, or cause to be submitted, a notification regarding the transactions contemplated by the
Merger Agreement to Directorate of Defense Trade Controls of the Department of State (the “DDTC”) pursuant to Section 122.4(b) of the U.S. International
Traffic in Arms Regulation set forth in 22 C.F.R. Parts 120 and 130 (“ITAR”). The Company shall promptly prepare any amendments and license transfer
requests, or take any other necessary steps, if requested by CNH Industrial, to transfer current permits applicable to the business that are issued pursuant to
the applicable provisions of U.S. export control laws and regulations, including the Arms Export Control Act (22 U.S.C. 2778 et seq.), ITAR, the Export
Controls Act of 2018 (22 U.S.C. 2751 et seq.), the Export Administration Regulations (15 C.F.R. 730 et seq.), the Foreign Trade Regulations (15 C.F.R. Part 30),
the U.S. anti-boycott laws and regulations and associated executive orders related to any such applicable laws relating to exports to the countries where
Raven and its subsidiaries conduct business, including U.S. government export and import licenses, agreements and other approvals, to CNH Industrial or
such entity as CNH Industrial shall designate. No later than five days after the date of the closing of the Merger, CNH Industrial shall file a material change
notice with DDTC as required under the ITAR, at 22 C.F.R. § 122.4(a). For purposes of the Merger Agreement, “DDTC approval” means that 60 days shall
have elapsed after the filing of a notification regarding the transactions contemplated by the Merger Agreement with DDTC pursuant to Section 122.4(b) of
the ITAR, or that DDTC shall have provided the parties a written notice that it has concluded its review of the transactions contemplated by the Merger
Agreement.
63
Table of Contents
Raven will also cooperate with CNH Industrial to ensure that Raven promptly submits the appropriate filings with or notices to Defense Counterintelligence
and Security Agency of the Department of Defense (“DCSA”) with respect to the transactions contemplated by the Merger Agreement, including, but not
limited to a pro forma draft SF-328 reflecting Raven’s impending change of ownership and control, and to comply with requirements of DCSA, including
pursuant to the National Industrial Security Program Operating Manual, applicable to it, and shall use its reasonable best efforts to provide any information
about its possession or control requested by DCSA in connection with DCSA’s review of the Merger and the foreign ownership, control or influence
following the completion of the Merger, in order to obtain the DCSA approval. To the extent not prohibited by DCSA, Raven shall (x) keep CNH Industrial
fully informed of material contacts, filings and discussions, including negotiations, with DCSA relating to the foregoing and (y) shall, to the extent feasible,
invite representatives of CNH Industrial to participate in conversations or negotiations with DCSA about any DCSA-suggested mechanisms to mitigate the
national security risks of foreign ownership, control or influence “FOCI mitigation” applicable to it, to the extent permitted by DCSA. Raven and CNH
Industrial shall cooperate to ensure that any FOCI mitigation agreement agreed to with DCSA imposes on Raven and CNH Industrial the fewest restrictions
on governance rights and information access consistent with the requirements of DCSA, applicable law and regulations. For purposes of the Merger
Agreement, “DCSA approval” means the acceptance by DCSA of the parties’ signed commitment letter to mitigate foreign ownership, control or influence
with respect to the transactions contemplated by the Merger Agreement in accordance with the National Industrial Security Program Operating Manual.
CNH Industrial will (i) offer to take (and if such offer is accepted, commit to take) with respect to itself, Raven and its and Raven’s respective subsidiaries all
actions necessary to avoid or eliminate impediments under any applicable law that may be asserted by any governmental authority with respect to the Merger
and the other transactions contemplated by the Merger Agreement so as to enable the consummation thereof as promptly as reasonably practicable (and in
any event prior to July 1, 2022); provided that in no event shall CNH Industrial be required to take, offer to take or agree to take any action that would
constitute a materially burdensome regulatory condition; and (ii) not, and shall cause its subsidiaries not to, acquire or agree to acquire (by merger,
consolidation or otherwise) any person or portion thereof, or otherwise acquire or agree to acquire any assets, if such acquisition or agreement would
reasonably be expected to jeopardize the consummation of the Merger in accordance with the terms of the Merger Agreement or would reasonably be
expected to delay beyond July 1, 2022, or restrain, prevent, enjoin, materially increase the risk of not obtaining any necessary consents of any governmental
authority or the expiration or termination of any applicable waiting period, or otherwise prohibit consummation of the Merger and the other transactions
contemplated by the Merger Agreement.
At the request of CNH Industrial, Raven will agree to divest, hold separate or otherwise take or commit to take any action that limits its freedom of action with
respect to, or its ability to retain, any of the businesses, services, or assets of Raven or any of its subsidiaries (but, absent such request, Raven shall not take
any such action); provided that any such action shall be conditioned upon the consummation of the Merger and the other transactions contemplated by the
Merger Agreement. Raven and its subsidiaries shall not take or agree to take any actions that would constitute a materially burdensome regulatory condition
without the prior written consent of CNH Industrial which, without limiting CNH Industrial’s obligations under this section, may be granted or withheld in
CNH Industrial’s sole discretion.
Each party will (i) promptly notify the other parties of any written responses to or communication to that party from any governmental authority and, subject
to applicable law, permit the other parties to review in advance any proposed written communication in respect thereof; (ii) not participate or agree to
participate in any substantive meeting or discussion with any governmental authority in respect of any filings, investigation or inquiry concerning matters in
connection with the Merger Agreement or the Merger and the other transactions contemplated by the Merger Agreement unless it consults with the other
parties in advance and, to the extent permitted by such governmental authority, gives the other parties the opportunity to attend and participate thereat; and
(iii) furnish the other parties with copies of all correspondence, filings, and communications (and memoranda setting forth the substance thereof) between it
and its affiliates and representatives on the one hand, and any governmental authority or members or their respective staffs on the other hand, with respect to
any matters in connection with the Merger Agreement.
Litigation Related to the Merger
Under the terms of the Merger Agreement, Raven will control the defense or settlement of any litigation or other legal proceedings against Raven or any of its
directors relating to the transactions contemplated by the Merger Agreement; provided that Raven (i) will give CNH Industrial reasonable opportunity to
participate, at CNH Industrial’s expense, in such litigation or legal proceedings and (ii) agrees that it will not settle any such litigation or legal proceedings
without the prior written consent of CNH Industrial, which consent will not be unreasonably withheld, delayed or conditioned.
64
Table of Contents
Employee Matters",35,37
RAVEN INDUSTRIES INC_20210806_DEFM14A_19454710_4273900.Pdf,Employee Matters,"Employee Matters
From and after the Effective Time, CNH Industrial will honor, or will cause one of its subsidiaries (including Raven) to honor, all contractual obligations under
Raven’s employee plans. For twelve months following the closing of the Merger, CNH Industrial will provide each Raven employee who is employed
immediately prior to the closing of the Merger (including any Raven employee who is not actively working on the date of the closing of the Merger as a result
of an approved leave of absence) and who remains in the employ of CNH Industrial, Raven or any of its subsidiaries after the closing of the Merger (a
“Continuing Employee”), (i) a base compensation and target annual cash bonus opportunity in each case that is no less favorable than the base
compensation and target annual cash bonus opportunity to which such Continuing Employee was entitled immediately prior to the closing of the Merger, (ii)
