Document,Section Header,Section Text,Start Page,End Page
except where the failure to comply with such Laws has not had and would not reasonably be expected to have a Parent Material Adverse Effect. None of
the Parent Parties has, during the past five years: (a) received any written notice from any Governmental Authority regarding any material violation by the
Parent Parties of any Law; or (b) provided any written notice to any Governmental Authority regarding any material violation by any of the Parent Parties
of any Law, which notice in either case of clauses (a) and (b) remains outstanding or unresolved as of the date hereof, except for such notices that would
not reasonably be expected to have, individually or in the aggregate, a Parent Material Adverse Effect.
Section 5.10 Brokers. No broker, investment banker or other Person that has been retained by or is authorized to act on behalf of the Parent Parties is
entitled to any broker’s, finder’s or other similar fee or commission payable by the Company or any of its Affiliates or any of their respective stockholders
in connection with the Merger and the other transactions contemplated by this Agreement.
Section 5.11 Takeover Statutes. None of the Parent Parties or, to the knowledge of the Parent Parties, any of their respective Affiliates, beneficially owns
(as defined in Rule 13d-3 under the Exchange Act) any Company Capital Stock or any securities that are convertible into or exchangeable or exercisable
for Company Capital Stock, or holds any rights to acquire or vote any Company Capital Stock, other than pursuant to this Agreement. None of the Parent
Parties or any of their Subsidiaries or the “Affiliates” or, to the knowledge of the Parent Parties, the “associates” of any such person, within the past five
years, has been an “interested stockholder” of the Company, in each case as defined in Section 3-601 of the MGCL.
Section 5.12 Information Supplied. None of the information supplied or to be supplied in writing on or behalf of the Parent Parties or any of their
respective Subsidiaries specifically for inclusion or incorporation by reference in the Proxy Statement will, at the time it is first mailed to the Company’s
stockholders, at the time of any amendment or supplement to the Proxy Statement, at the time of the Stockholders Meeting or at the Merger
A-37
Table of Contents
Effective Time, contain any untrue statement of a material fact or omit to state any material fact required to be stated therein or necessary in order to make
the statements therein, in light of the circumstances under which they are made, not misleading.
Section 5.13 No Other Representations and Warranties. Except for the representations or warranties expressly set forth in this Article V or any document,
agreement, certificate or other instrument contemplated hereby, none of the Parent Parties or any other Person on behalf of a Parent Party has made any
representation or warranty, expressed or implied, with respect to the Parent Parties or any of their respective Affiliates, their respective businesses,
operations, assets, liabilities, condition (financial or otherwise), results of operations, future operating or financial results, estimates, projections,
forecasts, plans or prospects (including the reasonableness of the assumptions underlying such estimates, projections, forecasts, plans or prospects) or
the accuracy or completeness of any information regarding the Parent Parties or any of their respective Affiliates. In particular, without limiting the
foregoing disclaimer, none of the Parent Parties or any other Person on behalf of a Parent Party makes or has made any representation or warranty to the
Company or any of its Affiliates or Representatives with respect to the Parent Parties, except for the representations and warranties made by the Parent
Parties in this Article V or any document, agreement, certificate or other instrument contemplated hereby, any oral or written information presented to the
Company or any of its Affiliates or Representatives in the course of their due diligence of the Parent Parties, the negotiation of this Agreement or in the
course of the transactions contemplated by this Agreement. Notwithstanding anything contained in this Agreement to the contrary, the Parent Parties
acknowledge and agree that none of the Company or any other Person on behalf of the Company has made or is making any representations or
warranties relating to the Acquired Companies whatsoever, express or implied, beyond those expressly given by the Company in Article IV or any
document, agreement, certificate or other instrument contemplated hereby, including any implied representation or warranty as to the accuracy or
completeness of any information regarding any Acquired Company furnished or made available to the Parent Parties or any of their respective
Representatives.
ARTICLE VI
COVENANTS RELATING TO CONDUCT OF BUSINESS PENDING THE MERGER
Section 6.1 Conduct of Business by the Company.
(a) The Company covenants and agrees that, between the date of this Agreement and the earlier to occur of the Merger Effective Time and the date, if
any, on which this Agreement is terminated pursuant to Section 9.1 (the “Interim Period”), except (i) to the extent required by Law, (ii) as may be
consented to in advance in writing by Parent (which consent shall not be unreasonably withheld, delayed or conditioned), (iii) as may be expressly
contemplated, required or expressly permitted by this Agreement, or (iv) as set forth in Schedule 6.1 of the Company Disclosure Letter, the Company
shall, and shall cause each Subsidiary of the Company to, (A) conduct its business in all material respects in the ordinary course and in a manner
consistent with past practices, and (B) use all reasonable efforts to (1) preserve intact its current business organization, goodwill, ongoing businesses
and significant relationships with tenants and other third parties, (2) retain the services of its current officers at the level of vice president or higher, (3)
preserve its assets and properties in good repair and condition (normal wear and tear excepted) and (4) maintain the status of the Company as a REIT.
(b) Without limiting the foregoing, the Company covenants and agrees that, during the Interim Period, except to the extent required by Law, as may be
consented to in advance in writing by Parent (which consent shall not be unreasonably withheld, delayed or conditioned), as may be expressly
contemplated, required or expressly permitted by this Agreement, or as set forth in Schedule 6.1 of the Company Disclosure Letter, the Company shall
not, and shall not cause or permit any Subsidiary of the Company to, do any of the following:
(i) (A) amend or propose to amend the Company Governing Documents or, other than in the ordinary course of business, such equivalent organizational
or governing documents of any Subsidiary of the
A-38
Table of Contents
Company, in each case, whether by merger, consolidation or otherwise, (B) reinitiate, or amend in a manner material to the Company, the Distribution
Reinvestment Plan or the Share Redemption Program, or (C) waive the stock ownership limit or create (or increase) an Excepted Holder Limit (as defined in
the Company Charter) under the Company Charter;
(ii) adjust, split, combine, reclassify or subdivide any shares of stock or other equity securities or ownership interests of any Acquired Company (other
than any Wholly Owned Company Subsidiary);
(iii) declare, set aside or pay any dividend on or make any other actual, constructive or deemed distributions (whether in cash, stock, property or
otherwise) with respect to Company Capital Stock or other equity securities or ownership interests in any Acquired Company or otherwise make any
payment to its or their stockholders or other equity holders in their capacity as such, except for (A) the declaration and payment by the Company of
regular quarterly dividends for the first and second quarters of 2022 on shares of Company Common Stock in accordance with past practice; provided,
that, the Company shall ensure that (1) the record date with respect to any such quarterly dividend shall be consistent with historical record dates from
fiscal year 2021 or if such date is not a Business Day, the next day that is a Business Day and (2) any such individual quarterly dividend on shares of
Company Common Stock shall not exceed $0.07 per share, (B) the declaration and payment of dividends or other distributions to the Company by any
Wholly Owned Company Subsidiary, (C) distributions by any Subsidiary of the Company that is not wholly owned, directly or indirectly, by the
Company, in accordance with the requirements of the organizational documents of such Subsidiary, and (D) distributions resulting from the vesting or
settlement of Company Compensatory Awards in existence as of the date hereof or issued after the date hereof in accordance with this Agreement;
provided, that, notwithstanding the restriction on dividends and other distributions in this Section 6.1(b), the Company and any Subsidiary of the
Company shall be permitted to make distributions in accordance with Section 7.11;
(iv) redeem, repurchase or otherwise acquire, directly or indirectly, any shares of Company Capital Stock or any other equity interests of the Company or
any Subsidiary of the Company, except for shares of Company Capital Stock withheld by, or forfeited to, the Company in connection with the vesting and
settlement of taxes for outstanding Company Compensatory Awards in the ordinary course;
(v) except for transactions among the Company and one or more Wholly Owned Company Subsidiaries or among one or more Wholly Owned Company
Subsidiaries, issue, sell, pledge, dispose, permit any Lien (other than Permitted Liens) on or grant any shares of Company Capital Stock or any other
equity interests in the Company or the Subsidiaries of the Company or any options, warrants, convertible securities or other rights of any kind to acquire
any shares of (or any rights linked to the value of) Company Capital Stock or any other equity interests in the Company or in the Subsidiaries of the
Company, or enter into any agreement, arrangement or understanding with respect to the sale, registration or voting of the Company Capital Stock or any
other equity interests in the Company or in the Subsidiaries of the Company;
(vi) acquire or agree to acquire (whether by merger, consolidation, acquisition of stock or assets, or otherwise) any assets or interest in any Person,
except (A) acquisitions by the Company or any Wholly Owned Company Subsidiary of or from an existing Wholly Owned Company Subsidiary and (B)
other acquisitions of personal property and equipment in the ordinary course of business for a purchase price of less than $3,000,000 in the aggregate;
(vii) except as described in Schedule 6.1(b)(vii) of the Company Disclosure Letter or as permitted by clause (viii) below, sell, mortgage, pledge, lease,
license, assign, transfer, abandon, dispose of or permit any material Lien on, or effect a deed in lieu of foreclosure with respect to, any real property or any
other material property, material rights or material assets, except pursuant to residential leases for multifamily units, Permitted Liens incurred in the
ordinary course of business;
(viii) incur, create, assume, guarantee, refinance, replace or prepay any Indebtedness for borrowed money or issue or materially amend the terms of any
Indebtedness of the Acquired Companies, except
A-39
Table of Contents
(A) Indebtedness incurred under the Company’s existing Debt Facilities in the ordinary course of business (including to the extent necessary to pay
dividends permitted by Section 6.1(b)(iii)) that does not, in the aggregate, exceed $5,000,000); (B) repayments under the existing Debt Facilities in the
ordinary course of business consistent with past practice (specifically excluding the loans secured directly or indirectly by any Company Property) and
(C) mandatory payments under the terms of any Indebtedness in accordance with its terms;
(ix) make any loans, advances or capital contributions to, or investments in, any other Person (including to any of its officers, directors, Affiliates, agents
or consultants) or make any change in its existing borrowing or lending arrangements for or on behalf of such Persons, other than by the Company or a
Wholly Owned Company Subsidiary to the Company or a Wholly Owned Company Subsidiary;
(x) enter into, renew, modify, amend or terminate, or waive, release, compromise or assign any rights or claims under, any Material Contract (or any
Contract that, if existing as of the date hereof, would be a Material Contract), other than any termination or renewal in accordance with the terms of any
existing Material Contract that occurs automatically without any action by any Acquired Company; provided, however, that if Parent fails to respond to
the Company’s written request for approval of any such action (which response may include a request for additional information) within 48 hours of
receipt of any such request made to each of the Persons set forth on Schedule 6.1(b)(x) of the Company Disclosure Letter in the manner set forth in
Section 10.2, Parent shall be deemed to have given its written consent to such action;
(xi) except as set forth in Schedule 6.1(b)(xi) of the Company Disclosure Letter, make any payment, direct or indirect, of any liability of any Acquired
Company before the same comes due in accordance with its terms, other than (A) in the ordinary course of business, or (B) in connection with
dispositions or refinancings of any Indebtedness otherwise permitted hereunder;
(xii) waive, release, assign, settle or compromise any Action, other than waivers, releases, assignments, settlements or compromises that (A) with respect
to the payment of monetary damages, involve only the payment of monetary damages (excluding any portion of such payment payable under an existing
property-level insurance policy) that do not exceed $2,000,000 individually or $5,000,000 in the aggregate, (B) do not involve the imposition of injunctive
relief against any Acquired Company or the Surviving Entity, (C) do not provide for any admission of liability by any of the Acquired Companies, and (D)
with respect to any Action involving any present, former or purported holder or group of holders of Company Common Stock comply with Section 7.7(c)
(excluding in each case any such matter related to Taxes, which, for the avoidance of doubt, shall be covered by Section 6.1(b)(xvi));
(xiii) except as set forth in Schedule 6.1(b)(xiii) of the Company Disclosure Letter, (A) hire or, except where due to cause, terminate any officer of the
Company or increase employee headcount by more than 3%, (B) increase in any manner the amount, rate or terms of compensation or benefits of any of
the Acquired Companies’ directors, officers or employees, except for increases in annual compensation or wage rate in the ordinary course of business or
as required under any Company Benefit Plan set forth on Schedule 4.17(a) of the Company Disclosure Letter or as may be required to comply with
applicable Law, (C) enter into, adopt, amend or terminate any employment, bonus, severance or retirement Contract or Company Benefit Plan (or any plan,
agreement, program, policy, trust, fund or other arrangement that would be a Company Benefit Plan if it were in existence as of the date of this Agreement)
or other compensation or employee benefits arrangement, except in the ordinary course in conjunction with annual Employee Benefit Plan renewals or as
may be required to comply with applicable Law, (D) grant to any of the Acquired Companies’ directors, officers or employees any new or additional
entitlement to severance or termination pay or any other payments or benefits triggered by a change of control or by the transactions contemplated by
this Agreement or (E) recognize any union or other labor organization as the representative of any of the employees of the Company, or enter into
collective bargaining agreement with any labor organization;
A-40
Table of Contents
(xiv) make any material change to its methods, principles or procedures of accounting in effect as of December 31, 2020, except as required by a change in
GAAP or in applicable Law, or make any change with respect to accounting policies, principles or practices, in each case, except for such changes that are
required by GAAP, the SEC or applicable Law, or as otherwise specifically disclosed in the Company SEC Documents filed prior to the date hereof;
(xv) enter into any new line of business;
(xvi) enter into or modify in a manner adverse to any Acquired Company, or take (or fail to take) any action that would violate, be inconsistent with, or
give rise to liability with respect to, any Tax Protection Agreement, make, change or rescind any entity classification or other material election relating to
Taxes, change a material method of Tax accounting, change any Tax accounting period, file or amend any material Tax Return, settle or compromise any
material Tax liability, audit, claim or assessment, enter into any material closing agreement related to Taxes, knowingly surrender any right to claim any
material Tax refund, or give or request any waiver or extension of a statute of limitation with respect to any material Tax Return or Tax claim or assessment
except, in each case, (A) to the extent required by Law, or (B) to the extent necessary, as reasonably determined after consultation with Parent, (1) to
preserve the Company’s qualification as a REIT under the Code, or (2) to qualify or preserve the status of any Subsidiary of the Company as a
disregarded entity or partnership for U.S. federal income tax purposes or as a Qualified REIT Subsidiary or a Taxable REIT Subsidiary under the applicable
provisions of Section 856 of the Code, as the case may be;
(xvii) take any action that would, or fail to take any action, the failure of which to be taken would, reasonably be expected to cause the Company to fail to
qualify as a REIT or any Subsidiary of the Company to cease to be treated as any of (A) a partnership or disregarded entity for federal income tax
purposes, or (B) a Qualified REIT Subsidiary or a Taxable REIT Subsidiary under the applicable provisions of Section 856 of the Code, as the case may be;
(xviii) make or commit to make any capital expenditures other than (A) within the applicable thresholds set forth on Schedule 6.1(b)(xviii) of the Company
Disclosure Letter, (B) to address obligations required under existing Contracts or (C) for emergency repairs required by Law;
(xix) adopt a plan of merger, complete or partial liquidation or resolutions providing for or authorizing such merger, liquidation or a dissolution,
consolidation, recapitalization or bankruptcy reorganization;
(xx) materially modify or reduce the amount of any insurance coverage provided by the Insurance Policies;
(xxi) make any material adverse change to their publicly posted privacy policies or the operation or security of their IT Assets, except as required by
applicable Law;
(xxii) (A) initiate or consent to any zoning reclassification of any Company Property, or any change to any approved site plan, special use permit or other
land use entitlement affecting any Company Property or (B) amend, modify or terminate, or fail to use commercially reasonable efforts to avoid the lapse
of, any Permit of the Company or its Subsidiaries, in each case of clauses (A) and (B) except as would not reasonably be expected to materially adversely
impair the current use, operation or value of the subject Company Property;
(xxiii) except as set forth in Schedule 6.1(b)(xxiii) of the Company Disclosure Letter, apply for or receive any relief under the COVID-19 Laws; or
(xxiv) authorize or enter into any Contract to do any of the foregoing.
A-41
Table of Contents
(c) Notwithstanding anything to the contrary set forth in this Agreement, nothing in this Agreement shall prohibit the Company from taking any action,
at any time or from time to time, that in the reasonable judgment of the Company Board (or any committee thereof), upon advice of counsel to the
Company, is reasonably necessary (i) after consultation with Parent, for the Company to avoid or to continue to avoid incurring entity level income or
excise Taxes under the Code or to maintain its qualification as a REIT under the Code or otherwise to qualify or preserve the status of any Subsidiary of
the Company for federal income tax purposes as a partnership, disregarded entity, Qualified REIT Subsidiary or Taxable REIT Subsidiary for any period or
portion thereof ending on or prior to the Closing Date, or (ii) to establish or maintain any exemption from or otherwise avoid the imposition of any
requirement that any of the Acquired Companies be registered as an investment company under the Investment Company Act, including in the case of
clause (i) only, making dividend or any other actual, constructive or deemed distribution payments to stockholders of the Company as permitted pursuant
to Section 6.1(b)(iii) or Section 7.11.
Section 6.2 No Control of Other Parties’ Business. Notwithstanding the foregoing, nothing contained in this Agreement shall give directly or indirectly,
the right to control or direct any of the Acquired Companies’ operations prior to the Merger Effective Time. Prior to the Merger Effective Time, the
Company shall exercise, consistent with the terms and conditions of this Agreement, complete control and supervision over the Acquired Companies’
respective operations.
ARTICLE VII
ADDITIONAL COVENANTS
Section 7.1 Preparation of the Proxy Statement; Stockholder Approval.
(a) As promptly as reasonably practicable following the date of this Agreement, the Company shall prepare and, after approval by Parent (which shall not
be unreasonably withheld, delayed or conditioned), cause to be filed with the SEC the Proxy Statement in preliminary form with respect to the
Stockholders Meeting. The Company shall cause the Proxy Statement to comply as to form and substance in all material respects with the applicable
requirements of the Exchange Act. The Company shall promptly notify Parent and Merger Sub upon the receipt of any comments from the SEC or any
request from the SEC for amendments or supplements to the Proxy Statement, and shall, as promptly as practicable after receipt thereof, provide Parent
and Merger Sub with copies of all correspondence between it and its Representatives, on the one hand, and the SEC, on the other hand, and all written
comments with respect to the Proxy Statement received from the SEC and promptly advise Parent and Merger Sub of any oral comments with respect to
the Proxy Statement received from the SEC. The Company shall respond as promptly as practicable to any comments from the SEC with respect to the
Proxy Statement; provided that, prior to responding to any comments of the SEC, the Company shall provide Parent with a reasonable opportunity to
consult and review such response and the Company shall consider in good faith any comments on such response reasonably proposed by Parent. Prior
to filing the Proxy Statement (or any amendment or supplement thereto) with the SEC or responding to any comments of the SEC with respect thereto,
each of Parent and Merger Sub shall reasonably cooperate with the Company in connection with the preparation and filing of the Proxy Statement,
including promptly furnishing to the Company in writing upon request any and all information relating to Parent, Merger Sub and their respective
Affiliates as may be required, or otherwise reasonably requested by the Company, to be set forth in the Proxy Statement under applicable Law. The Proxy
Statement shall contain the Board Recommendation, except to the extent that the Company Board (or any committee thereof) shall have effected an
Adverse Recommendation Change, as permitted by and determined in accordance with Section 7.3.
(b) If, at any time prior to the receipt of the Stockholder Approval, any information relating to the Company or Parent, as the case may be, or any of their
respective subsidiaries or Affiliates, should be discovered by the Company or Parent which, in the reasonable judgment of the Company or Parent,
should be set forth in an
A-42
Table of Contents
amendment of, or a supplement to, the Proxy Statement, so that any of such documents would not include any misstatement of a material fact or omit to
state any material fact necessary to make the statements therein, in light of the circumstances under which they were made, not misleading, the Party that
discovers such information shall promptly notify the other Parties, and the Company and Parent shall cooperate in the prompt filing with the SEC of any
necessary amendment of, or supplement to, the Proxy Statement and, to the extent required by Law, in disseminating the information contained in such
amendment or supplement to stockholders of the Company; provided, however, that no amended or supplemental materials will be filed with the SEC or
mailed by the Company without affording Parent a reasonable opportunity in advance for consultation and review, and the Company shall consider in
good faith any comments on such materials reasonably proposed by Parent. Nothing in this Section 7.1(b) shall limit the obligations of any Party under
Section 7.1(a). For purposes of Section 4.23, Section 5.12 and this Section 7.1, any information concerning or related to the Company, its Affiliates or the
Stockholders Meeting will be deemed to have been provided by the Company and any information concerning or related to Parent or its Affiliates will be
deemed to have been provided by Parent.
