Document,Section Header,Section Text,Start Page,End Page
standalone operation, do not take into account any circumstances, transactions or events occurring after the date on which the financial projections were
prepared and do not give effect to any changes or expenses as a result of the merger or any effects of the merger. Further, the financial projections do not
prepared and do not give effect to any changes or expenses as a result of the merger or any effects of the merger. Further, the financial projections do not
take into account the effect of any failure of the merger to be consummated and should not be viewed as accurate or continuing in that context. The
financial projections also reflect assumptions as to certain business decisions that are subject to change. Given that the financial projections cover
multiple years, by their nature, they become subject to greater uncertainty with each successive year. Important factors that may affect actual results and
the achievability of the financial projections include, but are not limited to, local market conditions, general economic conditions and disruptions in the
financial, debt, capital, credit or securities markets, developing industry dynamics, competition, our ability to obtain financing, development and
redevelopment costs, changes in business strategy and those risks and uncertainties described in our Annual Report on Form 10-K for the fiscal year
ended December 31, 2020, as updated by our subsequent filings with the SEC. For additional information on factors that may cause our future financial
results to materially vary from the projected results summarized above, see the section entitled “Cautionary Statement Regarding Forward-Looking
Statements.”
The financial projections also reflect assumptions that are subject to change and are susceptible to multiple interpretations and periodic revisions based
on actual results, revised prospects for our business, changes in general business or economic conditions, certain accounting assumptions, timing of
business investments, changes in actual or projected cash flows, competitive pressures and changes in tax or other laws or regulations or any other
transaction or event that has occurred or that may occur and that was not anticipated when the financial projections were prepared. In addition, the
financial projections may be affected by our ability to achieve strategic goals, objectives and targets over the applicable period. Accordingly, actual
results will differ, and may differ materially, from those contained in the financial projections. The financial projections should be evaluated, if at all, in
conjunction with the historical financial statements and other information contained in our public filings with the SEC. There can be no assurance that the
financial results in the financial projections will be realized, or that future actual financial results will not materially vary from those estimated in the
financial projections.
The inclusion of the financial projections and accompanying narrative in the tables above should not be regarded as an indication that we, Blackstone,
our or its affiliates and/or any of our or their respective officers, directors, advisors or other representatives consider the financial projections to be
necessarily predictive of actual future events, and this information should not be relied upon as such. None of us, Blackstone, our or its affiliates nor any
of our or their respective officers, directors, advisors or other representatives gives any of our stockholders or any other person any assurance that
actual results will not differ materially from the financial projections, and we, Blackstone, our or its affiliates and/or our or their respective officers,
directors, advisors or other representatives undertake no obligation to update or otherwise revise or reconcile the financial projections to reflect
circumstances existing after the dates on which the financial projections were prepared or to reflect the occurrence of future events, even in the event that
any or all of the assumptions and estimates underlying the financial projections are shown to be in error or are no longer appropriate. Some or all of the
assumptions that have been made in connection with the preparation of the financial projections may have changed since the date the financial
projections were prepared. These considerations should be taken into account in reviewing the financial projections, which were prepared as of an earlier
date. None of us, our affiliates and/or our or their respective officers, directors, advisors or other representatives has made or makes any representation to
any of
41
Table of Contents
our stockholders regarding our ultimate performance compared to the information contained in the financial projections or that the financial projections
will be achieved.
In light of the foregoing factors and the uncertainties inherent in the financial projections, our stockholders are cautioned not to place undue, if any,
reliance on the financial projections.",45,49
"Resource REIT, Inc._20220314_DEFM14A_19942780_4408792.Pdf",Opinion of Our Financial Advisor,"Opinion of Our Financial Advisor
Opinion of Lazard Frères & Co. LLC
On January 23, 2022, Lazard rendered its oral opinion, subsequently confirmed in writing by delivery of a written opinion, dated January 23, 2022, to our
board of directors that, as of such date and based upon and subject to the assumptions, procedures, factors, qualifications and limitations set forth in the
written opinion, the common stock merger consideration to be paid to the holders of common stock (other than holders of excluded common stock) in the
merger was fair, from a financial point of view, to such holders.
The full text of Lazard’s written opinion, dated January 23, 2022, which sets forth the assumptions made, procedures followed, factors considered and
qualifications and limitations on the review undertaken by Lazard in connection with its opinion, is attached to this proxy statement as Exhibit B and is
hereby incorporated by reference herein in its entirety. The following summary of Lazard’s opinion is qualified in its entirety by reference to the full
text of the opinion. You are encouraged to read Lazard’s opinion and this section carefully and in their entirety.
Lazard’s opinion was rendered to our board of directors in connection with its evaluation of the merger and addressed only the fairness, as of the date of
the opinion, from a financial point of view, to the holders of common stock (other than holders of excluded common stock) of the common stock merger
consideration to be paid to such holders in the merger. Lazard’s opinion was not intended to, and does not, constitute a recommendation to any
stockholder as to how such stockholder should vote or act with respect to the merger or any matter relating thereto.
In connection with its opinion, Lazard:
•
reviewed the financial terms and conditions of a draft, dated January 22, 2022, of the merger agreement;
•
reviewed certain publicly available historical business and financial information relating to the Company;
•
reviewed various financial forecasts and other data provided to Lazard by the Company relating to the business of the Company;
•
held discussions with members of the senior management of the Company with respect to the business and prospects of the Company;
•
reviewed public information with respect to certain other companies in lines of business Lazard believed to be generally relevant in
evaluating the business of the Company;
•
reviewed the financial terms of certain business combinations involving companies in lines of business Lazard believed to be generally
relevant in evaluating the business of the Company; and
•
conducted such other financial studies, analyses and investigations as Lazard deemed appropriate.
Lazard assumed and relied upon the accuracy and completeness of the foregoing information, without independent verification of such information.
Lazard did not conduct any independent valuation or appraisal of any of the assets or liabilities (contingent or otherwise) of the Company or concerning
the solvency or fair value of the Company, and Lazard was not furnished with any such valuation or appraisal. With respect to the financial
42Table of Contents
forecasts utilized in Lazard’s analyses, Lazard assumed, with the consent of the Company, that they were reasonably prepared on bases reflecting the
best currently available estimates and judgments as to the future financial performance of the Company. Lazard assumed no responsibility for and
expressed no view as to any such forecasts or the assumptions on which they were based.
Lazard’s opinion was necessarily based on economic, monetary, market and other conditions as in effect on, and the information made available to Lazard,
as of the date of the opinion. Lazard assumed no responsibility for updating or revising its opinion based on circumstances or events occurring after the
date of the opinion. Lazard’s opinion did not address the relative merits of the merger as compared to any other transaction or business strategy in which
the Company might have engaged or the merits of the underlying decision by the Company to engage in the merger.
In rendering its opinion, Lazard assumed, with the consent of the Company, that the merger would be consummated on the terms described in the merger
agreement, without any waiver or modification of any material terms or conditions. Representatives of the Company advised Lazard, and Lazard assumed,
that the merger agreement, as executed, conforms to the draft reviewed by Lazard in all material respects. Lazard also assumed, with the consent of the
Company, that obtaining the necessary governmental, regulatory or third-party approvals and consents for the merger would not have an adverse effect
on the Company or the merger. Lazard did not express any opinion as to any tax or other consequences that might result from the merger, nor did Lazard’s
opinion address any legal, tax, regulatory or accounting matters, as to which Lazard understood that the Company had obtained such advice as it deemed
necessary from qualified professionals. Lazard expressed no view or opinion as to any terms or other aspects (other than the common stock merger
consideration to the extent expressly specified in the opinion) of the merger, including, without limitation, the convertible stock merger consideration, the
form or structure of the merger or any other agreements or arrangements entered into in connection with, or contemplated by, the merger. In addition,
Lazard expressed no view or opinion as to the fairness of the amount or nature of, or any other aspects relating to, the compensation to any directors,
officers or employees of any parties to the merger, or class of such persons, relative to the common stock merger consideration or otherwise.
In connection with rendering its opinion, Lazard performed certain financial analyses and reviews of certain information that Lazard deemed appropriate in
connection with rendering its opinion as summarized below. The summary of the analyses and reviews provided below is not a complete description of
the analyses and reviews underlying Lazard’s opinion. The preparation of a fairness opinion is a complex process involving various determinations as to
the most appropriate and relevant methods of financial analysis and review and the application of those methods to particular circumstances, and,
therefore, is not readily susceptible to partial analysis or summary description. Considering selected portions of these analyses and reviews or the
summary set forth below without considering the analyses and reviews as a whole, could create an incomplete or misleading view of the analyses and
reviews underlying Lazard’s opinion. In arriving at its opinion, Lazard considered the results of all of its analyses and reviews and did not attribute any
particular weight to any particular analysis or review, or application thereof considered by it; rather, Lazard made its determination as to fairness on the
basis of its experience and professional judgment after considering the results of all of its analyses and reviews.
For purposes of its analyses and reviews, Lazard considered industry performance, general business, economic, market and financial conditions and
other matters, many of which are beyond the control of the Company. No company, business or transaction used in Lazard’s analyses and reviews, as a
comparison, is identical to the Company, its business or the merger, and an evaluation of the results of those analyses and reviews is not entirely
mathematical. Rather, the analyses and reviews involve complex considerations and judgments concerning financial and operating characteristics and
other factors that could affect the acquisition, public trading or other values of the companies, businesses or transactions used in Lazard’s analyses and
reviews. The estimates contained in Lazard’s analyses and reviews and the ranges of valuations resulting from any particular analysis or review are not
necessarily indicative of actual results or values or predictive of future results or values, which may be significantly more or less favorable than those
suggested by Lazard’s analyses and reviews. In addition, analyses and reviews relating to the value of companies, businesses or securities do not
43
Table of Contents
purport to be appraisals or to reflect the prices at which companies, businesses or securities actually may be sold. Accordingly, the estimates used in, and
the results derived from, Lazard’s analyses and reviews are inherently subject to substantial uncertainty.
Summary of Lazard Financial Analyses
The summary of the analyses and reviews provided below includes information presented in tabular format. In order to fully understand Lazard’s
analyses and reviews, the tables below must be read together with the full text of each summary. The tables alone do not constitute a complete
description of Lazard’s analyses and reviews. Considering the data in the tables below without considering the full description of the analyses and
reviews, including the methodologies and assumptions underlying the analyses and reviews, could create a misleading or incomplete view of Lazard’s
analyses and reviews.
Except as otherwise noted, the following quantitative information, to the extent that it is based on market data, is based on market data as it existed on or
before January 21, 2022, the last trading day before the financial presentation of Lazard dated January 23, 2022, and is not necessarily indicative of current
market conditions. Lazard has been instructed by our board of directors to use the Company financial projections as a basis for its analyses.
Discounted Cash Flow Analysis
Lazard performed a discounted cash flow analysis of the Company by calculating the estimated present value (as of June 30, 2022) of the stand-alone
unlevered, free cash flows that the Company was forecasted to generate during period from July 1, 2022 through December 31, 2026 based on the
Company financial projections. Lazard also calculated a range of estimated terminal values for the Company by applying a selected range of exit
capitalization rates of 4.25% to 5.0% to the stand-alone cash NOI attributable to the Company for the fiscal year ending December 31, 2027, which range
of exit capitalization rates was selected based on Lazard’s professional judgment and experience, taking into account, among other things, current and
historical implied capitalization rates for selected comparable companies and trends in the overall economy generally and in the industries and sectors in
which the Company operates. The cash flows and range of terminal values were then discounted to present value (as of June 30, 2022) using a selected
range of discount rates of 6.5% to 8.0% derived from a weighted average cost of capital calculation utilizing the capital asset pricing model. This analysis
indicated an implied enterprise value range for the Company, from which Lazard then calculated an implied equity value range for the Company by adding
the value of the Company’s tangible other assets and subtracting the value of the Company’s tangible liabilities as of June 30, 2022, based on the
Company financial projections.
This analysis resulted in a range of implied per share equity values per share of $11.71 to $15.52, as compared to (1) the most recent published NAV of the
Company of $9.06 per share, which was determined by our board of directors as of January 28, 2021, and (2) the common stock merger consideration of
$14.75 per share.
Selected Public Companies Analysis
Lazard reviewed publicly available financial and stock market information of the following six selected publicly traded companies that, given certain
business and financial characteristics, Lazard considered generally relevant for purposes of analysis.
•
Camden Property Trust
•
Mid-America Apartment Communities, Inc.
•
UDR, Inc.
•
Independence Realty Trust, Inc.
44
Table of Contents
•
NexPoint Residential Trust, Inc.
•
Centerspace
For each of the selected companies, Lazard calculated and compared, among other things, the ratio of its stock price as of January 21, 2022 to its 2022 and
2023 estimated funds from operations per share (the “FFO multiple”). Financial data for the selected companies were based on publicly available Wall
Street research analysts’ estimates. The results of this analysis are summarized in the following table:
Low
High
Median
Mean
2022 FFO Multiple
21.7x
27.8x
25.1x
24.7x
2023 FFO Multiple
20.6x
24.7x
23.2x
22.7x
Based on its professional judgment after taking into account, among other things, such observed multiples, Lazard selected a range of 2022 FFO multiples
of 23.1x to 27.1x and 2023 FFO multiples of 21.2x to 25.2x for the Company. Lazard applied such 2022 FFO multiple range and 2023 FFO multiple range
derived from the selected companies to the Company’s 2022 estimated FFO per share of the Company common stock and 2023 estimated FFO per share of
the Company common stock, respectively, each as set out in the Company financial projections. This analysis resulted in a range of implied values per
share of the Company common stock of $10.75 to $12.60 implied by the 2022 FFO multiple range and $11.65 to $13.86 implied by the 2023 FFO multiple
range, as compared to (1) the most recent published NAV of the Company of $9.06 per share, which was determined by our board of directors as of
January 28, 2021, and (2) the common stock merger consideration of $14.75.
Selected Precedent Transactions Analysis
Lazard analyzed certain publicly available information relating to certain all-cash acquisition transactions announced since April 2015 involving publicly-
traded residential real estate target companies in the United States in which the implied transaction value was greater than $1 billion. The selected
transactions are listed in the following table:
Announcement Date
Acquiror/Financial Sponsor
Target
December 2021
Blackstone Real Estate Partners
Bluerock Residential Growth REIT, Inc
July 2019
Cortland Partners, LLC
Pure Multi-Family REIT LP
July 2017
Greystar Real Estate Partners
Monogram Residential Trust, Inc.
January 2017
Starwood Capital Group
Milestone Apartments Real Estate Investment Trust
June 2015
Lone Star Funds & UDR, Inc.
Home Properties, Inc.
April 2015
Brookfield Asset Management
Associated Estates Realty Corporation
While none of the target companies in the selected transactions is directly comparable to the Company and none of the selected transactions is directly
comparable to the merger, the target companies in the selected transactions are companies with certain operations that, for the purposes of analysis, may
be considered similar to certain operations of the Company and, as such, for purposes of the analysis, the selected transactions may be considered
similar to the merger.
Using publicly available Wall Street research analysts’ estimates, for each of the selected transactions, Lazard observed the next twelve months FFO
multiple (“NTM FFO multiple”). The results of this review are summarized in the following table:
Low
High
Median
Mean
NTM FFO Multiple
13.3x
30.0x
20.0x
21.4x
45
Table of Contents
Based on the analysis of the relevant metrics for each of the selected transactions and its experience and professional judgment, Lazard selected a range
of NTM FFO multiples of 20.0x to 30.0x and applied this range to the Company’s projected 2022 FFO per common share, as set out in the Company
financial projections, to calculate a range of implied per share values of $9.29 to $13.92, as compared to (1) the most recent published NAV of the
Company of $9.06 per share, which was determined by our board of directors as of January 28, 2021 and (2) the common stock merger consideration of
$14.75.
Miscellaneous
Lazard is an internationally recognized investment banking firm providing a full range of financial advisory and other services. Lazard was selected to act
as our financial advisor based on its overall qualifications, expertise and reputation in investment banking and mergers and acquisitions generally and in
the real estate industry specifically, as well as its familiarity with the business of the Company.
Under the terms of its engagement letter, Lazard provided our board of directors with financial advisory services in connection with the merger, and the
Company agreed to pay Lazard the following fees: (1) quarterly advisory fees of $250,000 payable every 90 days after the date of the engagement letter;
(2) an opinion fee of $2.5 million payable upon rendering by Lazard of its written opinion to our board of directors; and (3) a sale transaction fee equal to
$15.0 million, plus an estimated incentive fee equal to approximately $10 million payable upon consummation of the merger (against which the quarterly
advisory fees and opinion fee will be credited). The Company also agreed to reimburse Lazard for certain expenses incurred in connection with Lazard’s
engagement and to indemnify Lazard and certain related persons under certain circumstances against various liabilities that may arise from or be related
to Lazard’s engagement, including certain liabilities under U.S. federal securities laws.
Lazard, as part of its investment banking business, is continually engaged in the valuation of businesses and their securities in connection with mergers
and acquisitions, negotiated underwritings, secondary distributions of listed and unlisted securities, private placements, leveraged buyouts, and
valuations for estate, corporate and other purposes. Lazard in the past has provided, currently is providing and in the future may provide certain
investment banking and financial advisory services to Blackstone and certain of its affiliates, for which it has received and may receive compensation,
including advising a portfolio company of Blackstone on capital advisory matters and several portfolio companies of Blackstone with respect to potential
sale or acquisition transactions, and, during the past two years, having advised (1) Blackstone Infrastructure Partners in its 2022 announced
contemplated investment in Invenergy and with respect to an additional matter in 2021, (2) BME Building Materials Europe in its 2021 acquisition of St.
Gobain Building Distribution, (3) Aqua Finance in its 2021 announced contemplated sale transaction and certain other advisory matters prior thereto, (4)
APG Asset Management and Blackstone in the 2021 acquisition of GCP Student Living plc, (5) Gavilan Resources in its 2021 restructuring proceedings
(and prior thereto Blackstone Energy Partners on matters related thereto), (6) Blackstone Tactical Opportunities in its 2020 investment into SUNZ
Insurance and sale of a stake in FGL Holdings, and (7) Blackstone in its 2020 sale of a stake in De Nora. The aggregate amount of fees paid to Lazard for
financial advisory services to Blackstone and its known affiliates in the two-year period prior to the date of Lazard’s opinion was between $25 and $30
million. In addition, in the ordinary course, Lazard and its affiliates and employees may trade securities of the Company, Blackstone and certain of their
respective affiliates for their own accounts and for the accounts of their customers, may at any time hold a long or short position in such securities, and
may also trade and hold securities on behalf of the Company, Blackstone and certain of their respective affiliates. The issuance of the Lazard opinion was
approved by the opinion committee of Lazard. The information disclosed in this paragraph is based upon information provided to us by Lazard.
Financing",49,53
"Resource REIT, Inc._20220314_DEFM14A_19942780_4408792.Pdf",Financing,"Financing
In connection with the closing of the merger, Parent will cause an aggregate of approximately $2.5 billion to be paid to the holders of common stock,
convertible stock, time vested restricted stock and performance
46Table of Contents
restricted stock (other than excluded stock). Parent has informed us that in connection with the closing of the merger, Parent expects to assume our
structured credit facility and to cause the outstanding indebtedness under our revolving credit facility, if any, to be prepaid in full. Parent has also
informed us that it expects our mortgage loans to be repaid or remain outstanding. As of February 25, 2022, we had approximately $1.2 billion in aggregate
principal amount of consolidated secured indebtedness, including approximately $495 million outstanding under our structured credit facility and
