Document,Section Header,Section Text,Start Page,End Page
"SPX FLOW, Inc._20220201_DEFM14A_19813071_4373457.Pdf",Company Termination Fee; Buyer Termination Fee,"Company Termination Fee; Buyer Termination Fee
SPX FLOW will be required to pay Buyer the Company Termination Fee in the following circumstances:
•
in the event that: (A) before obtaining the approval of the Merger Agreement by the stockholders of
the Company constituting the Requisite Company Vote, an Acquisition Proposal (whether or not
conditional) is publicly made or otherwise publicly disclosed, (B) thereafter, the Merger Agreement
is terminated by the Company or Buyer as a result of the Requisite Company Vote not being
obtained or the Merger not being completed by the Outside Date or by Buyer due to a Company
breach of its representations, warranties, covenants or agreements, or any inaccuracy in their
representations or warranties, and (C) within
75TABLE OF CONTENTS
12 months of such termination the Company and any of its subsidiaries shall have entered into a
definitive agreement in respect of any Acquisition Proposal that is subsequently consummated, or
the Company or any of its subsidiaries ultimately consummate an Acquisition Proposal which, in
each case, need not be the same Acquisition Proposal that was made, disclosed or
communicated prior to termination of the Merger Agreement (provided, that for purpose of this
clause (C), each reference to “15%” in the definition of Acquisition Proposal shall be deemed to be
a reference to “50%”));
•
in the event the Merger Agreement is terminated by Buyer due to a Change of Recommendation; or
•
in the event the Merger Agreement is terminated by the Company due to a Superior Proposal.
In no event will more than one Company Termination Fee be payable under the Merger Agreement.
Buyer (or the guarantor pursuant to the Limited Guarantee) will be required to pay the Company the Buyer
Termination Fee in the following circumstances:
•
Buyer or Merger Sub has breached any of its representations, warranties, covenants or
agreements, or there is any inaccuracy in any of its representations or warranties, in either case
which (1) would result in a failure of a condition to the obligation of SPX FLOW to complete the
Merger and (2) is either not curable prior to the Outside Date or is not cured within the earlier of (x)
30 days following the giving of written notice thereof by SPX FLOW to Buyer and (y) the Outside
Date; or
•
if (1) the closing did not occur on the date the closing should have occurred; (2) all conditions to
closing have been satisfied; (3) SPX FLOW has irrevocably confirmed by written notice to Buyer
that (A) the conditions to closing have been satisfied and will be satisfied, or SPX FLOW is willing
to waive any unsatisfied condition to the closing set forth in the Merger Agreement for the purpose
of consummating the Merger and other transactions contemplated by the Merger Agreement; (B)
SPX FLOW stands ready, willing and able to consummate the Merger and the other transactions
contemplated by the Merger Agreement; and (C) if Buyer and Merger Sub complied with their
obligations under the Merger Agreement, the closing would occur; and (4) the closing will not have
been consummated by Buyer and Merger Sub within three business days after delivery of such
notice.
In no event will more than one Buyer Termination Fee be payable under the Merger Agreement.
In the event that the Company fails to promptly pay the Company Termination Fee or the Buyer fails to
promptly pay the Buyer Termination Fee, and in order to obtain such payment, the Buyer, on the one hand,
or the Company, on the other hand, commences a legal proceeding that results in a judgment against the
Company for the Company Termination Fee, or against the Buyer for the Buyer Termination Fee, or any
portion thereof, as applicable, the Company shall pay the Buyer, or the Buyer shall pay the Company, as
the case may be, its out-of-pocket costs and expenses (including attorney's fees) in connection with such
legal proceeding (including interests) (the amounts referred to in the foregoing, the “Collection Costs”);
provided, that in no event shall the Collection Costs exceed $10,000,000.",85,86
"SPX FLOW, Inc._20220201_DEFM14A_19813071_4373457.Pdf",Buyer Expenses,"Buyer Expenses
In the event that the Merger Agreement is terminated by the Company or Buyer as a consequence of not
receiving the Requisite Company Vote, under circumstances in which the Company Termination Fee is not
then payable, then the Company will reimburse Buyer and its affiliates for the Buyer Expenses; provided,
that the payment by the Company of the Buyer Expenses pursuant to this paragraph shall not relieve the
Company of any subsequent obligation to pay the Company Termination Fee to the extent required by the
Merger Agreement. Payment of the Buyer Expenses shall be made by wire transfer of same-day funds to
the accounts designated by Buyer within two business days after the Company received notice and
documentation with respect to amounts validly due under this paragraph.",86,86
"SPX FLOW, Inc._20220201_DEFM14A_19813071_4373457.Pdf",Limitation on Remedies,"Limitation on Remedies
In the event of termination of the Merger Agreement and the abandonment of the Merger in accordance with
the provisions described in the section entitled “-Termination,” the Merger Agreement will become void and of
no effect with no liability to any person on the part of SPX FLOW, Buyer or Merger Sub (or of any of their
respective representatives or affiliates), except that the Confidentiality Agreement and certain sections of the
Merger
76TABLE OF CONTENTS
Agreement, including sections relating to termination fees and expenses, will survive termination. However,
termination of the Merger Agreement will not relieve any party of any liability or damages to the other party
resulting from any “willful breach” (as that term is defined in the Merger Agreement) of its obligations set
forth in the Merger Agreement.",86,87
"SPX FLOW, Inc._20220201_DEFM14A_19813071_4373457.Pdf",Expenses,"Expenses
Except as otherwise provided in the Merger Agreement, including as described in the sections entitled “-
Financing and Financing Cooperation” and “-Company Termination Fee; Buyer Termination Fee,” whether or
not the Merger is completed, all costs and expenses incurred in connection with the preparation,
negotiation, execution and performance of the Merger Agreement and the Merger and the other transactions
contemplated by the Merger Agreement, including all fees and expenses of representatives, will be paid by
the party incurring such expense.",87,87
"SPX FLOW, Inc._20220201_DEFM14A_19813071_4373457.Pdf",Amendment and Modification,"Amendment and Modification
Subject to the provisions of applicable law, at any time prior to the Effective Time, the parties may modify or
amend the Merger Agreement, by written agreement executed and delivered by duly authorized officers of
the respective parties; provided, however, certain provisions of the Merger Agreement, including provisions
related to modification of the Merger Agreement, termination of the Merger Agreement, governing law, third-
party beneficiaries, assignment, and non-recourse (and any provision of the Merger Agreement to the extent
a modification, waiver or amendment of such provision would modify the substance of any of the foregoing
provisions or related definitions), may not be modified, waived or amended in a manner that is adverse in any
material respect to any of the debt financing sources without the consent of the debt financing sources party
to the Debt Commitment Letter that have consent rights over amendments to the Merger Agreement.",87,87
"SPX FLOW, Inc._20220201_DEFM14A_19813071_4373457.Pdf",Assignment,"Assignment
The Merger Agreement cannot be assigned by any of the parties thereto without the prior written consent of
the other parties; provided, however, that (a) each of Buyer and Merger Sub may at any time assign all of its
rights and interests under the Merger Agreement, by written notice to the Company, to a wholly-owned
direct or indirect subsidiary of Buyer, in which event all references in the Merger Agreement to Buyer or
Merger Sub, as applicable, will be deemed references to such other subsidiary, except that all
representations and warranties made in the Merger Agreement with respect to Buyer or Merger Sub, as
applicable, as of the date of the Merger Agreement shall be deemed representations and warranties made
with respect to such other subsidiary as of the date of such assignment; provided that any such assignment
will not impede or delay the consummation of the transactions contemplated by the Merger Agreement, or
(b) after the Effective Time, Buyer may assign, in its sole discretion, any or all of its rights under the Merger
Agreement in whole or in part to any person, including to any of the financing sources of Buyer (including
any debt financing sources), to the extent necessary for purposes of creating a security interest therein or
otherwise assigning as collateral in respect of Buyer’s debt financing. Any purported assignment without
compliance with the foregoing will be void.",87,87
"SPX FLOW, Inc._20220201_DEFM14A_19813071_4373457.Pdf",Specific Enforcement,"Specific Enforcement
Each of the parties has agreed that if for any reason any of the provisions of the Merger Agreement, the
Limited Guarantee or Equity Commitment Letter are not performed in accordance with their specific terms or
are otherwise breached, immediate and irreparable harm would be caused for which money damages would
not be an adequate remedy. Accordingly, except where the Merger Agreement is validly terminated, in
addition to any other available remedies a party may have in equity or at law, each party will be entitled to
enforce specifically the terms and provisions of the Merger Agreement and to obtain an injunction restraining
any breach or violation or threatened breach or violation of the provisions of the Merger Agreement. Each of
the parties has acknowledged and agreed that, subject to the conditions set forth in the Merger Agreement,
such relief for specific performance shall include the right of the Company to cause Buyer to consummate
the transactions contemplated thereby, in each case, if each of the mutual closing conditions and the
closing conditions of Buyer set forth in the Merger Agreement have been satisfied or waived (other than
conditions which by their nature cannot be satisfied until the closing, but subject to the satisfaction or waiver
of those conditions at the closing) and the closing is required to occur. The parties have further agreed that
(i) by seeking specific performance, a party shall not in any respect waive its right to seek any other form of
relief, at law or in equity, that may be available to a party under the Merger Agreement, including monetary
damages in the event that the Merger Agreement is terminated or in the event that specific performance is
not
77TABLE OF CONTENTS
available or otherwise are not granted and (ii) no party shall be required to institute any action or proceeding
for (or limit any party's right to institute any proceeding for) specific performance before exercising any
termination right under the Merger Agreement (and pursuing damages after such termination), nor shall the
commencement of any action or proceeding pursuant to the terms of the Merger Agreement restrict or limit
any party's right to terminate the Merger Agreement in accordance with its terms or pursue any other
remedies under the Merger Agreement that may be available then or thereafter. Pursuant to the Merger
Agreement, in the event that any action or proceeding is brought in equity to enforce the provisions of the
Merger Agreement, no party will allege or assert, and each party has waived the defense, that there is an
adequate remedy at law.
Notwithstanding the foregoing, the right of the Company to seek specific performance of Buyer’s and Merger
Sub's obligations to cause the equity financing to be funded and to complete the Merger will only be
available if (1) all conditions to Buyer's obligation to consummate the transactions contemplated by the
Merger Agreement have been satisfied (other than any condition that by its nature cannot be satisfied until
the closing but each of which would be satisfied if the closing were to occur) at a time when the closing
would have otherwise occurred pursuant to the Merger Agreement, (2) the debt financing has been funded in
accordance with its terms or will be funded in accordance with its terms at the closing if the equity financing
is funded at the closing and (3) the Company has irrevocably confirmed in writing that all conditions to the
Company's obligation to consummate the transactions contemplated by the Merger Agreement have been
satisfied (or waived) and if specific performance is granted and the equity financing and the debt financing
are funded, then the closing would occur.
78
TABLE OF CONTENTS",87,89
"SPX FLOW, Inc._20220201_DEFM14A_19813071_4373457.Pdf","PROPOSAL NO. 2 - ADVISORY VOTE ON NAMED EXECUTIVE OFFICER MERGER-RELATED
COMPENSATION","Proposal No. 2 - Advisory Vote on Named Executive Officer Merger-Related Compensation
As required by Section 14A of the Exchange Act and the applicable SEC rules issued thereunder, SPX
FLOW is providing its stockholders with a separate advisory (non-binding) vote to approve certain
compensation that may be paid or become payable to its named executive officers in connection with the
merger, as described in the section entitled “Quantification of Potential Payments to Named Executive
Officers in Connection with the Merger” under “Proposal No. 1 - The Merger-Interests of SPX FLOW's
Directors and Executive Officers in the Merger,” including the footnotes to the table and related narrative
discussion beginning on page 48 of this proxy statement.
SPX FLOW's Board unanimously recommends that the stockholders of SPX FLOW approve the following
resolution:
“RESOLVED, that the compensation that may be paid or become payable to SPX FLOW's named executive
officers in connection with the merger, and the agreements or understandings pursuant to which such
compensation may be paid or become payable, in each case as disclosed pursuant to Item 402(t) of
Regulation S-K in the table in the section entitled “Proposal No. 1 - The Merger-Interests of SPX FLOW's
Directors and Executive Officers in the Merger - Quantification of Potential Payments to Named Executive
Officers in Connection with the Merger,” including the footnotes to the table and the related narrative
discussion, is hereby APPROVED.”
The vote on the Advisory Compensation Proposal is a vote separate and apart from the vote on the Merger
Proposal. Accordingly, you may vote to approve the Merger Proposal and vote not to approve Advisory
Compensation Proposal and vice versa. Because the Advisory Compensation Proposal is advisory only, it
will not be binding on either SPX FLOW or Buyer. Accordingly, if the Merger Agreement is approved and the
Merger is completed, the compensation will be payable, subject only to the conditions applicable thereto
under the applicable compensation agreements and arrangements, regardless of the outcome of the non-
binding, advisory vote of SPX FLOW's stockholders.
The above resolution approving the merger-related compensation of SPX FLOW's named executive officers
on an advisory basis requires the affirmative vote of a majority of shares present and represented by proxy
and entitled to vote with respect to this proposal.
SPX FLOW's Board unanimously recommends that the stockholders of SPX FLOW vote “FOR” the
Advisory Compensation Proposal.
79TABLE OF CONTENTS",89,90
"SPX FLOW, Inc._20220201_DEFM14A_19813071_4373457.Pdf",PROPOSAL NO. 3 - VOTE ON ADJOURNMENT,"Proposal No. 3 - Vote on Adjournment
The Company's stockholders are being asked to approve the Adjournment Proposal, a proposal for one or
more adjournments of the Special Meeting, if necessary or appropriate, including to solicit additional proxies
in favor of the Merger Proposal if there are insufficient votes at the time of the Special Meeting to approve the
Merger Proposal. If this Adjournment Proposal is approved, the Special Meeting could be adjourned by SPX
FLOW's Board to any date. In addition, SPX FLOW's Board could postpone the Special Meeting before it
commences. Pursuant to the Merger Agreement, SPX FLOW may postpone or adjourn the stockholders
meeting (i) with the written consent of Buyer; (ii)(A) due to the absence of a quorum or (B) due to the
Company not having received proxies representing a sufficient number of Shares for the Requisite Company
Vote, whether or not a quorum is present, in each case, to solicit additional proxies; or (iii) to allow
reasonable additional time for the filing and mailing of any supplemental or amended disclosure which the
Company Board has determined in good faith after consultation with outside legal counsel is necessary
under applicable Law and for such supplemental or amended disclosure to be disseminated and reviewed by
the Company's stockholders prior to the stockholders meeting; provided, that the Company may not
postpone or adjourn the Stockholders Meeting more than twice pursuant to clauses (ii)(A) and/or (ii)(B).
Notwithstanding the foregoing, the Company shall, at the request of Buyer, to the extent permitted by Law,
adjourn the stockholders meeting to a date specified by Buyer due to the absence of a quorum or if the
Company has not received proxies representing a sufficient number of shares for the Requisite Company
Vote; provided that the Company shall not be required to adjourn the stockholders meeting more than once
at the request of Buyer, and no such adjournment pursuant to this sentence shall be required to be for a
period exceeding 10 business days.
If the Special Meeting is adjourned for the purpose of soliciting additional proxies, stockholders who have
already submitted their proxies will be able to revoke them at any time before their use. If you sign and
return a proxy and do not indicate how you wish to vote on any proposal, or if you sign and return a proxy
and you indicate that you wish to vote in favor of the Merger Proposal but do not indicate a choice on the
Adjournment Proposal, your shares of common stock will be voted in favor of the Adjournment Proposal.
The Company does not anticipate calling a vote on the Adjournment Proposal if Proposal 1, the Merger
Proposal is approved by the requisite number of shares of SPX FLOW common stock at the Special
Meeting.
The vote on the Adjournment Proposal is a vote separate and apart from the Merger Proposal. Accordingly,
you may vote to approve the Merger Proposal and vote not to approve the Adjournment Proposal and vice
versa.
Approval of the Adjournment Proposal requires the affirmative vote of holders of a majority of shares present
or represented by proxy and entitled to vote with respect to this proposal.
SPX FLOW's Board unanimously recommends that the stockholders of SPX FLOW vote “FOR” the
Adjournment Proposal, if a vote on the Adjournment Proposal is called.
80TABLE OF CONTENTS",90,91
