Document,Section Header,Section Text,Start Page,End Page
"SPX FLOW, Inc._20220201_DEFM14A_19813071_4373457.Pdf",Opinion of Morgan Stanley,"Opinion of Morgan Stanley
SPX FLOW retained Morgan Stanley to act as financial advisor to SPX FLOW's Board in connection with
the proposed Merger. The Company's Board selected Morgan Stanley to act as its financial advisor based
on Morgan Stanley's qualifications, expertise and reputation, its knowledge of, and involvement in, recent
transactions in the industry, and its knowledge of SPX FLOW's business and affairs. At the meeting of SPX
FLOW's Board on December 12, 2021, Morgan Stanley rendered its oral opinion, subsequently confirmed in
writing, that as of such date, and based upon and subject to the various assumptions made, procedures
followed, matters considered and qualifications and limitations on the scope of the review undertaken by
Morgan Stanley as set forth in the written opinion, the Per Share Price of SPX FLOW common stock in
cash to be received by the holders of shares of SPX FLOW common stock pursuant to the Merger
Agreement was fair from a financial point of view to such holders of shares of SPX FLOW common stock.
The full text of the written opinion of Morgan Stanley, dated as of December 12, 2021, which sets forth,
among other things, the various assumptions made, procedures followed, matters considered and
qualifications and limitations on the scope of the review undertaken by Morgan Stanley in rendering its
opinion, is attached to this proxy statement as Annex B. You are encouraged to read the opinion carefully
and in its entirety. Morgan Stanley's opinion was rendered for the benefit of SPX FLOW's Board, in its
capacity as such, and addressed only the fairness from a financial point of view, as of the date of such
opinion, of the Per Share Price to be received by the holders of shares of SPX FLOW common stock
pursuant to the Merger Agreement. Morgan Stanley's opinion did not address any other aspects or
40TABLE OF CONTENTS
implications of the Merger, including the relative merits of the Merger as compared to any other alternative
business transaction, or other alternatives, or the fairness of the amount or nature of the compensation to
any officers, directors or employees of SPX FLOW, or any class of such persons, relative to the Per Share
Price to be received by the holders of shares of SPX FLOW common stock pursuant to the Merger
Agreement. Morgan Stanley did not express any opinion or recommendation as to how the stockholders of
SPX FLOW should vote at the stockholders' meeting to be held in connection with the Merger. The summary
of the opinion of Morgan Stanley set forth below is qualified in its entirety by reference to the full text of the
opinion attached hereto as Annex B.
In connection with rendering its opinion, Morgan Stanley, among other things:
•
Reviewed certain publicly available financial statements and other business and financial
information of the Company;
•
Reviewed certain internal financial statements and other financial and operating data concerning
the Company;
•
Reviewed certain financial projections prepared by the management of the Company;
•
Discussed the past and current operations and financial condition and the prospects of the
Company with senior executives of the Company;
•
Reviewed the reported prices and trading activity for SPX FLOW common stock;
•
Compared the financial performance of the Company and the prices and trading activity of shares of
SPX FLOW common stock with that of certain other publicly-traded companies comparable with
the Company, and their securities;
•
Reviewed the financial terms, to the extent publicly available, of certain comparable acquisition
transactions;
•
Participated in certain discussions and negotiations among representatives of the Company and
Buyer and their financial and legal advisors;
•
Reviewed the Merger Agreement, the draft commitment letter from certain lenders substantially in
the form of the draft dated December 11, 2021, and certain related documents; and
•
Performed such other analyses, reviewed such other information and considered such other factors
as Morgan Stanley deemed appropriate.
In arriving at its opinion, Morgan Stanley assumed and relied upon, without independent verification, the
accuracy and completeness of the information that was publicly available or supplied or otherwise made
available to Morgan Stanley by the Company and formed a substantial basis for its opinion. With respect to
the Forecasted Financial Information, Morgan Stanley assumed that they had been reasonably prepared on
bases reflecting the best currently available estimates and judgments of the Company's management of the
future financial performance of the Company. In addition, Morgan Stanley assumed that the Merger will be
consummated in accordance with the terms set forth in the Merger Agreement without any waiver,
amendment or delay of any terms or conditions, including, among other things, that Buyer will obtain
financing required to consummate the Merger and that the definitive Merger Agreement will not differ in any
material respect from the draft furnished to Morgan Stanley. Morgan Stanley assumed that in connection
with the receipt of all the necessary governmental, regulatory or other approvals and consents required for
the proposed Merger, no delays, limitations, conditions or restrictions will be imposed that would have a
material adverse effect on the contemplated benefits expected to be derived in the proposed Merger. Morgan
Stanley noted that it is not a legal, tax, or regulatory advisor. Morgan Stanley is a financial advisor only and
relied upon, without independent verification, the assessment of the Company and its legal, tax, and
regulatory advisors with respect to legal, tax, and regulatory matters. Morgan Stanley expressed no opinion
with respect to the fairness of the amount or nature of the compensation to any of the Company's officers,
directors or employees, or any class of such persons, relative to the Per Share Price to be received by the
holders of shares of SPX FLOW common stock in the Merger. Morgan Stanley did not make any
independent valuation or appraisal of the assets or liabilities of the Company, nor was Morgan Stanley
furnished with any such valuations or appraisals. Morgan Stanley's opinion did not address the relative
merits of the transactions contemplated by the Merger Agreement as compared to other business or
financial strategies that might be available to the Company, nor did it address the underlying business
decision of the Company to enter into the Merger Agreement or proceed with any other transaction
contemplated by the Merger Agreement. Morgan Stanley's opinion was necessarily based on financial,
economic, market and other
41
TABLE OF CONTENTS
conditions as in effect on, and the information made available to Morgan Stanley as of, the date of delivery of
its opinion. Events occurring after such date may affect Morgan Stanley's opinion and the assumptions used
in preparing it, and Morgan Stanley did not assume any obligation to update, revise or reaffirm its opinion.
Summary of Financial Analyses
The following is a summary of the material financial analyses performed by Morgan Stanley in connection
with its oral opinion and the preparation of its written opinion dated December 12, 2021. The following
summary is not a complete description of Morgan Stanley's opinion or the financial analyses performed and
factors considered by Morgan Stanley in connection with its opinion, nor does the order of analyses
described represent the relative importance or weight given to those analyses. In connection with arriving at
its opinion, Morgan Stanley considered all of its analyses as a whole and did not attribute any particular
weight to any analysis described below. Considering any portion of such analyses and factors considered,
without considering all analyses and factors, could create a misleading or incomplete view of the process
underlying Morgan Stanley's opinion. Some of these summaries of financial analyses include information
presented in tabular format. In order to fully understand the financial analyses used by Morgan Stanley, the
tables must be read together with the text of each summary. The tables alone do not constitute a complete
description of the financial analyses.
Except as otherwise noted, the following quantitative information, to the extent that it is based on market
data, is based on market data as it existed on or before December 10, 2021, the last trading day prior to the
date of the meeting of the Board at which Morgan Stanley rendered its oral opinion. Capitalization
information for SPX FLOW, including fully diluted number of shares, was provided on December 12, 2021 by
SPX FLOW management to Morgan Stanley, and were approved by SPX FLOW management for Morgan
Stanley's use in its financial analyses.
In performing the financial analyses summarized below and in arriving at its opinion, Morgan Stanley used
and relied upon the following financial projections: (i) the Street Consensus Forecasted Financial
Information, as more fully described above under “Certain SPX FLOW Unaudited Prospective Financial
Information,” (ii) the Public Guidance Forecasted Financial Information, as more fully described above under
“Certain SPX FLOW Unaudited Prospective Financial Information”, (iii) the Management Case-Adjusted, as
more fully described above under “Certain SPX FLOW Unaudited Prospective Financial Information”, and (iv)
the Management Case-Long Range Plan, as more fully described above under “Certain SPX FLOW
Unaudited Prospective Financial Information”, which were approved by SPX FLOW management for Morgan
Stanley's use in connection with its financial analyses.
Historical Trading Range Analysis
Morgan Stanley reviewed the historical trading range of shares of SPX FLOW common stock for the 52-
week period ending December 10, 2021 and noted that, during such period, the maximum stock price for
shares of SPX FLOW common stock was $88.55 (maximum closing trading price was $87.15), which was
also an all-time high as of December 10, 2021, the minimum stock price for shares of SPX FLOW common
stock was $52.30 (minimum closing trading price was $52.97), and the unaffected all-time maximum stock
price for shares of SPX FLOW common stock prior to The Wall Street Journal publishing a story reporting
that, according to unnamed sources, Ingersoll Rand had made takeover bids for SPX FLOW, was $71.62
(and unaffected all-time maximum closing trading price was $70.60). Morgan Stanley also noted that the
closing trading price for shares of SPX FLOW common stock on July 16, 2021, the last trading day prior to
The Wall Street Journal publishing a story reporting that, according to unnamed sources, Ingersoll Rand had
made takeover bids for SPX FLOW, was $62.09.
Equity Research Analyst Price Targets
Morgan Stanley reviewed the undiscounted unaffected price targets for shares of SPX common stock
prepared and published by equity research analysts that had been published by Bloomberg as of July 16,
2021, the last trading day prior to The Wall Street Journal publishing a story reporting that, according to
unnamed sources, Ingersoll Rand had made takeover bids for SPX FLOW. These targets generally reflect
each analyst's estimate of the future public market trading price of shares of SPX FLOW common stock. In
order to better compare the equity research analysts' stock price targets with the Per Share Price, based on
its professional judgment and experience, Morgan Stanley discounted each analyst's price target to present
value assuming a cost of equity of 9.3%. This analysis resulted in a discounted analyst unaffected price
target range for SPX FLOW common stock of $61.00 to $82.00, rounded to the nearest $1.00.
Morgan Stanley also reviewed the undiscounted current price targets for shares of SPX common stock
prepared and published by equity research analysts that had been published by Bloomberg as of December
10, 2021. In order to
42
TABLE OF CONTENTS
better compare the equity research analysts' stock price targets with the Per Share Price, based on its
professional judgment and experience, Morgan Stanley discounted each analyst's price target to present
value assuming a cost of equity of 9.3%. This analysis resulted in a discounted analyst current price target
range for SPX FLOW common stock of $69.00 to $99.00, rounded to the nearest $1.00.
Morgan Stanley compared these ranges to the Per Share Price of SPX FLOW common stock in cash, to
the closing trading price of SPX FLOW common stock of $62.09 on July 16, 2021, the last trading day prior
to The Wall Street Journal publishing a story reporting that, according to unnamed sources, Ingersoll Rand
had made takeover bids for SPX FLOW, and the closing trading price of $85.63 on December 10, 2021.
The public market trading price targets published by equity research analysts do not necessarily reflect
current market trading prices for SPX FLOW common stock and these estimates are subject to
uncertainties, including the future financial performance of SPX FLOW and future financial market
conditions.
Public Trading Comparables Analysis
Morgan Stanley performed a public trading comparables analysis, which is designed to provide an implied
value of a company by comparing it to similar companies that are publicly traded. Morgan Stanley reviewed
and compared certain financial estimates for SPX FLOW with comparable publicly available consensus
equity analyst research estimates for selected companies that, in Morgan Stanley's professional judgment,
share certain similar business characteristics and have certain comparable operating characteristics.
For purposes of this analysis, Morgan Stanley analyzed the ratios of aggregate value, which Morgan Stanley
defined as fully diluted market capitalization plus net debt, plus non-controlling interest (as appropriate for
the company being analyzed), less investment in associate (as appropriate for the company being
analyzed), to EBITDA, which is defined as earnings before interest, taxes, depreciations and amortization
for the calendar year 2022, which ratios Morgan Stanley referred to as Aggregate Value/CY2022E EBITDA,
calculated with the burden of stock based compensation. Certain of the foregoing terms are used throughout
this summary of financial analyses.
The below table summarizes the companies, the metrics and the multiples employed in this analysis:
Consensus
Aggregate
Value/CY2022E
EBITDA
Xylem
24.7x
IDEX
22.0x
Graco
21.5x
Ingersoll Rand
20.3x
Alfa Laval
16.3x
Dover
15.4x
ITT
13.8x
GEA
12.0x
Crane
9.5x
Sulzer
8.6x
Based on its analysis and its professional judgment, Morgan Stanley selected a reference range of
Aggregate Value/CY2022E EBITDA, burdened by stock-based compensation, of 11.0x-15.0x for SPX FLOW.
Morgan Stanley applied the elected reference range to the adjusted EBITDA set forth in the Street
Consensus Case, the Management Case-Adjusted, and the Management Case-Long Range Plan.
Based on this analysis, Morgan Stanley derived the following ranges of implied equity value per share of
SPX FLOW common stock on a fully diluted basis (in each case, rounded to the nearest $1.00):
Public Trading Comparables Analysis
Implied Equity
Value 
Per Share Range
Street Consensus Forecasted Financial Information
$62-$85
Management Case-Adjusted
$70-$96
Management Case-Long Range Plan
$78-$107
Morgan Stanley compared these ranges to the Per Share Price of SPX FLOW common stock in cash, to
the closing trading price of SPX FLOW common stock of $62.09 on July 16, 2021, the last trading day prior
to The Wall Street
43
TABLE OF CONTENTS
Journal publishing a story reporting that, according to unnamed sources, Ingersoll Rand had made takeover
bids for SPX FLOW, and the closing trading price of $85.63 on December 10, 2021.
No company used in the public trading comparables analysis is identical to SPX FLOW or directly
comparable in business mix, size or other metrics. Accordingly, an analysis of the results of the foregoing
analysis necessarily involves complex considerations and judgments concerning differences between SPX
FLOW and the companies being compared and other factors that would affect the value of the companies to
which SPX FLOW is being compared. In selecting comparable companies, Morgan Stanley made numerous
judgments and assumptions with respect to size, business mix, industry performance, general business,
regulatory, economic, market and financial conditions and other matters, many of which are beyond the
control of SPX FLOW. These include, among other things, selected company growth and profitability, the
impact of competition on the business of SPX FLOW or the industry generally, industry growth, and the
absence of any adverse material change in the financial condition or prospects of SPX FLOW or the
industry, or in the financial markets in general. Mathematical analysis is not in itself a meaningful method of
using selected company data.
Discounted Cash Flow Analysis
Morgan Stanley performed a discounted cash flow analysis on SPX FLOW, which is designed to provide an
implied value of a company by calculating the present value of the estimated future cash flows and terminal
value of such company. In connection with this analysis, Morgan Stanley calculated a range of per share
equity values for SPX FLOW.
Morgan Stanley calculated the estimated present value of the unlevered free cash flows that SPX FLOW
was forecasted to generate from the fourth quarter of calendar year 2021 through calendar year 2025 on a
standalone basis. Morgan Stanley performed this analysis on the estimated future cash flows contained in
the Street Consensus Forecasted Financial Information, the Public Guidance Forecasted Financial
Information, the Management Case-Adjusted and the Management Case-Long Range Plan.
For purposes of this analysis, unlevered free cash flows were calculated as adjusted EBITDA (burdened by
stock based compensation) less depreciation and amortization, plus minority interest, to arrive at operating
income, less taxes (assuming a 25.0% of cash tax rate for the projection period per SPX FLOW
management guidance to reflect tax assets and incentives and assuming 28.0% of tax rate in the terminal
year to reflect normalized level of tax rate), to arrive at net operating profit after tax, plus depreciation and
amortization, less increases in net working capital, less cash restructuring expenses, less capital
expenditures, adjusted for any net proceeds from asset sales or expenditure on asset purchases. These
estimated unlevered free cash flows were reviewed and approved by SPX FLOW management for Morgan
Stanley's use.
Morgan Stanley calculated terminal values for SPX FLOW by applying a range of terminal growth rates of
2.0% to 3.0%, based on Morgan Stanley's professional judgment, to the unlevered free cash flows of SPX
FLOW through 2025. Morgan Stanley then discounted the unlevered free cash flows and terminal value to
present value as of September 30, 2021, using a range of discount rates from 7.7% to 9.5%, which were
selected based on Morgan Stanley's professional judgment.
Based on this analysis, Morgan Stanley derived the following ranges of implied equity value per share of
SPX FLOW common stock on a fully diluted basis (in each case, rounded to the nearest $1.00):
Discounted Cash Flow Analysis
Implied Equity
Value 
Per Share Range
Street Consensus Forecasted Financial Information
$62-$97
Public Guidance Forecasted Financial Information
$62-$99
Management Case-Adjusted
$73-$114
Management Case-Long Range Plan
$82-$127
Morgan Stanley compared this range to the Per Share Price of SPX FLOW common stock in cash, to the
closing trading price of SPX FLOW common stock of $62.09 on July 16, 2021, the last trading day prior to
news reports speculating about Ingersoll Rand's offer for SPX FLOW, and the closing trading price of $85.63
on December 10, 2021.
Discounted Equity Value Analysis
Morgan Stanley performed a discounted equity value analysis, which is designed to provide insight into the
potential future equity value of a company as a function of the company's estimated future earnings. The
resulting equity value
44
TABLE OF CONTENTS
was subsequently discounted to arrive at an estimate of the implied present value for such company's
potential future equity value. In connection with this analysis, Morgan Stanley calculated a range of implied
present equity values per share on a standalone basis for SPX FLOW.
To calculate the discounted equity value for SPX FLOW, Morgan Stanley used estimated Aggregate
Value/NTM EBITDA based on (i) the Street Consensus Forecasted Financial Information, (ii) the Public
Guidance Forecasted Financial Information, (iii) the Management Case-Adjusted, and (iv) the Management
Case-Long Range Plan. Based upon the application of its professional judgment and experience after
reviewing and comparing certain financial estimates for SPX FLOW, Morgan Stanley applied a range of
Aggregate Value/NTM EBITDA multiples of 11.0x to 14.0x to these NTM estimates as of year-end 2022,
which range was selected based upon Morgan Stanley's professional judgment and experience taking into
account SPX FLOW's and its peers' historical long-term trading multiples, and discounted the resulting
equity values to September 30, 2021 at a discount rate of 9.3%, which rate was selected based on the
estimated cost of equity for SPX FLOW.
Based on this analysis, Morgan Stanley derived the below ranges of implied equity value per share of
Company common stock on a fully diluted basis (in each case, rounded to the nearest $1.00). Morgan
Stanley also derived the below implied equity value per share of Company common stock on a fully diluted
basis utilizing SPX FLOW's average Aggregate Value/NTM EBITDA multiple of 10.1x since the completion of
the Spin-Off on September 26, 2015 until July 16, 2021, the last trading day prior to The Wall Street Journal
publishing a story reporting that, according to unnamed sources, Ingersoll Rand had made takeover bids for
SPX FLOW, in each case, rounded to the nearest $1.00.
Aggregate Value/NTM EBITDA
Implied Equity Value Per
Share 
Range (Selected Multiple
Range 
of 11.0x to 14.0x)
Implied Equity Value
Per 
Share (SPX FLOW
Historic 
Average Trading
Multiple of 
10.1x)
Street Consensus Forecasted Financial Information
$74-$93
$68
Public Guidance Forecasted Financial Information
$77-$99
$71
Management Case-Adjusted
$81-$102
$74
Management Case-Long Range Plan
$89-$113
$82
Morgan Stanley compared this range to the Per Share Price of SPX FLOW common stock in cash, to the
closing trading price of SPX FLOW common stock of $62.09 on July 16, 2021, the last trading day prior to
The Wall Street Journal publishing a story reporting that, according to unnamed sources, Ingersoll Rand had
made takeover bids for SPX FLOW, and the closing trading price of $85.63 on December 10, 2021.
Other Factors
Morgan Stanley observed certain additional factors that were not considered part of its financial analyses
with respect to its opinion but were referenced for informational purposes, including, among other things, the
following:
Precedent Transactions Analysis
For informational purposes, Morgan Stanley performed a precedent transactions analysis, which is designed
to imply a value of a company based on publicly available financial terms of selected transactions. Morgan
Stanley selected, based on Morgan Stanley's professional judgment and knowledge of the sector, certain
flow control related sector transactions since 2011 for which relevant financial information was publicly
available.
For these transactions, Morgan Stanley reviewed the purchase price paid and calculated the ratio of the
aggregate value of each transaction to the estimated last twelve months EBITDA (burdened by stock-based
compensation where such information was available), which we refer to as LTM EBITDA, based on publicly
available financial information. Morgan Stanley reviewed the transactions in connection with this analysis
and determined the high, median and low multiples for such selected transactions as 18.9x, 12.0x and 8.3x,
respectively.
The selected precedent transactions varied significantly based upon company scale, business risks, growth
prospects and geography, as well as prevailing market trends. Based on its experience and professional
judgment and taking into consideration, among other things, (i) the observed multiples for the precedent
transactions listed above, (ii) the different business, financial and operating characteristics of the companies
in such transactions as compared to the Company and (iii) the prevailing market trends for the valuation and
performance companies in the Company's industry at the time of each transaction as compared to the
current prevailing market trends, Morgan Stanley applied Aggregate Value/LTM EBITDA multiple range of
11.0x to 15.0x to the Company's estimated EBITDA for 2021 of $226 million based on the Management
Case-Long Range Plan.
45
TABLE OF CONTENTS
Based on this analysis, Morgan Stanley calculated a range of implied fully diluted share prices for shares of
SPX FLOW common stock of $56.00 to $77.00, rounded to the nearest $1.00.
No company or transaction used in the precedent transactions analysis is identical to SPX FLOW or the
Merger. In evaluating the precedent transactions, Morgan Stanley made judgments and assumptions with
regard to industry performance, general business, economic, market and financial conditions and other
matters, many of which are beyond the control of SPX FLOW, such as the impact of competition on SPX
FLOW's business or the industry generally, industry growth and the absence of any adverse material change
in the financial condition or prospects of SPX FLOW or the industry, or in the financial markets in general.
Precedent Premia Analysis
For informational purposes, Morgan Stanley also discussed with the Board, based on publicly available
information, the premiums paid in certain U.S. acquisition transactions. The analyses excluded terminated
transactions, employee stock ownership plan transactions, self-tenders, spin-offs, share repurchases,
minority interest transactions, exchange offers, recapitalizations and restructurings, as they were not
considered comparable to the Merger. Morgan Stanley considered premiums paid in announced
transactions with a transaction value of approximately $1 billion or more that involved U.S. publicly traded
target companies since 2005. The average premium paid in all such transactions since 2005 was 33%.
Based on the foregoing, Morgan Stanley applied a premium range of 20% to 40% to the closing trading price
of SPX FLOW common stock of $62.09 on July 16, 2021, the last trading day prior to The Wall Street
Journal publishing a story reporting that, according to unnamed sources, Ingersoll Rand had made takeover
bids for SPX FLOW. Based on this analysis, Morgan Stanley calculated a range of implied fully diluted
share prices for SPX FLOW common stock of $75.00 to $87.00, rounded to the nearest $1.00.
No company or transaction used in the precedent transactions analysis is identical to SPX FLOW or the
merger. In evaluating the precedent transactions, Morgan Stanley made judgments and assumptions with
regard to industry performance, general business, economic, market and financial conditions and other
matters, many of which are beyond the control of SPX, such as the impact of competition on SPX FLOW's
business or the industry generally, industry growth and the absence of any adverse material change in the
financial condition or prospects of SPX FLOW or the industry, or in the financial markets in general.
General
The preparation of a financial opinion is a complex analytical process involving various determinations as to
the most appropriate and relevant methods of financial analysis and the application of those methods to the
particular circumstances and, therefore, a financial opinion is not readily susceptible to summary
description. Morgan Stanley arrived at its opinion based on the results of all analyses undertaken and
assessed as a whole, and it did not ascribe a specific range of values to SPX FLOW common stock or
draw, in isolation, conclusions from or with regard to, and did not attribute any particular weight to, any one
factor or method of analysis, but rather made qualitative judgments as to the significance and relevance of
each analysis and factor relative to all other analyses and factors performed and considered by it and in the
context of the circumstances of the particular transaction. In addition, in rendering its opinion, Morgan
Stanley may have given various analyses and factors more or less weight than other analyses and factors
and may have deemed various assumptions more or less probable than other assumptions. As a result, the
ranges of implied valuations resulting from any particular analysis described above should not be taken to be
Morgan Stanley's view of the actual value of the Company. In performing its analyses, Morgan Stanley made
numerous assumptions with respect to industry performance, general business and economic conditions
and other matters. Many of these assumptions are beyond the control of SPX FLOW. Any estimates
contained in Morgan Stanley's analyses are not necessarily indicative of future results or actual values,
which may be significantly more or less favorable than those suggested by such estimates.
Morgan Stanley conducted the analyses described above solely as part of its analysis of the fairness from a
financial point of view of the Per Share Price to be received by the holders of shares of SPX FLOW common
stock and in connection with the delivery of its written opinion, dated December 12, 2021, to the Board.
These analyses do not purport to be appraisals or to reflect the prices at which shares of SPX FLOW
common stock might actually trade.
The Per Share Price to be received by the holders of shares of SPX FLOW common stock pursuant to the
Merger Agreement was determined through arm's-length negotiations between SPX FLOW and Buyer, rather
than by any financial advisor, and was approved by the Board. The Company's decision to enter into the
Merger Agreement was solely that of the Board. As described in the section entitled “Reasons for the
Merger; Recommendation of the Board”
46
TABLE OF CONTENTS
beginning on page 34, Morgan Stanley's analyses were only one of the factors considered by the Board in
its evaluation of the Merger and should not be viewed as determinative of the views of the Board or
management with respect to the Merger or the Per Share Price.
Morgan Stanley's opinion was approved by a committee of Morgan Stanley investment banking and other
professionals in accordance with its customary practice. No limitations were imposed by the Board upon
Morgan Stanley with respect to the investigations made or procedures followed by it in rendering its opinion.
Morgan Stanley did not recommend any specific amount or form of consideration to us or that any specific
amount or form of consideration constituted the only appropriate consideration for the Merger.
The Board retained Morgan Stanley based upon Morgan Stanley's qualifications, expertise and reputation,
its knowledge of and involvement in recent transactions in the Company's industry, and its knowledge and
understanding of SPX FLOW's business and affairs. Morgan Stanley is a global financial services firm
engaged in the securities, investment management and individual wealth management businesses. Its
securities business is engaged in securities underwriting, trading and brokerage activities, foreign exchange,
commodities and derivatives trading, prime brokerage, as well as providing investment banking, financing
and financial advisory services. Morgan Stanley, its affiliates, directors and officers may at any time invest
on a principal basis or manage funds that invest, hold long or short positions, finance positions, and may
trade or otherwise structure and effect transactions, for their own account or the accounts of their
customers, in debt or equity securities or loans of Buyer, Buyer's affiliates, SPX FLOW, or any other
company, or any currency or commodity, that may be involved in the Merger, or any related derivative
instrument.
As compensation for Morgan Stanley's services relating to its engagement, the Company has agreed to pay
Morgan Stanley a total fee of approximately $34 million, approximately $9 million of which became payable
upon the rendering of its opinion and the remainder of which is contingent upon the completion of the
Merger. In addition, we have agreed to reimburse Morgan Stanley for its reasonable expenses including,
without limitation, professional and legal fees and disbursements, plus any sales, use or other taxes related
to such fees and disbursements, regardless of whether the Merger is consummated. In addition, SPX FLOW
has agreed to indemnify Morgan Stanley and its affiliates, their respective directors, officers, agents and
employees and each person, if any, controlling Morgan Stanley or any of its affiliates against certain
liabilities and expenses, including certain liabilities under the federal securities laws, related to or arising out
of Morgan Stanley's engagement.
In the two years prior to the date of Morgan Stanley's opinion, Morgan Stanley or its affiliates (i) have
provided financial advisory services to SPX FLOW for which Morgan Stanley or its affiliates has received, in
the aggregate, compensation of less than $1 million, and (ii) have provided financing services to Lone Star
and majority controlled affiliates and portfolio companies thereof for which Morgan Stanley or its affiliates
has received, in the aggregate, compensation of between $5 million and $10 million, and Morgan Stanley or
its affiliates are also currently engaged by a majority controlled affiliate of Lone Star to provide financing
services thereto for which Morgan Stanley would expect to receive fees for any such services under certain
circumstances. Morgan Stanley and its affiliates may also seek to provide financial advisory and financing
services to the Company and Lone Star and their respective affiliates in the future and would expect to
receive fees for the rendering of any such services.
Financing",49,56
