Document,Section Header,Section Text,Start Page,End Page
"SPX FLOW, Inc._20220201_DEFM14A_19813071_4373457.Pdf",Interim Operations,"Interim Operations.
(a) The Company covenants and agrees as to itself and its Subsidiaries that, from the date of this
Agreement until the earlier of the Effective Time and the termination of this Agreement in accordance
with Article VI (except: (i) if Parent shall otherwise approve in writing, such approval not to be
unreasonably withheld, delayed or conditioned, (ii) as otherwise expressly contemplated or required by
this Agreement, (iii) as expressly set forth in Section 4.1(a) of the Company Disclosure Letter or (iv) as
required by applicable Laws, any Governmental Entity or COVID-19 Measures), the business of the
Company and its Subsidiaries shall be conducted, in all material respects, in the ordinary course of
business (including, for the avoidance of doubt, consistent with recent past practice in light of COVID-
19). Without limiting the generality of the foregoing and in furtherance thereof, from the date of this
Agreement until the earlier of the Effective Time and the termination of this Agreement in accordance
with Article VI, except (A) as otherwise contemplated or required by this Agreement, (B) as Parent may
approve in writing (such approval not to be unreasonably withheld, delayed or conditioned), (C) as
required by applicable Laws or any Governmental Entity or (D) as set forth in Section 4.1(a) of the
Company Disclosure Letter, the Company will not, and will not permit its Subsidiaries, to:
(i) adopt any amendments to its charter or by-laws or other applicable governing instruments;
(ii) merge or consolidate the Company or any of its Subsidiaries with any other Person, or
restructure, reorganize or completely or partially liquidate the Company or any of its Subsidiaries,
except for any such transactions solely among wholly-owned Subsidiaries of the Company;
A-26TABLE OF CONTENTS
(iii) acquire assets or capital stock outside of the ordinary course of business from any other
Person with a value or purchase price in the aggregate in excess of $10,000,000 in any transaction
or series of related transactions, other than capital expenditures not otherwise prohibited by
subsection (ix) of this Section 4.1(a);
(iv) issue, sell, pledge, dispose of, grant, transfer, encumber, or authorize the issuance, sale,
pledge, disposition, grant, transfer or encumbrance of, any shares of capital stock of the Company
or any its Subsidiaries (other than (A) the issuance of Shares upon the settlement of Restricted
Stock Units and Performance Stock Units (and dividend equivalents thereon, if applicable)
outstanding on the date of this Agreement in accordance with the terms of such awards, (B) the
issuance of Shares upon the exercise of Stock Options outstanding on the date of this Agreement
in accordance with the terms of such awards, or (C) the issuance of shares of capital stock by a
Subsidiary of the Company to the Company or another Subsidiary of the Company), or securities
convertible or exchangeable into or exercisable for any shares of such capital stock, or any
options, warrants or other rights of any kind to acquire any shares of such capital stock or such
convertible, exchangeable or exercisable securities;
(v) make any loans, advances or capital contributions to or investments in any Person (other than
the Company or any direct or indirect wholly-owned Subsidiary of the Company) in excess of
$5,000,000 in the aggregate other than as would be permitted under Section 4.1(a)(iii);
(vi) declare, set aside, make or pay any dividend or other distribution, payable in cash, stock,
property or otherwise, with respect to any of its capital stock (except for dividends paid by any
direct or indirect wholly-owned Subsidiary of the Company to the Company or to any other direct or
indirect wholly-owned Subsidiary of the Company);
(vii) reclassify, split, combine, subdivide or redeem, purchase or otherwise acquire, directly or
indirectly, any of its capital stock or securities convertible or exchangeable into or exercisable for
any shares of its capital stock (other than, to the extent required by the Stock Plan or any award
outstanding on the date hereof, the acquisition of any Shares tendered by current or former
employees or directors in order to pay Taxes in connection with the settlement of Restricted
Shares, Restricted Stock Units or Performance Stock Units);
(viii) incur any indebtedness for borrowed money or guarantee such indebtedness of another
Person (other than a wholly-owned Subsidiary of the Company), or issue or sell any debt securities
or warrants or other rights to acquire any debt security of the Company or any of its Subsidiaries,
except for the incurrence of indebtedness for borrowed money incurred in the ordinary and usual
course of business pursuant to the Company’s existing credit facilities and that can be repaid
without penalty on or prior to the Closing Date and issuances of letters of credit under the
Company’s revolving credit facility;
(ix) make or authorize capital expenditures in excess of $40,000,000 in the aggregate;
(x) make any material changes with respect to accounting policies or procedures, except as
required by changes in GAAP or any foreign equivalent thereof;
(xi) compromise or settle any Action (including any Action relating to this Agreement or the
transactions contemplated hereby) or any commitment, obligation or liability, in each case other
than compromises or settlements that (A) involve only the payment of money damages (excluding
monetary damages that are fully covered by the insurance policies of the Company and its
Subsidiaries) of less than $2,500,000 in the aggregate, and (B) do not involve injunctive or equitable
relief that would impose any material restrictions, obligations or changes on the business or
operations of the Company or any of its Subsidiaries that, in each case, would be effective after, or
not terminate as a result of, the Closing;
(xii) (A) make, revoke or modify any material election related to Taxes, (B) change or otherwise
alter the fiscal year of any member of the Company Group, any material matter related to Tax
accounting, or any method of Tax accounting, (C) file any material amended Tax Return or any
amendment or other modification to any Tax Return, (D) enter into any closing agreement (as
defined in Section 7121 of the Code), (E) enter into any voluntary disclosure agreement or program
with any Governmental Authority, (F) settle, compromise, concede, or abandon any material Tax
claim or assessment, (G) surrender any right to claim a refund of material Taxes, (H) consent to
any extension or waiver of the limitation period
A-27
TABLE OF CONTENTS
applicable to any, Tax, Tax claim, or Tax assessment, (I) file or join in any material Tax Return
(other than a Tax Return that is prepared in accordance with past practice and custom of the
Company Group), or (J) change the tax residency or tax classification of any member of the
Company Group;
(xiii) except for transactions among the Company and its wholly-owned Subsidiaries or among
the Company’s wholly-owned Subsidiaries, transfer, sell, lease, license, mortgage, pledge,
surrender, encumber, divest, cancel, abandon or allow to lapse or expire or otherwise dispose of
any assets or businesses of the Company or its Subsidiaries, including capital stock of any of its
Subsidiaries, in each case which are material to the Company and its Subsidiaries taken as a
whole, other than equipment, inventory, supplies and other assets in the ordinary course of
business and other than pursuant to Contracts in effect prior to the date of this Agreement that
have been made available to Parent prior to the date of this Agreement;
(xiv) except as required pursuant to any Benefit Plan or Contract as in effect on the date of this
Agreement, or as otherwise required by applicable Laws, (A) grant or provide any severance or
termination payments or severance or termination benefits to any director or officer of the Company
or any of its Subsidiaries or other employee of the Company or any of its Subsidiaries having an
annual base salary of more than $250,000, (B) increase the compensation payable to or benefits
provided to any director or officer or any of its Subsidiaries or other employee of the Company or
any of its Subsidiaries having an annual base salary of more than $250,000, except for immaterial
increases in the ordinary course of business and consistent with past practice, (C) grant any new
equity awards to any director, officer, employee or other service provider of the Company or any of
its Subsidiaries, (D) establish, adopt, terminate or amend any Benefit Plan or any plan, agreement,
policy, trust, fund or other arrangement that would be a Benefit Plan if it were in existence as of the
date of this Agreement, other than (x) annual renewals in the ordinary course of business and
consistent with past practice and consistent with the terms of such previously disclosed to Parent,
(y) the funding and creation of a rabbi trust for the SPX Flow Supplemental Retirement Savings
Plan, or (z) the funding and creation of a rabbi trust for the SPX FLOW Supplemental Retirement
Plan for Top Management, or (E) hire or promote, other than in the ordinary course of business,
any employee or other individual service provider of the Company or any of its Subsidiaries with an
annual base salary of more than $250,000, or terminate the service (other than for cause) of any
employee of the Company or any of its Subsidiaries with an annual base salary of more than
$250,000;
(xv) enter into, amend or modify in any material respect or terminate (except with respect to the
expiration of the stated term or renewal in connection therewith) any Company Material Contract of
a type referred to in clauses (B), (C), (D), (F), (G), (H), (I), (J) or (K) of Section 3.1(q)(i), other than
(x) in the case of clause (H) of Section 3.1(q)(i), amendment or modification in the ordinary course
of business of any such Lease that does not increase the annual rent payable thereunder by more
than 10% on an annualized basis or (y) in the cause of clause (K) of Section 3.1(q)(i), amendment
or modification in the ordinary course of business of any such collective bargaining agreement or
other Contract that does not impose any material additional liability or obligation on the Company
and its Subsidiaries;
(xvi) adopt or implement any stockholder rights agreement, “poison pill” or similar antitakeover
agreement or plan; or
(xvii) agree, authorize or commit to do any of the foregoing.
(b) The Company covenants and agrees as to itself and its Subsidiaries that the Company and its
Subsidiaries shall take such actions (it being understood and agreed that such actions are expressly
permitted notwithstanding anything to the contrary in Section 4.1(a)) as are described on Section 4.1(b)
of the Company Disclosure Letter.
(c) The Parties acknowledge and agree that the restrictions set forth in this Agreement are not
intended to give Parent or Merger Sub, on the one hand, or the Company, on the other hand, directly or
indirectly, the right to control or direct the business or operations of the other at any time prior to the
Effective Time. Prior to the Effective Time, the Company shall exercise, subject to the terms, conditions
and restrictions of this Agreement, complete control and supervision over its business and operations.
A-28
TABLE OF CONTENTS",130,133
